library/src/amd_detail/rocblaslt/src/Tensile/Logic/asm_full/aquavanjaram/gfx942/GridBased/aquavanjaram_Cijk_Ailk_Bljk_HH_F8B8HS_BH_BiasSH_HAS_SAV_UserArgs.yaml
- {MinimumRequiredVersion: 4.33.0}
- aquavanjaram
- gfx942
- [Device 0049, Device 0050]
    SolutionIndex: -1
    SolutionIndex: 0
    SolutionNameMin: Cijk_Ailk_Bljk_HH_F8B8HS_BH_BiasSH_HAS_SAV_UserArgs_MT16x16x32_MI16x16x1_SN_GRVWA1_GRVWB1_GSU1_MIWT1_1_SU32_SUM0_SUS256_WGM8
    SolutionIndex: 1
    SolutionNameMin: Cijk_Ailk_Bljk_HH_F8B8HS_BH_BiasSH_HAS_SAV_UserArgs_MT16x16x32_MI16x16x1_SN_GRVWA1_GRVWB4_GSU1_MIWT1_1_SU32_SUM0_SUS256_WGM8
    SolutionIndex: 2
    SolutionNameMin: Cijk_Ailk_Bljk_HH_F8B8HS_BH_BiasSH_HAS_SAV_UserArgs_MT16x16x32_MI16x16x1_SN_GRVWA8_GRVWB4_GSU1_MIWT1_1_SU32_SUM0_SUS256_WGM8
    SolutionIndex: 3
    SolutionNameMin: Cijk_Ailk_Bljk_HH_F8B8HS_BH_BiasSH_HAS_SAV_UserArgs_MT16x16x32_MI16x16x1_SN_GRVWA1_GRVWB8_GSU1_MIWT1_1_SU32_SUM0_SUS256_WGM8
    SolutionIndex: 4
    SolutionNameMin: Cijk_Ailk_Bljk_HH_F8B8HS_BH_BiasSH_HAS_SAV_UserArgs_MT16x16x32_MI16x16x1_SN_GRVWA4_GRVWB8_GSU1_MIWT1_1_SU32_SUM0_SUS256_WGM8
    SolutionIndex: 5
    SolutionNameMin: Cijk_Ailk_Bljk_HH_F8B8HS_BH_BiasSH_HAS_SAV_UserArgs_MT16x16x32_MI16x16x1_SN_GRVWA8_GRVWB8_GSU1_MIWT1_1_SU32_SUM0_SUS256_WGM8
- - - [128, 128, 1, 128, 128, 128, 128, 128]
    - [5, 19.0975]
  - - [127, 127, 1, 127, 127, 127, 127, 127]
    - [4, 205.187]
  - - [129, 129, 1, 129, 129, 129, 129, 129]
    - [1, 19.6995]
  - - [16, 16, 1, 16, 16, 16, 16, 16]
    - [3, 0.85852]
  - - [256, 128, 1, 64, 256, 256, 256, 64]
    - [0, 145.706]
  - - [64, 64, 1, 64, 64, 64, 64, 64]
    - [0, 2.43929]
  - - [65, 65, 1, 65, 65, 65, 65, 65]
    - [2, 34.8575]
  - - [1, 1024, 1, 512, 1, 1, 1, 512]
    - [1, 4.81391]
  - - [1, 1, 1, 512, 1, 1, 1, 512]
    - [0, 0.00475536]
  - - [1024, 1, 1, 512, 1024, 1024, 1024, 512]
    - [5, 34.4123]
  - - [1, 1, 1, 1, 1, 1, 1, 1]
    - [0, 0.000194856]
- 
- 
- DeviceEfficiency
- GridBased
