library/src/amd_detail/rocblaslt/src/Tensile/Logic/asm_full/aldebaran/104CU/Equality/aldebaran_Cijk_Alik_Bljk_HHS_BH_Bias_HAH_SAV.yaml
- {MinimumRequiredVersion: 4.33.0}
- aldebaran
- {Architecture: gfx90a, CUCount: 104}
- [Device 0050, Device 0051, Device 0052, Device 0054, Device 0062, Device 7400, Device
    SolutionIndex: -1
    SolutionIndex: 0
    SolutionNameMin: Cijk_Alik_Bljk_HHS_BBiasH_HAH_SAV_MT32x64x32_MI16x16x16x1_SN_1LDSB0_AFC0_GRVW4_GSU2_LPA4_LPB4_LRVW4_MIWT2_1_PLR3_WG16_16_1
    SolutionIndex: 1
    SolutionNameMin: Cijk_Alik_Bljk_HHS_BBiasH_HAH_SAV_MT160x128x32_MI32x32x8x1_SN_1LDSB0_AFC1_GRVW2_GSU1_LPA4_LPB4_LRVW4_MIWT5_1_PLR5_WG32_8_1
    SolutionIndex: 2
    SolutionNameMin: Cijk_Alik_Bljk_HHS_BBiasH_HAH_SAV_MT160x256x32_MI32x32x8x1_SN_1LDSB0_AFC1_GRVW4_GSU1_LPA4_LPB4_LRVW4_MIWT5_2_PLR5_WG32_8_1
    SolutionIndex: 3
    SolutionNameMin: Cijk_Alik_Bljk_HHS_BBiasH_HAH_SAV_MT128x128x32_MI32x32x8x1_SN_1LDSB1_AFC1_GRVW2_GSU1_LPA4_LPB4_LRVW4_MIWT2_2_PLR5_WG64_4_1
    SolutionIndex: 4
    SolutionNameMin: Cijk_Alik_Bljk_HHS_BBiasH_HAH_SAV_MT128x160x32_MI32x32x8x1_SN_1LDSB1_AFC1_GRVW4_GSU1_LPA4_LPB4_LRVW4_MIWT1_5_PLR5_WG128_2_1
    SolutionIndex: 5
    SolutionNameMin: Cijk_Alik_Bljk_HHS_BBiasH_HAH_SAV_MT128x160x32_MI32x32x8x1_SN_1LDSB1_AFC1_GRVW2_GSU1_LPA8_LPB8_LRVW8_MIWT1_5_PLR5_WG128_2_1
    SolutionIndex: 6
    SolutionNameMin: Cijk_Alik_Bljk_HHS_BBiasH_HAH_SAV_MT96x192x32_MI16x16x16x1_SN_1LDSB1_AFC1_GRVW4_GSU1_LPA4_LPB4_LRVW4_MIWT6_3_PLR3_WG16_16_1
    SolutionIndex: 7
    SolutionNameMin: Cijk_Alik_Bljk_HHS_BBiasH_HAH_SAV_MT160x256x32_MI32x32x8x1_SN_1LDSB1_AFC1_GRVW4_GSU1_LPA8_LPB8_LRVW8_MIWT5_2_PLR5_WG32_8_1
    SolutionIndex: 8
    SolutionNameMin: Cijk_Alik_Bljk_HHS_BBiasH_HAH_SAV_MT64x16x64_MI16x16x16x1_SN_1LDSB0_AFC1_GRVW4_GSU1_LPA16_LPB16_LRVW8_MIWT1_1_PLR5_WG64_4_1
    SolutionIndex: 9
    SolutionNameMin: Cijk_Alik_Bljk_HHS_BBiasH_HAH_SAV_MT64x16x64_MI16x16x16x1_SN_1LDSB0_AFC0_GRVW4_GSU2_LPA4_LPB4_LRVW4_MIWT1_1_PLR5_WG64_4_1
    SolutionIndex: 10
    SolutionNameMin: Cijk_Alik_Bljk_HHS_BBiasH_HAH_SAV_MT64x16x64_MI16x16x16x1_SN_1LDSB0_AFC0_GRVW2_GSU2_LPA16_LPB16_LRVW8_MIWT1_1_PLR5_WG64_4_1
    SolutionIndex: 11
    SolutionNameMin: Cijk_Alik_Bljk_HHS_BBiasH_HAH_SAV_MT64x16x64_MI16x16x16x1_SN_1LDSB0_AFC0_GRVW4_GSU2_LPA16_LPB16_LRVW8_MIWT1_1_PLR5_WG64_4_1
    SolutionIndex: 12
    SolutionNameMin: Cijk_Alik_Bljk_HHS_BBiasH_HAH_SAV_MT32x32x64_MI16x16x16x1_SN_1LDSB0_AFC1_GRVW2_GSU1_LPA4_LPB4_LRVW4_MIWT1_1_PLR5_WG32_8_1
    SolutionIndex: 13
    SolutionNameMin: Cijk_Alik_Bljk_HHS_BBiasH_HAH_SAV_MT32x32x64_MI16x16x16x1_SN_1LDSB0_AFC1_GRVW4_GSU1_LPA4_LPB4_LRVW4_MIWT1_1_PLR5_WG32_8_1
    SolutionIndex: 14
    SolutionNameMin: Cijk_Alik_Bljk_HHS_BBiasH_HAH_SAV_MT32x32x64_MI16x16x16x1_SN_1LDSB0_AFC1_GRVW4_GSU1_LPA16_LPB16_LRVW8_MIWT1_1_PLR5_WG32_8_1
    SolutionIndex: 15
    SolutionNameMin: Cijk_Alik_Bljk_HHS_BBiasH_HAH_SAV_MT32x32x64_MI16x16x16x1_SN_1LDSB0_AFC0_GRVW2_GSU2_LPA4_LPB4_LRVW4_MIWT1_1_PLR5_WG32_8_1
    SolutionIndex: 16
    SolutionNameMin: Cijk_Alik_Bljk_HHS_BBiasH_HAH_SAV_MT64x32x64_MI16x16x16x1_SN_1LDSB0_AFC1_GRVW8_GSU1_LPA16_LPB16_LRVW8_MIWT2_1_PLR5_WG32_8_1
    SolutionIndex: 17
    SolutionNameMin: Cijk_Alik_Bljk_HHS_BBiasH_HAH_SAV_MT128x32x64_MI32x32x8x1_SN_1LDSB0_AFC0_GRVW8_GSU2_LPA8_LPB8_LRVW8_MIWT1_1_PLR9_WG128_2_1
    SolutionIndex: 18
    SolutionNameMin: Cijk_Alik_Bljk_HHS_BBiasH_HAH_SAV_MT64x48x64_MI16x16x16x1_SN_1LDSB0_AFC0_GRVW2_GSU2_LPA4_LPB4_LRVW4_MIWT1_3_PLR5_WG64_4_1
    SolutionIndex: 19
    SolutionNameMin: Cijk_Alik_Bljk_HHS_BBiasH_HAH_SAV_MT16x64x64_MI16x16x16x1_SN_1LDSB0_AFC1_GRVW2_GSU1_LPA16_LPB16_LRVW8_MIWT1_1_PLR5_WG16_16_1
    SolutionIndex: 20
    SolutionNameMin: Cijk_Alik_Bljk_HHS_BBiasH_HAH_SAV_MT32x64x64_MI16x16x16x1_SN_1LDSB0_AFC1_GRVW8_GSU1_LPA8_LPB8_LRVW4_MIWT2_1_PLR5_WG16_16_1
    SolutionIndex: 21
    SolutionNameMin: Cijk_Alik_Bljk_HHS_BBiasH_HAH_SAV_MT32x64x64_MI16x16x16x1_SN_1LDSB0_AFC1_GRVW4_GSU1_LPA16_LPB16_LRVW8_MIWT2_1_PLR5_WG16_16_1
    SolutionIndex: 22
    SolutionNameMin: Cijk_Alik_Bljk_HHS_BBiasH_HAH_SAV_MT32x64x64_MI16x16x16x1_SN_1LDSB0_AFC1_GRVW8_GSU1_LPA16_LPB16_LRVW8_MIWT2_1_PLR5_WG16_16_1
    SolutionIndex: 23
    SolutionNameMin: Cijk_Alik_Bljk_HHS_BBiasH_HAH_SAV_MT48x64x64_MI16x16x16x1_SN_1LDSB0_AFC1_GRVW4_GSU1_LPA4_LPB4_LRVW4_MIWT3_1_PLR5_WG16_16_1
    SolutionIndex: 24
    SolutionNameMin: Cijk_Alik_Bljk_HHS_BBiasH_HAH_SAV_MT64x64x64_MI32x32x8x1_SN_1LDSB0_AFC1_GRVW8_GSU1_LPA8_LPB8_LRVW8_MIWT1_1_PLR9_WG64_4_1
    SolutionIndex: 25
    SolutionNameMin: Cijk_Alik_Bljk_HHS_BBiasH_HAH_SAV_MT64x64x64_MI32x32x8x1_SN_1LDSB0_AFC0_GRVW8_GSU2_LPA8_LPB8_LRVW8_MIWT1_1_PLR9_WG64_4_1
    SolutionIndex: 26
    SolutionNameMin: Cijk_Alik_Bljk_HHS_BBiasH_HAH_SAV_MT80x64x64_MI16x16x16x1_SN_1LDSB0_AFC1_GRVW4_GSU1_LPA4_LPB4_LRVW4_MIWT5_1_PLR5_WG16_16_1
    SolutionIndex: 27
    SolutionNameMin: Cijk_Alik_Bljk_HHS_BBiasH_HAH_SAV_MT80x64x64_MI16x16x16x1_SN_1LDSB0_AFC1_GRVW4_GSU1_LPA16_LPB16_LRVW8_MIWT5_1_PLR5_WG16_16_1
    SolutionIndex: 28
    SolutionNameMin: Cijk_Alik_Bljk_HHS_BBiasH_HAH_SAV_MT96x64x64_MI16x16x16x1_SN_1LDSB0_AFC1_GRVW8_GSU1_LPA16_LPB16_LRVW8_MIWT6_1_PLR5_WG16_16_1
    SolutionIndex: 29
    SolutionNameMin: Cijk_Alik_Bljk_HHS_BBiasH_HAH_SAV_MT96x64x64_MI16x16x16x1_SN_1LDSB0_AFC0_GRVW8_GSU2_LPA16_LPB16_LRVW8_MIWT6_1_PLR5_WG16_16_1
    SolutionIndex: 30
    SolutionNameMin: Cijk_Alik_Bljk_HHS_BBiasH_HAH_SAV_MT64x80x64_MI16x16x16x1_SN_1LDSB0_AFC0_GRVW4_GSU2_LPA4_LPB4_LRVW4_MIWT1_5_PLR5_WG64_4_1
    SolutionIndex: 31
    SolutionNameMin: Cijk_Alik_Bljk_HHS_BBiasH_HAH_SAV_MT128x80x64_MI16x16x16x1_SN_1LDSB0_AFC1_GRVW4_GSU1_LPA4_LPB4_LRVW4_MIWT2_5_PLR5_WG64_4_1
    SolutionIndex: 32
    SolutionNameMin: Cijk_Alik_Bljk_HHS_BBiasH_HAH_SAV_MT32x96x64_MI16x16x16x1_SN_1LDSB0_AFC1_GRVW4_GSU1_LPA4_LPB4_LRVW4_MIWT1_3_PLR5_WG32_8_1
    SolutionIndex: 33
    SolutionNameMin: Cijk_Alik_Bljk_HHS_BBiasH_HAH_SAV_MT64x96x64_MI16x16x16x1_SN_1LDSB0_AFC1_GRVW8_GSU1_LPA16_LPB16_LRVW8_MIWT2_3_PLR5_WG32_8_1
    SolutionIndex: 34
    SolutionNameMin: Cijk_Alik_Bljk_HHS_BBiasH_HAH_SAV_MT64x128x64_MI32x32x8x1_SN_1LDSB0_AFC1_GRVW8_GSU1_LPA8_LPB8_LRVW8_MIWT2_1_PLR9_WG32_8_1
    SolutionIndex: 35
    SolutionNameMin: Cijk_Alik_Bljk_HHS_BBiasH_HAH_SAV_MT80x128x64_MI16x16x16x1_SN_1LDSB0_AFC1_GRVW4_GSU1_LPA4_LPB4_LRVW4_MIWT5_2_PLR5_WG16_16_1
    SolutionIndex: 36
    SolutionNameMin: Cijk_Alik_Bljk_HHS_BBiasH_HAH_SAV_MT96x128x64_MI32x32x8x1_SN_1LDSB0_AFC1_GRVW8_GSU1_LPA8_LPB8_LRVW8_MIWT3_1_PLR9_WG32_8_1
    SolutionIndex: 37
    SolutionNameMin: Cijk_Alik_Bljk_HHS_BBiasH_HAH_SAV_MT64x32x64_MI16x16x16x1_SN_1LDSB1_AFC1_GRVW2_GSU1_LPA16_LPB16_LRVW8_MIWT2_1_PLR5_WG32_8_1
    SolutionIndex: 38
    SolutionNameMin: Cijk_Alik_Bljk_HHS_BBiasH_HAH_SAV_MT32x64x64_MI16x16x16x1_SN_1LDSB1_AFC1_GRVW8_GSU1_LPA16_LPB16_LRVW8_MIWT2_1_PLR5_WG16_16_1
    SolutionIndex: 39
    SolutionNameMin: Cijk_Alik_Bljk_HHS_BBiasH_HAH_SAV_MT64x64x64_MI32x32x8x1_SN_1LDSB1_AFC1_GRVW8_GSU1_LPA8_LPB8_LRVW4_MIWT1_1_PLR9_WG64_4_1
    SolutionIndex: 40
    SolutionNameMin: Cijk_Alik_Bljk_HHS_BBiasH_HAH_SAV_MT64x64x64_MI32x32x8x1_SN_1LDSB1_AFC1_GRVW8_GSU1_LPA8_LPB8_LRVW8_MIWT1_1_PLR9_WG64_4_1
    SolutionIndex: 41
    SolutionNameMin: Cijk_Alik_Bljk_HHS_BBiasH_HAH_SAV_MT96x64x64_MI16x16x16x1_SN_1LDSB1_AFC1_GRVW8_GSU1_LPA16_LPB16_LRVW8_MIWT6_1_PLR5_WG16_16_1
    SolutionIndex: 42
    SolutionNameMin: Cijk_Alik_Bljk_HHS_BBiasH_HAH_SAV_MT128x64x64_MI32x32x8x1_SN_1LDSB1_AFC1_GRVW8_GSU1_LPA8_LPB8_LRVW8_MIWT2_1_PLR9_WG64_4_1
    SolutionIndex: 43
    SolutionNameMin: Cijk_Alik_Bljk_HHS_BBiasH_HAH_SAV_MT160x64x64_MI16x16x16x1_SN_1LDSB1_AFC1_GRVW8_GSU1_LPA16_LPB16_LRVW8_MIWT10_1_PLR5_WG16_16_1
    SolutionIndex: 44
    SolutionNameMin: Cijk_Alik_Bljk_HHS_BBiasH_HAH_SAV_MT256x80x64_MI16x16x16x1_SN_1LDSB1_AFC1_GRVW2_GSU1_LPA4_LPB4_LRVW4_MIWT4_5_PLR5_WG64_4_1
    SolutionIndex: 45
    SolutionNameMin: Cijk_Alik_Bljk_HHS_BBiasH_HAH_SAV_MT128x96x64_MI32x32x8x1_SN_1LDSB1_AFC1_GRVW8_GSU1_LPA8_LPB8_LRVW8_MIWT1_3_PLR9_WG128_2_1
    SolutionIndex: 46
    SolutionNameMin: Cijk_Alik_Bljk_HHS_BBiasH_HAH_SAV_MT64x128x64_MI32x32x8x1_SN_1LDSB1_AFC1_GRVW8_GSU1_LPA8_LPB8_LRVW8_MIWT2_1_PLR9_WG32_8_1
    SolutionIndex: 47
    SolutionNameMin: Cijk_Alik_Bljk_HHS_BBiasH_HAH_SAV_MT80x128x64_MI16x16x16x1_SN_1LDSB1_AFC1_GRVW4_GSU1_LPA4_LPB4_LRVW4_MIWT5_2_PLR5_WG16_16_1
    SolutionIndex: 48
    SolutionNameMin: Cijk_Alik_Bljk_HHS_BBiasH_HAH_SAV_MT96x128x64_MI32x32x8x1_SN_1LDSB1_AFC1_GRVW8_GSU1_LPA8_LPB8_LRVW8_MIWT3_1_PLR9_WG32_8_1
    SolutionIndex: 49
    SolutionNameMin: Cijk_Alik_Bljk_HHS_BBiasH_HAH_SAV_MT96x128x64_MI32x32x8x1_SN_1LDSB1_AFC0_GRVW8_GSU2_LPA8_LPB8_LRVW8_MIWT3_1_PLR9_WG32_8_1
    SolutionIndex: 50
    SolutionNameMin: Cijk_Alik_Bljk_HHS_BBiasH_HAH_SAV_MT128x128x64_MI32x32x8x1_SN_1LDSB1_AFC1_GRVW8_GSU1_LPA8_LPB8_LRVW8_MIWT2_2_PLR9_WG64_4_1
    SolutionIndex: 51
    SolutionNameMin: Cijk_Alik_Bljk_HHS_BBiasH_HAH_SAV_MT160x128x64_MI32x32x8x1_SN_1LDSB1_AFC1_GRVW8_GSU1_LPA8_LPB8_LRVW8_MIWT5_1_PLR9_WG32_8_1
    SolutionIndex: 52
    SolutionNameMin: Cijk_Alik_Bljk_HHS_BBiasH_HAH_SAV_MT160x128x64_MI32x32x8x1_SN_1LDSB1_AFC0_GRVW8_GSU2_LPA8_LPB8_LRVW8_MIWT5_1_PLR9_WG32_8_1
    SolutionIndex: 53
    SolutionNameMin: Cijk_Alik_Bljk_HHS_BBiasH_HAH_SAV_MT176x128x64_MI16x16x16x1_SN_1LDSB1_AFC1_GRVW4_GSU1_LPA4_LPB4_LRVW4_MIWT11_2_PLR5_WG16_16_1
    SolutionIndex: 54
    SolutionNameMin: Cijk_Alik_Bljk_HHS_BBiasH_HAH_SAV_MT176x128x64_MI16x16x16x1_SN_1LDSB1_AFC0_GRVW4_GSU2_LPA4_LPB4_LRVW4_MIWT11_2_PLR5_WG16_16_1
    SolutionIndex: 55
    SolutionNameMin: Cijk_Alik_Bljk_HHS_BBiasH_HAH_SAV_MT256x128x64_MI32x32x8x1_SN_1LDSB1_AFC1_GRVW8_GSU1_LPA8_LPB8_LRVW8_MIWT4_2_PLR9_WG64_4_1
    SolutionIndex: 56
    SolutionNameMin: Cijk_Alik_Bljk_HHS_BBiasH_HAH_SAV_MT128x160x64_MI32x32x8x1_SN_1LDSB1_AFC1_GRVW8_GSU1_LPA8_LPB8_LRVW8_MIWT1_5_PLR9_WG128_2_1
    SolutionIndex: 57
    SolutionNameMin: Cijk_Alik_Bljk_HHS_BBiasH_HAH_SAV_MT256x160x64_MI32x32x8x1_SN_1LDSB1_AFC1_GRVW8_GSU1_LPA8_LPB8_LRVW8_MIWT2_5_PLR9_WG128_2_1
- - - [256, 1024, 1, 7616, 256, 256, 7616, 7616]
    - [30, 47445.1]
  - - [7616, 1024, 1, 256, 7616, 7616, 256, 256]
    - [40, 45519.6]
  - - [256, 512, 1, 7616, 256, 256, 7616, 7616]
    - [25, 27729.0]
  - - [7616, 512, 1, 256, 7616, 7616, 256, 256]
    - [40, 33959.7]
  - - [256, 1024, 1, 2400, 256, 256, 2400, 2400]
    - [23, 22278.5]
  - - [256, 1024, 1, 256, 256, 256, 256, 256]
    - [16, 4154.06]
  - - [9630, 1024, 1, 256, 9630, 9630, 256, 256]
    - [45, 46992.7]
  - - [2400, 1024, 1, 256, 2400, 2400, 256, 256]
    - [48, 27906.2]
  - - [256, 1024, 1, 4800, 256, 256, 4800, 4800]
    - [29, 36456.4]
  - - [12840, 1024, 1, 256, 12840, 12840, 256, 256]
    - [4, 51537.7]
  - - [3200, 1024, 1, 256, 3200, 3200, 256, 256]
    - [46, 32357.2]
  - - [256, 512, 1, 2400, 256, 256, 2400, 2400]
    - [0, 11841.6]
  - - [256, 512, 1, 256, 256, 256, 256, 256]
    - [14, 2189.52]
  - - [9630, 512, 1, 256, 9630, 9630, 256, 256]
    - [3, 36296.3]
  - - [2400, 512, 1, 256, 2400, 2400, 256, 256]
    - [41, 16617.7]
  - - [256, 512, 1, 4800, 256, 256, 4800, 4800]
    - [17, 21594.2]
  - - [12840, 512, 1, 256, 12840, 12840, 256, 256]
    - [40, 41037.9]
  - - [3200, 512, 1, 256, 3200, 3200, 256, 256]
    - [39, 20738.2]
  - - [2048, 1024, 1, 1024, 2048, 2048, 1024, 1024]
    - [40, 60809.4]
  - - [2048, 512, 1, 1024, 2048, 2048, 1024, 1024]
    - [43, 40313.2]
  - - [2048, 1024, 1, 7616, 2048, 2048, 7616, 7616]
    - [44, 122465.0]
  - - [2048, 512, 1, 7616, 2048, 2048, 7616, 7616]
    - [35, 104734.0]
  - - [1024, 1024, 1, 2048, 1024, 1024, 2048, 2048]
    - [35, 60322.6]
  - - [1024, 512, 1, 2048, 1024, 1024, 2048, 2048]
    - [33, 39173.4]
  - - [1024, 1024, 1, 1024, 1024, 1024, 1024, 1024]
    - [31, 41021.7]
  - - [1024, 256, 1, 1024, 1024, 1024, 1024, 1024]
    - [32, 13523.2]
  - - [1024, 512, 1, 1024, 1024, 1024, 1024, 1024]
    - [26, 24238.0]
  - - [4000, 1024, 1, 11190, 4000, 4000, 11190, 11190]
    - [7, 132062.0]
  - - [4000, 256, 1, 11190, 4000, 4000, 11190, 11190]
    - [52, 95647.0]
  - - [4000, 512, 1, 11190, 4000, 4000, 11190, 11190]
    - [51, 119615.0]
  - - [2200, 1024, 1, 2200, 2200, 2200, 2200, 2200]
    - [53, 79996.1]
  - - [2200, 256, 1, 2200, 2200, 2200, 2200, 2200]
    - [28, 35270.1]
  - - [2200, 512, 1, 2200, 2200, 2200, 2200, 2200]
    - [48, 55680.3]
  - - [2200, 1024, 1, 22374, 2200, 2200, 22374, 22374]
    - [53, 127341.0]
  - - [2200, 256, 1, 22374, 2200, 2200, 22374, 22374]
    - [49, 93403.3]
  - - [2200, 512, 1, 22374, 2200, 2200, 22374, 22374]
    - [54, 113892.0]
  - - [4000, 1024, 1, 4000, 4000, 4000, 4000, 4000]
    - [2, 118155.0]
  - - [4000, 256, 1, 4000, 4000, 4000, 4000, 4000]
    - [47, 74162.6]
  - - [4000, 512, 1, 4000, 4000, 4000, 4000, 4000]
    - [1, 102457.0]
  - - [3465, 1024, 1, 128, 3465, 3465, 128, 128]
    - [40, 20104.7]
  - - [3465, 512, 1, 128, 3465, 3465, 128, 128]
    - [37, 10938.5]
  - - [9375, 1024, 1, 128, 9375, 9375, 128, 128]
    - [5, 28868.8]
  - - [9375, 512, 1, 128, 9375, 9375, 128, 128]
    - [6, 21806.6]
  - - [128, 1024, 1, 1677, 128, 128, 1677, 1677]
    - [21, 9202.95]
  - - [128, 512, 1, 1677, 128, 128, 1677, 1677]
    - [14, 4776.35]
  - - [2048, 1024, 1, 3465, 2048, 2048, 3465, 3465]
    - [51, 89529.1]
  - - [2048, 512, 1, 3465, 2048, 2048, 3465, 3465]
    - [36, 63820.8]
  - - [2048, 1024, 1, 9375, 2048, 2048, 9375, 9375]
    - [51, 115931.0]
  - - [2048, 512, 1, 9375, 2048, 2048, 9375, 9375]
    - [52, 91009.6]
  - - [1024, 1, 1, 1024, 1024, 1024, 1024, 1024]
    - [19, 56.2239]
  - - [1024, 128, 1, 1024, 1024, 1024, 1024, 1024]
    - [21, 6816.54]
  - - [1024, 16384, 1, 1024, 1024, 1024, 1024, 1024]
    - [42, 107562.0]
  - - [1024, 2048, 1, 1024, 1024, 1024, 1024, 1024]
    - [56, 60492.5]
  - - [1024, 32, 1, 1024, 1024, 1024, 1024, 1024]
    - [13, 1783.39]
  - - [1024, 4096, 1, 1024, 1024, 1024, 1024, 1024]
    - [42, 82715.6]
  - - [1024, 64, 1, 1024, 1024, 1024, 1024, 1024]
    - [8, 3654.17]
  - - [1024, 8192, 1, 1024, 1024, 1024, 1024, 1024]
    - [42, 98508.4]
  - - [2, 1, 1, 1024, 2, 2, 1024, 1024]
    - [10, 0.104144]
  - - [2, 32, 1, 1024, 2, 2, 1024, 1024]
    - [9, 3.3166]
  - - [2, 64, 1, 1024, 2, 2, 1024, 1024]
    - [11, 6.72854]
  - - [3072, 128, 1, 1024, 3072, 3072, 1024, 1024]
    - [39, 19456.5]
  - - [3072, 256, 1, 1024, 3072, 3072, 1024, 1024]
    - [34, 32715.4]
  - - [3072, 32, 1, 1024, 3072, 3072, 1024, 1024]
    - [12, 5086.57]
  - - [3072, 64, 1, 1024, 3072, 3072, 1024, 1024]
    - [20, 9505.5]
  - - [4096, 1024, 1, 1024, 4096, 4096, 1024, 1024]
    - [46, 84621.6]
  - - [4096, 128, 1, 1024, 4096, 4096, 1024, 1024]
    - [27, 23474.9]
  - - [4096, 16384, 1, 1024, 4096, 4096, 1024, 1024]
    - [48, 120373.0]
  - - [4096, 2048, 1, 1024, 4096, 4096, 1024, 1024]
    - [46, 100274.0]
  - - [4096, 256, 1, 1024, 4096, 4096, 1024, 1024]
    - [43, 40718.3]
  - - [4096, 32, 1, 1024, 4096, 4096, 1024, 1024]
    - [22, 6362.54]
  - - [4096, 4096, 1, 1024, 4096, 4096, 1024, 1024]
    - [46, 111558.0]
  - - [4096, 64, 1, 1024, 4096, 4096, 1024, 1024]
    - [38, 12048.3]
  - - [4096, 8192, 1, 1024, 4096, 4096, 1024, 1024]
    - [46, 117860.0]
  - - [1024, 1024, 1, 4096, 1024, 1024, 4096, 4096]
    - [35, 76743.8]
  - - [1024, 128, 1, 4096, 1024, 1024, 4096, 4096]
    - [18, 18180.2]
  - - [1024, 16384, 1, 4096, 1024, 1024, 4096, 4096]
    - [55, 128212.0]
  - - [1024, 2048, 1, 4096, 1024, 1024, 4096, 4096]
    - [56, 105651.0]
  - - [1024, 256, 1, 4096, 1024, 1024, 4096, 4096]
    - [24, 31123.0]
  - - [1024, 32, 1, 4096, 1024, 1024, 4096, 4096]
    - [15, 4946.2]
  - - [1024, 4096, 1, 4096, 1024, 1024, 4096, 4096]
    - [57, 118363.0]
  - - [1024, 64, 1, 4096, 1024, 1024, 4096, 4096]
    - [12, 9384.21]
  - - [1024, 8192, 1, 4096, 1024, 1024, 4096, 4096]
    - [50, 124386.0]
- 
- 
- DeviceEfficiency
- Equality
