library/src/amd_detail/rocblaslt/src/Tensile/Logic/asm_full/navi32/Equality/navi32_Cijk_Alik_Bljk_HHS_BH_UserArgs.yaml
- {MinimumRequiredVersion: 4.33.0}
- navi32
- gfx1101
- [Device 73f0]
    SolutionIndex: -1
    SolutionIndex: 0
    SolutionNameMin: Cijk_Alik_Bljk_HHS_BH_UserArgs_MT32x32x32_MI16x16x1_SN_LDSB0_GRVWA8_GRVWB8_GSU1_LBSPPA128_LBSPPB128_MIWT1_1_SS0_SU32_SUM0_SUS256_TLDS1_WG32_4_1_WGM8
    SolutionIndex: 1
    SolutionNameMin: Cijk_Alik_Bljk_HHS_BH_UserArgs_MT32x32x32_MI16x16x1_SN_LDSB0_GRVWA8_GRVWB8_GSU1_LBSPPA128_LBSPPB128_MIWT1_1_SS1_SU32_SUM0_SUS256_TLDS1_WG32_4_1_WGM8
    SolutionIndex: 2
    SolutionNameMin: Cijk_Alik_Bljk_HHS_BH_UserArgs_MT96x32x32_MI16x16x1_SN_LDSB0_GRVWA8_GRVWB8_GSU1_LBSPPA128_LBSPPB128_MIWT3_1_SS1_SU32_SUM0_SUS256_TLDS1_WG32_4_1_WGM8
    SolutionIndex: 3
    SolutionNameMin: Cijk_Alik_Bljk_HHS_BH_UserArgs_MT224x32x32_MI16x16x1_SN_LDSB1_GRVWA8_GRVWB8_GSU1_LBSPPA128_LBSPPB128_MIWT7_1_SS1_SU32_SUM0_SUS256_TLDS1_WG32_4_1_WGM8
    SolutionIndex: 4
    SolutionNameMin: Cijk_Alik_Bljk_HHS_BH_UserArgs_MT32x96x32_MI16x16x1_SN_LDSB0_GRVWA8_GRVWB8_GSU1_LBSPPA128_LBSPPB128_MIWT1_3_SS1_SU32_SUM0_SUS256_TLDS1_WG32_4_1_WGM8
    SolutionIndex: 5
    SolutionNameMin: Cijk_Alik_Bljk_HHS_BH_UserArgs_MT96x96x32_MI16x16x1_SN_LDSB0_GRVWA8_GRVWB8_GSU1_LBSPPA128_LBSPPB128_MIWT3_3_SS1_SU32_SUM0_SUS256_TLDS1_WG32_4_1_WGM8
- - - [1, 1, 1, 64, 1, 1, 64, 64]
    - [0, 0.0249328]
  - - [1024, 1024, 1, 64, 1024, 1024, 64, 64]
    - [5, 9176.63]
  - - [128, 128, 1, 64, 128, 128, 64, 64]
    - [1, 419.774]
  - - [256, 256, 1, 64, 256, 256, 64, 64]
    - [1, 1466.58]
  - - [384, 384, 1, 64, 384, 384, 64, 64]
    - [2, 3016.51]
  - - [4096, 4096, 1, 64, 4096, 4096, 64, 64]
    - [3, 16938.6]
  - - [64, 1024, 1, 64, 64, 64, 64, 64]
    - [1, 1461.76]
  - - [64, 256, 1, 64, 64, 64, 64, 64]
    - [1, 420.085]
  - - [64, 4096, 1, 64, 64, 64, 64, 64]
    - [4, 4492.77]
  - - [64, 64, 1, 64, 64, 64, 64, 64]
    - [1, 104.883]
- 
- 
- DeviceEfficiency
- Equality
