library/src/amd_detail/rocblaslt/src/Tensile/Logic/asm_full/aquavanjaram/gfx942_80cu/Equality/aquavanjaram_Cijk_Ailk_Bljk_HHS_BH_UserArgs.yaml
- {MinimumRequiredVersion: 4.33.0}
- aquavanjaram
- {Architecture: gfx942, CUCount: 80}
- [Device 0049]
    SolutionIndex: -1
    SolutionIndex: 0
    SolutionNameMin: Cijk_Ailk_Bljk_HHS_BH_MT32x16x64_MI16x16x16x1_SN_GRVW8_GSU6_MIWT1_1_SU0_SUS0_SRVW0_SVW4_VW8_WG32_4_1_WGM1
    SolutionIndex: 1
    SolutionNameMin: Cijk_Ailk_Bljk_HHS_BH_MT64x16x64_MI16x16x16x1_SN_GRVW2_GSU6_MIWT1_1_SU0_SUS0_SRVW0_SVW4_VW2_WG64_4_1_WGM1
    SolutionIndex: 2
    SolutionNameMin: Cijk_Ailk_Bljk_HHS_BH_MT64x16x64_MI16x16x16x1_SN_GRVW8_GSU1_LPB16_LRVW8_MIWT1_1_PLR5_SU0_SUS0_SVW4_VW2_WG64_4_1_WGM1
    SolutionIndex: 3
    SolutionNameMin: Cijk_Ailk_Bljk_HHS_BH_MT64x16x64_MI16x16x16x1_SN_GRVW4_GSU1_LPB16_LRVW8_MIWT1_1_PLR5_SU0_SUS0_SVW4_VW8_WG64_4_1_WGM1
    SolutionIndex: 4
    SolutionNameMin: Cijk_Ailk_Bljk_HHS_BH_MT32x16x64_MI16x16x16x1_SN_GRVW8_GSU12_LPB16_LRVW8_MIWT1_1_PLR5_SU0_SUS0_SVW2_VW8_WG32_4_1_WGM8
    SolutionIndex: 5
    SolutionNameMin: Cijk_Ailk_Bljk_HHS_BH_MT16x16x64_MI16x16x16x1_SN_GRVW8_GSU12_LPB16_LRVW8_MIWT1_1_PLR5_SU0_SUS0_SVW4_VW8_WG16_4_1_WGM1
    SolutionIndex: 6
    SolutionNameMin: Cijk_Ailk_Bljk_HHS_BH_MT16x32x64_MI16x16x16x1_SN_GRVW2_GSU7_LPB4_LRVW4_MIWT1_1_PLR5_SU32_SUS128_SVW4_VW2_WG16_8_1_WGM1
    SolutionIndex: 7
    SolutionNameMin: Cijk_Ailk_Bljk_HHS_BH_MT16x32x64_MI16x16x16x1_SN_GRVW2_GSU7_LPB4_LRVW4_MIWT1_1_PLR5_SU0_SUS0_SVW2_VW2_WG16_8_1_WGM1
    SolutionIndex: 8
    SolutionNameMin: Cijk_Ailk_Bljk_HHS_BH_MT64x16x64_MI16x16x16x1_SN_GRVW8_GSU9_LPB16_LRVW8_MIWT1_1_PLR5_SU0_SUS0_SVW4_VW4_WG64_4_1_WGM8
    SolutionIndex: 9
    SolutionNameMin: Cijk_Ailk_Bljk_HHS_BH_MT64x16x64_MI16x16x16x1_SN_GRVW2_GSU9_MIWT1_1_SU0_SUS0_SRVW0_SVW4_VW4_WG64_4_1_WGM15
    SolutionIndex: 10
    SolutionNameMin: Cijk_Ailk_Bljk_HHS_BH_MT64x16x64_MI16x16x16x1_SN_GRVW2_GSU1_LPB16_LRVW8_MIWT1_1_PLR5_SU0_SUS0_SVW4_VW2_WG64_4_1_WGM1
    SolutionIndex: 11
    SolutionNameMin: Cijk_Ailk_Bljk_HHS_BH_MT64x16x64_MI16x16x16x1_SN_GRVW8_GSU9_MIWT2_1_NEPBS0_SPO1_VW2_WGM1
    SolutionIndex: 12
    SolutionNameMin: Cijk_Ailk_Bljk_HHS_BH_MT64x16x64_MI16x16x16x1_SN_GRVW8_GSU9_MIWT2_1_NEPBS2_SPO0_VW8_WGM21
    SolutionIndex: 13
    SolutionNameMin: Cijk_Ailk_Bljk_HHS_BH_MT96x16x64_MI16x16x16x1_SN_GRVW8_GSU6_MIWT3_1_NEPBS0_SU0_SUS0_SPO0_VW4_WGM1
    SolutionIndex: 14
    SolutionNameMin: Cijk_Ailk_Bljk_HHS_BH_MT64x16x64_MI16x16x16x1_SN_GRVW8_GSU6_MIWT2_1_NEPBS0_SU0_SUS0_SPO0_VW1_WGM1
    SolutionIndex: 15
    SolutionNameMin: Cijk_Ailk_Bljk_HHS_BH_MT32x16x64_MI16x16x16x1_SN_GRVW8_GSU1_MIWT1_1_NEPBS0_SPO1_VW1_WG32_4_1_WGM15
    SolutionIndex: 16
    SolutionNameMin: Cijk_Ailk_Bljk_HHS_BH_MT64x16x64_MI16x16x16x1_SN_GRVW8_GSU1_MIWT2_1_NEPBS2_SPO0_VW1_WG32_4_1_WGM1
    SolutionIndex: 17
    SolutionNameMin: Cijk_Ailk_Bljk_HHS_BH_MT32x16x64_MI16x16x16x1_SN_GRVW2_GSU1_MIWT1_1_NEPBS2_SPO1_VW4_WG32_4_1_WGM19
    SolutionIndex: 18
    SolutionNameMin: Cijk_Ailk_Bljk_HHS_BH_MT64x16x64_MI16x16x16x1_SN_GRVW8_GSU1_MIWT2_1_NEPBS0_SPO1_VW4_WG32_4_1_WGM15
    SolutionIndex: 19
    SolutionNameMin: Cijk_Ailk_Bljk_HHS_BH_MT16x16x64_MI16x16x16x1_SN_GRVW8_GSU8_MIWT1_1_NEPBS2_SU0_SUS0_SPO1_VW8_WGM1
    SolutionIndex: 20
    SolutionNameMin: Cijk_Ailk_Bljk_HHS_BH_MT16x16x64_MI16x16x16x1_SN_GRVW8_GSU8_MIWT1_1_NEPBS0_SU0_SUS0_SPO0_VW4_WGM1
    SolutionIndex: 21
    SolutionNameMin: Cijk_Ailk_Bljk_HHS_BH_MT32x16x64_MI16x16x16x1_SN_GRVW4_GSU8_MIWT1_1_NEPBS2_SU0_SUS0_SPO0_VW8_WGM1
    SolutionIndex: 22
    SolutionNameMin: Cijk_Ailk_Bljk_HHS_BH_MT32x48x64_MI16x16x16x1_SN_1LDSB0_GRVW8_GSU12_MIWT2_3_NEPBS2_SU32_SUS256_SPO1_VW2_WG16_4_1_WGM8
    SolutionIndex: 23
    SolutionNameMin: Cijk_Ailk_Bljk_HHS_BH_MT128x16x64_MI16x16x1_SN_GSU19_MIWT2_1_NTA1_NTB0_SU4_SUS256_WSGRA1_WSGRB1_WGM1
    SolutionIndex: 24
    SolutionNameMin: Cijk_Ailk_Bljk_HHS_BH_MT128x16x128_MI16x16x1_SN_LDSB1_GRVWB4_GSU1_LBSPPA1024_LBSPPB256_MIWT2_1_NTA0_NEPBS0_NLCA1_SPO0_SSO0_SVW2_VWA2_WG64_4_1
    SolutionIndex: 25
    SolutionNameMin: Cijk_Ailk_Bljk_HHS_BH_MT256x16x64_MI16x16x1_SN_LDSB1_GRVWB2_GSU5_LBSPPA2048_LBSPPB128_MIWT4_1_NTA0_NEPBS0_NLCA1_SPO0_SSO2_SVW4_VWA4_WG64_4_1
    SolutionIndex: 26
    SolutionNameMin: Cijk_Ailk_Bljk_HHS_BH_MT16x64x128_MI16x16x1_SN_LDSB0_GRVWA8_GSU1_LBSPPB256_MIWT1_1_NTB1_NEPBS0_SPO0_SSO0_WG16_16_1
    SolutionIndex: 27
    SolutionNameMin: Cijk_Ailk_Bljk_HHS_BH_MT16x64x128_MI16x16x1_SN_LDSB0_GRVWA8_GSU8_LBSPPB256_MIWT1_1_NTB1_NEPBS16_SPO1_SSO0_WG16_16_1
    SolutionIndex: 28
    SolutionNameMin: Cijk_Ailk_Bljk_HHS_BH_MT16x128x128_MI16x16x1_SN_LDSB1_GRVWA8_GSU1_LBSPPB256_MIWT1_2_NTB1_NEPBS16_SPO0_SSO2_WG16_16_1
    SolutionIndex: 29
    SolutionNameMin: Cijk_Ailk_Bljk_HHS_BH_UserArgs_MT256x16x32_MI16x16x1_SN_CLR1_GRVWA8_GRVWB2_GSU8_LBSPPA2048_LBSPPB128_LPA0_LPB4_LRVW4_LWPM2_MIWT4_1_NTA0_NLCA1_PLR1_SU0_SUM0_SUS0_SVW4_VWA4_WSGRA0_WG64_4_1_WGM1
    SolutionIndex: 30
    SolutionNameMin: Cijk_Ailk_Bljk_HHS_BH_UserArgs_MT256x16x64_MI16x16x1_SN_CLR1_GRVWA8_GRVWB4_GSU5_LBSPPA4096_LBSPPB128_LPA0_LPB16_LRVW8_LWPM4_MIWT4_1_NTA0_NLCA1_PLR1_SU0_SUM0_SUS0_SVW4_VWA4_WSGRA0_WG64_4_1_WGM1
    SolutionIndex: 31
    SolutionNameMin: Cijk_Ailk_Bljk_HHS_BH_UserArgs_MT256x16x32_MI16x16x1_SN_CLR1_GRVWA8_GRVWB2_GSU8_LBSPPA2048_LBSPPB128_LPA0_LPB4_LRVW4_LWPM4_MIWT4_1_NTA4_NLCA1_PLR1_SU0_SUM0_SUS0_SVW4_VWA4_WSGRA0_WG64_4_1_WGM1
    SolutionIndex: 32
    SolutionNameMin: Cijk_Ailk_Bljk_HHS_BH_UserArgs_MT256x16x64_MI16x16x1_SN_CLR1_GRVWA8_GRVWB4_GSU5_LBSPPA4096_LBSPPB128_LPA0_LPB16_LRVW8_LWPMn1_MIWT4_1_NTA0_NLCA1_PLR1_SU0_SUM0_SUS0_SVW4_VWA4_WSGRA0_WG64_4_1_WGM1
    SolutionIndex: 33
    SolutionNameMin: Cijk_Ailk_Bljk_HHS_BH_UserArgs_MT256x16x32_MI16x16x1_SN_CLR1_GRVWA2_GRVWB2_GSU2_LBSPPA2048_LBSPPB128_LPA0_LPB4_LRVW4_LWPMn1_MIWT4_1_NTA4_NLCA2_PLR1_SU4_SUM0_SUS256_SVW4_VWA4_WSGRA1_WG64_4_1_WGM1
    SolutionIndex: 34
    SolutionNameMin: Cijk_Ailk_Bljk_HHS_BH_UserArgs_MT256x16x32_MI16x16x1_SN_CLR1_GRVWA8_GRVWB2_GSU3_LBSPPA2048_LBSPPB128_LPA0_LPB4_LRVW4_LWPMn1_MIWT4_1_NTA4_NLCA1_PLR1_SU4_SUM0_SUS256_SVW4_VWA4_WSGRA1_WG64_4_1_WGM1
    SolutionIndex: 35
    SolutionNameMin: Cijk_Ailk_Bljk_HHS_BH_UserArgs_MT512x16x32_MI16x16x1_SN_CLR1_GRVWA8_GRVWB2_GSU5_LBSPPA4096_LBSPPB128_LPA0_LPB4_LRVW4_LWPM4_MIWT8_1_NTA0_NLCA1_PLR1_SU0_SUM0_SUS0_SVW8_VWA8_WSGRA0_WG64_4_1_WGM1
    SolutionIndex: 36
    SolutionNameMin: Cijk_Ailk_Bljk_HHS_BH_UserArgs_MT256x16x32_MI16x16x1_SN_CLR1_GRVWA8_GRVWB2_GSU6_LBSPPA2048_LBSPPB128_LPA0_LPB4_LRVW4_LWPM4_MIWT4_1_NTA4_NLCA1_PLR1_SU0_SUM0_SUS0_SVW4_VWA4_WSGRA0_WG64_4_1_WGM1
    SolutionIndex: 37
    SolutionNameMin: Cijk_Ailk_Bljk_HHS_BH_UserArgs_MT512x16x32_MI16x16x1_SN_CLR1_GRVWA8_GRVWB2_GSU5_LBSPPA4096_LBSPPB128_LPA0_LPB4_LRVW4_LWPM2_MIWT8_1_NTA0_NLCA1_PLR1_SU4_SUM0_SUS256_SVW8_VWA8_WSGRA1_WG64_4_1_WGM1
    SolutionIndex: 38
    SolutionNameMin: Cijk_Ailk_Bljk_HHS_BH_UserArgs_MT256x16x32_MI16x16x1_SN_CLR1_GRVWA2_GRVWB2_GSU3_LBSPPA2048_LBSPPB128_LPA0_LPB4_LRVW4_LWPM2_MIWT4_1_NTA4_NLCA2_PLR1_SU0_SUM0_SUS0_SVW4_VWA4_WSGRA1_WG64_4_1_WGM1
    SolutionIndex: 39
    SolutionNameMin: Cijk_Ailk_Bljk_HHS_BH_UserArgs_MT256x16x32_MI16x16x1_SN_CLR1_GRVWA8_GRVWB2_GSU6_LBSPPA2048_LBSPPB128_LPA0_LPB4_LRVW4_LWPMn1_MIWT4_1_NTA0_NLCA1_PLR1_SU0_SUM0_SUS0_SVW4_VWA4_WSGRA1_WG64_4_1_WGM1
    SolutionIndex: 40
    SolutionNameMin: Cijk_Ailk_Bljk_HHS_BH_UserArgs_MT128x16x128_MI16x16x1_SN_CLR1_GRVWA8_GRVWB8_GSU1_LBSPPA2048_LBSPPB256_LPA32_LPB16_LRVW8_LWPMn1_MIWT2_1_NTA0_NLCA1_PLR3_SU4_SUM0_SUS256_SVW2_VWA2_WSGRA0_WG64_4_1_WGM1
    SolutionIndex: 41
    SolutionNameMin: Cijk_Ailk_Bljk_HHS_BH_UserArgs_MT512x16x32_MI16x16x1_SN_CLR1_GRVWA8_GRVWB2_GSU5_LBSPPA4096_LBSPPB128_LPA0_LPB4_LRVW4_LWPM4_MIWT8_1_NTA0_NLCA1_PLR1_SU4_SUM0_SUS256_SVW8_VWA8_WSGRA0_WG64_4_1_WGM1
    SolutionIndex: 42
    SolutionNameMin: Cijk_Ailk_Bljk_HHS_BH_UserArgs_MT128x16x64_MI16x16x1_SN_CLR1_GRVWA8_GRVWB4_GSU6_LBSPPA2048_LBSPPB128_LPA32_LPB16_LRVW8_LWPM4_MIWT2_1_NTA0_NLCA1_PLR1_SU0_SUM0_SUS0_SVW2_VWA2_WSGRA0_WG64_4_1_WGM1
    SolutionIndex: 43
    SolutionNameMin: Cijk_Ailk_Bljk_HHS_BH_UserArgs_MT128x16x128_MI16x16x1_SN_CLR1_GRVWA8_GRVWB8_GSU1_LBSPPA2048_LBSPPB256_LPA32_LPB16_LRVW8_LWPMn1_MIWT2_1_NTA0_NLCA1_PLR3_SU0_SUM0_SUS0_SVW2_VWA2_WSGRA0_WG64_4_1_WGM1
    SolutionIndex: 44
    SolutionNameMin: Cijk_Ailk_Bljk_HHS_BH_UserArgs_MT512x16x32_MI16x16x1_SN_CLR1_GRVWA8_GRVWB2_GSU5_LBSPPA4096_LBSPPB128_LPA0_LPB4_LRVW4_LWPMn1_MIWT8_1_NTA0_NLCA1_PLR1_SU0_SUM0_SUS0_SVW8_VWA8_WSGRA0_WG64_4_1_WGM1
    SolutionIndex: 45
    SolutionNameMin: Cijk_Ailk_Bljk_HHS_BH_UserArgs_MT256x16x32_MI16x16x1_SN_CLR1_GRVWA8_GRVWB2_GSU3_LBSPPA2048_LBSPPB128_LPA0_LPB4_LRVW4_LWPM2_MIWT4_1_NTA4_NLCA1_PLR1_SU4_SUM0_SUS256_SVW4_VWA4_WSGRA0_WG64_4_1_WGM1
    SolutionIndex: 46
    SolutionNameMin: Cijk_Ailk_Bljk_HHS_BH_UserArgs_MT256x16x32_MI16x16x1_SN_CLR1_GRVWA8_GRVWB2_GSU2_LBSPPA2048_LBSPPB128_LPA0_LPB4_LRVW4_LWPMn1_MIWT4_1_NTA0_NLCA1_PLR1_SU4_SUM0_SUS256_SVW4_VWA4_WSGRA1_WG64_4_1_WGM1
    SolutionIndex: 47
    SolutionNameMin: Cijk_Ailk_Bljk_HHS_BH_UserArgs_MT256x16x32_MI16x16x1_SN_CLR1_GRVWA8_GRVWB2_GSU4_LBSPPA2048_LBSPPB128_LPA0_LPB4_LRVW4_LWPMn1_MIWT4_1_NTA0_NLCA1_PLR1_SU4_SUM0_SUS256_SVW4_VWA4_WSGRA1_WG64_4_1_WGM1
    SolutionIndex: 48
    SolutionNameMin: Cijk_Ailk_Bljk_HHS_BH_UserArgs_MT512x16x32_MI16x16x1_SN_CLR1_GRVWA8_GRVWB2_GSU3_LBSPPA4096_LBSPPB128_LPA0_LPB4_LRVW4_LWPM4_MIWT8_1_NTA4_NLCA1_PLR1_SU0_SUM0_SUS0_SVW8_VWA8_WSGRA1_WG64_4_1_WGM1
    SolutionIndex: 49
    SolutionNameMin: Cijk_Ailk_Bljk_HHS_BH_UserArgs_MT256x16x32_MI16x16x1_SN_CLR1_GRVWA2_GRVWB2_GSU6_LBSPPA2048_LBSPPB128_LPA0_LPB4_LRVW4_LWPMn1_MIWT4_1_NTA4_NLCA2_PLR1_SU0_SUM0_SUS0_SVW4_VWA4_WSGRA1_WG64_4_1_WGM1
    SolutionIndex: 50
    SolutionNameMin: Cijk_Ailk_Bljk_HHS_BH_UserArgs_MT512x16x32_MI16x16x1_SN_CLR1_GRVWA8_GRVWB2_GSU4_LBSPPA4096_LBSPPB128_LPA0_LPB4_LRVW4_LWPM4_MIWT8_1_NTA4_NLCA1_PLR1_SU0_SUM0_SUS0_SVW8_VWA8_WSGRA1_WG64_4_1_WGM1
    SolutionIndex: 51
    SolutionNameMin: Cijk_Ailk_Bljk_HHS_BH_UserArgs_MT256x16x32_MI16x16x1_SN_CLR1_GRVWA8_GRVWB2_GSU4_LBSPPA2048_LBSPPB128_LPA0_LPB4_LRVW4_LWPM2_MIWT4_1_NTA0_NLCA1_PLR1_SU0_SUM0_SUS0_SVW4_VWA4_WSGRA1_WG64_4_1_WGM1
    SolutionIndex: 52
    SolutionNameMin: Cijk_Ailk_Bljk_HHS_BH_UserArgs_MT256x16x32_MI16x16x1_SN_CLR1_GRVWA8_GRVWB2_GSU8_LBSPPA2048_LBSPPB128_LPA0_LPB4_LRVW4_LWPM2_MIWT4_1_NTA4_NLCA1_PLR1_SU0_SUM0_SUS0_SVW4_VWA4_WSGRA1_WG64_4_1_WGM1
    SolutionIndex: 53
    SolutionNameMin: Cijk_Ailk_Bljk_HHS_BH_UserArgs_MT256x16x32_MI16x16x1_SN_CLR1_GRVWA8_GRVWB2_GSU4_LBSPPA2048_LBSPPB128_LPA0_LPB4_LRVW4_LWPM4_MIWT4_1_NTA4_NLCA1_PLR1_SU0_SUM0_SUS0_SVW4_VWA4_WSGRA1_WG64_4_1_WGM1
    SolutionIndex: 54
    SolutionNameMin: Cijk_Ailk_Bljk_HHS_BH_UserArgs_MT256x16x32_MI16x16x1_SN_CLR1_GRVWA8_GRVWB2_GSU6_LBSPPA2048_LBSPPB128_LPA0_LPB4_LRVW4_LWPM2_MIWT4_1_NTA4_NLCA1_PLR1_SU0_SUM0_SUS0_SVW4_VWA4_WSGRA0_WG64_4_1_WGM1
    SolutionIndex: 55
    SolutionNameMin: Cijk_Ailk_Bljk_HHS_BH_UserArgs_MT512x16x32_MI16x16x1_SN_CLR1_GRVWA8_GRVWB2_GSU8_LBSPPA4096_LBSPPB128_LPA0_LPB4_LRVW4_LWPM4_MIWT8_1_NTA0_NLCA1_PLR1_SU0_SUM0_SUS0_SVW8_VWA8_WSGRA1_WG64_4_1_WGM1
    SolutionIndex: 56
    SolutionNameMin: Cijk_Ailk_Bljk_HHS_BH_UserArgs_MT256x16x32_MI16x16x1_SN_CLR1_GRVWA8_GRVWB2_GSU4_LBSPPA2048_LBSPPB128_LPA0_LPB4_LRVW4_LWPMn1_MIWT4_1_NTA0_NLCA1_PLR1_SU0_SUM0_SUS0_SVW4_VWA4_WSGRA0_WG64_4_1_WGM1
    SolutionIndex: 57
    SolutionNameMin: Cijk_Ailk_Bljk_HHS_BH_UserArgs_MT256x16x32_MI16x16x1_SN_CLR1_GRVWA8_GRVWB2_GSU6_LBSPPA2048_LBSPPB128_LPA0_LPB4_LRVW4_LWPM4_MIWT4_1_NTA0_NLCA1_PLR1_SU4_SUM0_SUS256_SVW4_VWA4_WSGRA1_WG64_4_1_WGM1
    SolutionIndex: 58
    SolutionNameMin: Cijk_Ailk_Bljk_HHS_BH_UserArgs_MT512x16x32_MI16x16x1_SN_CLR1_GRVWA8_GRVWB2_GSU3_LBSPPA4096_LBSPPB128_LPA0_LPB4_LRVW4_LWPMn1_MIWT8_1_NTA0_NLCA1_PLR1_SU4_SUM0_SUS256_SVW8_VWA8_WSGRA0_WG64_4_1_WGM1
    SolutionIndex: 59
    SolutionNameMin: Cijk_Ailk_Bljk_HHS_BH_UserArgs_MT256x16x32_MI16x16x1_SN_CLR1_GRVWA8_GRVWB2_GSU3_LBSPPA2048_LBSPPB128_LPA0_LPB4_LRVW4_LWPM4_MIWT4_1_NTA4_NLCA1_PLR1_SU4_SUM0_SUS256_SVW4_VWA4_WSGRA0_WG64_4_1_WGM1
    SolutionIndex: 60
    SolutionNameMin: Cijk_Ailk_Bljk_HHS_BH_UserArgs_MT256x224x64_MI32x32x1_SN_GRVWB8_GSU1_LBSPPA0_LPA0_LPB8_LRVW8_MIWT2_7_NLCA1_SU8_SUM0_SUS256_SVW2_VWA2_WG128_2_1_WGM32_WGMXCC1
    SolutionIndex: 61
    SolutionNameMin: Cijk_Ailk_Bljk_HHS_BH_UserArgs_MT256x256x32_MI32x32x1_SN_GRVWB8_GSU1_LBSPPA0_LPA0_LPB8_LRVW8_MIWT2_8_NLCA1_SU8_SUM0_SUS256_SVW2_VWA2_WG128_2_1_WGM32_WGMXCC4
    SolutionIndex: 62
    SolutionNameMin: Cijk_Ailk_Bljk_HHS_BH_UserArgs_MT128x256x64_MI32x32x1_SN_GRVWB8_GSU1_MIWT2_4_SU8_SUM0_SUS512_SSO0_SVW2_VWA2_WG64_4_1_WGM1
    SolutionIndex: 63
    SolutionNameMin: Cijk_Ailk_Bljk_HHS_BH_UserArgs_MT256x224x64_MI32x32x1_SN_GRVWB8_GSU1_LBSPPA0_LBSPPB128_LPA0_LPB8_LRVW8_MIWT2_7_NTC4_NTD4_PLR2_SU0_SUM0_SUS0_SVW2_VWA2_VWB1_WSGRA1_WSGRB0_WG128_2_1_WGM1
    SolutionIndex: 64
    SolutionNameMin: Cijk_Ailk_Bljk_HHS_BH_UserArgs_MT256x128x32_MI32x32x1_SN_GRVWB8_GSU1_LBSPPA0_LBSPPB128_LPA0_LPB8_LRVW8_MIWT2_4_NTC0_NTD0_PLR1_SU0_SUM0_SUS0_SVW2_VWA2_VWB1_WSGRA0_WSGRB0_WG128_2_1_WGM1
    SolutionIndex: 65
    SolutionNameMin: Cijk_Ailk_Bljk_HHS_BH_UserArgs_MT256x128x32_MI32x32x1_SN_GRVWB8_GSU1_LBSPPA0_LBSPPB256_LPA0_LPB8_LRVW8_MIWT2_4_NTC0_NTD0_PLR1_SU4_SUM0_SUS256_SVW2_VWA2_VWB4_WSGRA1_WSGRB1_WG128_2_1_WGM1
    SolutionIndex: 66
    SolutionNameMin: Cijk_Ailk_Bljk_HHS_BH_UserArgs_MT256x256x32_MI32x32x1_SN_GRVWB8_GSU1_LBSPPA0_LBSPPB128_LPA16_LPB8_LRVW8_MIWT2_8_NTC3_NTD3_PLR1_SU0_SUM0_SUS0_SVW2_VWA2_VWB1_WSGRA0_WSGRB0_WG128_2_1_WGM1
    SolutionIndex: 67
    SolutionNameMin: Cijk_Ailk_Bljk_HHS_BH_UserArgs_MT256x256x32_MI32x32x1_SN_GRVWB4_GSU1_LBSPPA0_LBSPPB256_LPA0_LPB8_LRVW8_MIWT2_8_NTC4_NTD4_PLR1_SU0_SUM0_SUS0_SVW2_VWA2_VWB4_WSGRA1_WSGRB1_WG128_2_1_WGM1
    SolutionIndex: 68
    SolutionNameMin: Cijk_Ailk_Bljk_HHS_BH_UserArgs_MT256x128x32_MI32x32x1_SN_GRVWB8_GSU1_LBSPPA0_LBSPPB128_LPA0_LPB8_LRVW8_MIWT2_4_NTC4_NTD4_PLR1_SU0_SUM0_SUS0_SVW2_VWA2_VWB1_WSGRA1_WSGRB0_WG128_2_1_WGM1
    SolutionIndex: 69
    SolutionNameMin: Cijk_Ailk_Bljk_HHS_BH_UserArgs_MT256x128x32_MI32x32x1_SN_GRVWB8_GSU1_LBSPPA0_LBSPPB256_LPA0_LPB8_LRVW8_MIWT2_4_NTC0_NTD0_PLR1_SU0_SUM0_SUS0_SVW2_VWA2_VWB4_WSGRA1_WSGRB1_WG128_2_1_WGM1
    SolutionIndex: 70
    SolutionNameMin: Cijk_Ailk_Bljk_HHS_BH_UserArgs_MT256x224x64_MI32x32x1_SN_GRVWB8_GSU1_LBSPPA0_LBSPPB128_LPA0_LPB8_LRVW8_MIWT2_7_NTC3_NTD3_PLR2_SU0_SUM0_SUS0_SVW2_VWA2_VWB1_WSGRA0_WSGRB1_WG128_2_1_WGM1
    SolutionIndex: 71
    SolutionNameMin: Cijk_Ailk_Bljk_HHS_BH_UserArgs_MT256x256x32_MI32x32x1_SN_GRVWB8_GSU1_LBSPPA0_LBSPPB128_LPA16_LPB8_LRVW8_MIWT2_8_NTC4_NTD4_PLR1_SU4_SUM0_SUS256_SVW2_VWA2_VWB1_WSGRA0_WSGRB0_WG128_2_1_WGM1
    SolutionIndex: 72
    SolutionNameMin: Cijk_Ailk_Bljk_HHS_BH_UserArgs_MT256x224x64_MI32x32x1_SN_GRVWB8_GSU1_LBSPPA0_LBSPPB128_LPA0_LPB8_LRVW8_MIWT2_7_NTC4_NTD4_PLR2_SU4_SUM0_SUS256_SVW2_VWA2_VWB1_WSGRA0_WSGRB1_WG128_2_1_WGM1
    SolutionIndex: 73
    SolutionNameMin: Cijk_Ailk_Bljk_HHS_BH_UserArgs_MT256x256x32_MI32x32x1_SN_GRVWB4_GSU1_LBSPPA0_LBSPPB256_LPA0_LPB8_LRVW8_MIWT2_8_NTC0_NTD0_PLR1_SU4_SUM0_SUS256_SVW2_VWA2_VWB4_WSGRA1_WSGRB1_WG128_2_1_WGM8
    SolutionIndex: 74
    SolutionNameMin: Cijk_Ailk_Bljk_HHS_BH_UserArgs_MT256x256x32_MI32x32x1_SN_GRVWB8_GSU1_LBSPPA0_LBSPPB128_LPA16_LPB8_LRVW8_MIWT2_8_NTC0_NTD0_PLR1_SU0_SUM0_SUS0_SVW2_VWA2_VWB1_WSGRA0_WSGRB0_WG128_2_1_WGM1
    SolutionIndex: 75
    SolutionNameMin: Cijk_Ailk_Bljk_HHS_BH_UserArgs_MT256x256x32_MI32x32x1_SN_GRVWB8_GSU1_LBSPPA0_LBSPPB256_LPA0_LPB8_LRVW8_MIWT2_8_NTC4_NTD4_PLR1_SU0_SUM0_SUS0_SVW2_VWA2_VWB4_WSGRA1_WSGRB1_WG128_2_1_WGM1
    SolutionIndex: 76
    SolutionNameMin: Cijk_Ailk_Bljk_HHS_BH_UserArgs_MT256x256x32_MI32x32x1_SN_GRVWB4_GSU1_LBSPPA0_LBSPPB256_LPA0_LPB8_LRVW8_MIWT2_8_NTC3_NTD3_PLR1_SU0_SUM0_SUS0_SVW2_VWA2_VWB4_WSGRA1_WSGRB1_WG128_2_1_WGM1
    SolutionIndex: 77
    SolutionNameMin: Cijk_Ailk_Bljk_HHS_BH_UserArgs_MT256x192x64_MI32x32x1_SN_GRVWB4_GSU1_LBSPPA0_LBSPPB128_LPA0_LPB8_LRVW8_MIWT2_6_NTC0_NTD0_PLR2_SU4_SUM0_SUS256_SVW2_VWA2_VWB1_WSGRA1_WSGRB0_WG128_2_1_WGM32
    SolutionIndex: 78
    SolutionNameMin: Cijk_Ailk_Bljk_HHS_BH_UserArgs_MT256x224x64_MI32x32x1_SN_GRVWB8_GSU1_LBSPPA0_LBSPPB128_LPA0_LPB8_LRVW8_MIWT2_7_NTC0_NTD0_PLR2_SU0_SUM0_SUS0_SVW2_VWA2_VWB1_WSGRA1_WSGRB0_WG128_2_1_WGM1
    SolutionIndex: 79
    SolutionNameMin: Cijk_Ailk_Bljk_HHS_BH_UserArgs_MT256x256x32_MI32x32x1_SN_GRVWB4_GSU1_LBSPPA0_LBSPPB128_LPA16_LPB8_LRVW8_MIWT2_8_NTC0_NTD0_PLR1_SU0_SUM0_SUS0_SVW2_VWA2_VWB1_WSGRA0_WSGRB0_WG128_2_1_WGM1
    SolutionIndex: 80
    SolutionNameMin: Cijk_Ailk_Bljk_HHS_BH_UserArgs_MT256x224x64_MI32x32x1_SN_GRVWB8_GSU1_LBSPPA0_LBSPPB128_LPA0_LPB8_LRVW8_MIWT2_7_NTC0_NTD0_PLR2_SU4_SUM0_SUS256_SVW2_VWA2_VWB1_WSGRA0_WSGRB1_WG128_2_1_WGM1
    SolutionIndex: 81
    SolutionNameMin: Cijk_Ailk_Bljk_HHS_BH_UserArgs_MT16x80x128_MI16x16x1_SN_LDSB1_GRVWB8_GSU1_LBSPPA256_LBSPPB256_LPB16_LRVW8_MIWT1_5_NTB0_SU0_SUM0_SUS0_SPO1_WG16_4_4_WGM1
    SolutionIndex: 82
    SolutionNameMin: Cijk_Ailk_Bljk_HHS_BH_UserArgs_MT16x64x256_MI16x16x1_SN_LDSB1_GRVWB2_GSU1_LBSPPA256_LBSPPB512_LPB16_LRVW8_MIWT1_4_NTB0_SU0_SUM0_SUS0_SPO1_WG16_4_4_WGM1
    SolutionIndex: 83
    SolutionNameMin: Cijk_Ailk_Bljk_HHS_BH_UserArgs_MT16x96x128_MI16x16x1_SN_LDSB1_GRVWB8_GSU1_LBSPPA256_LBSPPB256_LPB16_LRVW8_MIWT1_3_NTB4_SU0_SUM0_SUS0_SPO0_WG16_8_2_WGM1
    SolutionIndex: 84
    SolutionNameMin: Cijk_Ailk_Bljk_HHS_BH_UserArgs_MT16x80x128_MI16x16x1_SN_LDSB1_GRVWB8_GSU3_LBSPPA256_LBSPPB256_LPB16_LRVW8_MIWT1_5_NTB0_SU0_SUM0_SUS0_SPO1_WG16_4_4_WGM1
    SolutionIndex: 85
    SolutionNameMin: Cijk_Ailk_Bljk_HHS_BH_UserArgs_MT16x80x128_MI16x16x1_SN_LDSB1_GRVWB8_GSU1_LBSPPA256_LBSPPB256_LPB16_LRVW8_MIWT1_5_NTB4_SU0_SUM0_SUS0_SPO1_WG16_4_4_WGM1
    SolutionIndex: 86
    SolutionNameMin: Cijk_Ailk_Bljk_HHS_BH_UserArgs_MT16x112x128_MI16x16x1_SN_LDSB1_GRVWB8_GSU1_LBSPPA256_LBSPPB256_LPB16_LRVW8_MIWT1_7_NTB0_SU0_SUM0_SUS0_SPO0_WG16_4_4_WGM1
    SolutionIndex: 87
    SolutionNameMin: Cijk_Ailk_Bljk_HHS_BH_UserArgs_MT16x80x128_MI16x16x1_SN_LDSB1_GRVWB8_GSU3_LBSPPA256_LBSPPB256_LPB16_LRVW8_MIWT1_5_NTB4_SU0_SUM0_SUS0_SPO0_WG16_4_4_WGM1
    SolutionIndex: 88
    SolutionNameMin: Cijk_Ailk_Bljk_HHS_BH_UserArgs_MT16x96x128_MI16x16x1_SN_LDSB1_GRVWB8_GSU1_LBSPPA256_LBSPPB256_LPB16_LRVW8_MIWT1_3_NTB4_SU0_SUM0_SUS0_SPO1_WG16_8_2_WGM1
    SolutionIndex: 89
    SolutionNameMin: Cijk_Ailk_Bljk_HHS_BH_UserArgs_MT16x80x256_MI16x16x1_SN_LDSB1_GRVWB2_GSU1_LBSPPA256_LBSPPB512_LPB16_LRVW8_MIWT1_5_NTB0_SU0_SUM0_SUS0_SPO1_WG16_4_4_WGM1
    SolutionIndex: 90
    SolutionNameMin: Cijk_Ailk_Bljk_HHS_BH_UserArgs_MT16x112x128_MI16x16x1_SN_LDSB1_GRVWB8_GSU1_LBSPPA256_LBSPPB256_LPB16_LRVW8_MIWT1_7_NTB0_SU0_SUM0_SUS0_SPO1_WG16_4_4_WGM1
    SolutionIndex: 91
    SolutionNameMin: Cijk_Ailk_Bljk_HHS_BH_UserArgs_MT16x96x128_MI16x16x1_SN_LDSB1_GRVWB8_GSU1_LBSPPA256_LBSPPB256_LPB16_LRVW8_MIWT1_6_NTB4_SU0_SUM0_SUS0_SPO0_WG16_4_4_WGM1
    SolutionIndex: 92
    SolutionNameMin: Cijk_Ailk_Bljk_HHS_BH_UserArgs_MT16x96x128_MI16x16x1_SN_LDSB1_GRVWB8_GSU5_LBSPPA256_LBSPPB256_LPB16_LRVW8_MIWT1_3_NTB0_SU0_SUM0_SUS0_SPO1_WG16_8_2_WGM1
    SolutionIndex: 93
    SolutionNameMin: Cijk_Ailk_Bljk_HHS_BH_UserArgs_MT16x128x128_MI16x16x1_SN_LDSB1_GRVWB8_GSU1_LBSPPA256_LBSPPB256_LPB16_LRVW8_MIWT1_4_NTB0_SU0_SUM0_SUS0_SPO1_WG16_8_2_WGM1
    SolutionIndex: 94
    SolutionNameMin: Cijk_Ailk_Bljk_HHS_BH_UserArgs_MT16x80x256_MI16x16x1_SN_LDSB1_GRVWB2_GSU1_LBSPPA256_LBSPPB512_LPB16_LRVW8_MIWT1_5_NTB4_SU0_SUM0_SUS0_SPO0_WG16_4_4_WGM1
    SolutionIndex: 95
    SolutionNameMin: Cijk_Ailk_Bljk_HHS_BH_UserArgs_MT16x128x128_MI16x16x1_SN_LDSB1_GRVWB8_GSU1_LBSPPA256_LBSPPB256_LPB16_LRVW8_MIWT1_4_NTB4_SU0_SUM0_SUS0_SPO0_WG16_8_2_WGM1
    SolutionIndex: 96
    SolutionNameMin: Cijk_Ailk_Bljk_HHS_BH_UserArgs_MT16x176x128_MI16x16x1_SN_LDSB1_GRVWB8_GSU1_LBSPPA256_LBSPPB256_LPB16_LRVW8_MIWT1_11_NTB4_SU0_SUM0_SUS0_SPO0_WG16_4_4_WGM1
    SolutionIndex: 97
    SolutionNameMin: Cijk_Ailk_Bljk_HHS_BH_UserArgs_MT16x96x256_MI16x16x1_SN_LDSB1_GRVWB2_GSU1_LBSPPA128_LBSPPB512_LPB4_LRVW4_MIWT1_6_NTB4_SU0_SUM0_SUS0_SPO0_WG16_4_4_WGM1
    SolutionIndex: 98
    SolutionNameMin: Cijk_Ailk_Bljk_HHS_BH_UserArgs_MT16x96x128_MI16x16x1_SN_LDSB1_GRVWB8_GSU1_LBSPPA256_LBSPPB256_LPB16_LRVW8_MIWT1_6_NTB4_SU0_SUM0_SUS0_SPO1_WG16_4_4_WGM1
    SolutionIndex: 99
    SolutionNameMin: Cijk_Ailk_Bljk_HHS_BH_UserArgs_MT16x96x128_MI16x16x1_SN_LDSB1_GRVWB8_GSU1_LBSPPA256_LBSPPB256_LPB16_LRVW8_MIWT1_3_NTB0_SU0_SUM0_SUS0_SPO1_WG16_8_2_WGM1
    SolutionIndex: 100
    SolutionNameMin: Cijk_Ailk_Bljk_HHS_BH_UserArgs_MT16x224x128_MI16x16x1_SN_LDSB1_GRVWB2_GSU1_LBSPPA128_LBSPPB256_LPB4_LRVW4_MIWT1_14_NTB4_SU0_SUM0_SUS0_SPO0_WG16_4_4_WGM1
    SolutionIndex: 101
    SolutionNameMin: Cijk_Ailk_Bljk_HHS_BH_UserArgs_MT16x96x128_MI16x16x1_SN_LDSB1_GRVWB8_GSU1_LBSPPA256_LBSPPB256_LPB16_LRVW8_MIWT1_6_NTB0_SU0_SUM0_SUS0_SPO1_WG16_4_4_WGM1
    SolutionIndex: 102
    SolutionNameMin: Cijk_Ailk_Bljk_HHS_BH_UserArgs_MT16x64x256_MI16x16x1_SN_LDSB1_GRVWB2_GSU1_LBSPPA256_LBSPPB512_LPB16_LRVW8_MIWT1_4_NTB4_SU0_SUM0_SUS0_SPO0_WG16_4_4_WGM1
    SolutionIndex: 103
    SolutionNameMin: Cijk_Ailk_Bljk_HHS_BH_UserArgs_MT16x112x128_MI16x16x1_SN_LDSB1_GRVWB8_GSU1_LBSPPA256_LBSPPB256_LPB16_LRVW8_MIWT1_7_NTB4_SU0_SUM0_SUS0_SPO0_WG16_4_4_WGM1
- - - [1104, 1, 1, 4608]
    - [0, 0.0]
  - - [1104, 16, 1, 4608]
    - [1, 0.0]
  - - [4608, 1, 1, 320]
    - [2, 0.0]
  - - [4608, 16, 1, 320]
    - [3, 0.0]
  - - [16, 1, 1, 4608]
    - [4, 0.0]
  - - [16, 16, 1, 4608]
    - [5, 0.0]
  - - [16, 1335, 1, 4608]
    - [6, 0.0]
  - - [16, 1408, 1, 4608]
    - [7, 0.0]
  - - [768, 1, 1, 4608]
    - [8, 0.0]
  - - [768, 16, 1, 4608]
    - [9, 0.0]
  - - [4608, 1, 1, 768]
    - [2, 0.0]
  - - [4608, 16, 1, 768]
    - [10, 0.0]
  - - [1536, 1, 1, 4608]
    - [11, 0.0]
  - - [1536, 16, 1, 4608]
    - [12, 0.0]
  - - [2208, 1, 1, 4608]
    - [13, 0.0]
  - - [2208, 16, 1, 4608]
    - [14, 0.0]
  - - [9216, 1, 1, 320]
    - [15, 0.0]
  - - [9216, 1, 1, 768]
    - [16, 0.0]
  - - [9216, 16, 1, 320]
    - [17, 0.0]
  - - [9216, 16, 1, 768]
    - [18, 0.0]
  - - [32, 1, 1, 4608]
    - [19, 0.0]
  - - [32, 16, 1, 4608]
    - [20, 0.0]
  - - [32, 1335, 1, 4608]
    - [21, 0.0]
  - - [32, 1408, 1, 4608]
    - [22, 0.0]
  - - [16, 2048, 1, 1024]
    - [26, 0.0]
  - - [16, 2048, 1, 65536]
    - [27, 0.0]
  - - [16, 8192, 1, 1024]
    - [28, 0.0]
  - - [2048, 16, 1, 65536]
    - [23, 0.0]
  - - [8192, 16, 1, 1024]
    - [24, 0.0]
  - - [8192, 16, 1, 65536]
    - [25, 0.0]
  - - [12288, 1, 1, 4096]
    - [29, 0.0]
  - - [4096, 1, 1, 4096]
    - [30, 0.0]
  - - [22016, 1, 1, 4096]
    - [31, 0.0]
  - - [4096, 1, 1, 11008]
    - [32, 0.0]
  - - [151936, 1, 1, 4096]
    - [33, 0.0]
  - - [12288, 1, 1, 8192]
    - [34, 0.0]
  - - [8192, 1, 1, 4096]
    - [35, 0.0]
  - - [24576, 1, 1, 8192]
    - [36, 0.0]
  - - [8192, 1, 1, 12288]
    - [37, 0.0]
  - - [76032, 1, 1, 8192]
    - [38, 0.0]
  - - [6144, 1, 1, 8192]
    - [39, 0.0]
  - - [8192, 1, 1, 2048]
    - [40, 0.0]
  - - [8192, 1, 1, 6144]
    - [41, 0.0]
  - - [38016, 1, 1, 8192]
    - [36, 0.0]
  - - [3072, 1, 1, 8192]
    - [42, 0.0]
  - - [8192, 1, 1, 1024]
    - [43, 0.0]
  - - [8192, 1, 1, 3072]
    - [44, 0.0]
  - - [19008, 1, 1, 8192]
    - [45, 0.0]
  - - [19968, 1, 1, 13312]
    - [46, 0.0]
  - - [13312, 1, 1, 6656]
    - [47, 0.0]
  - - [35584, 1, 1, 13312]
    - [36, 0.0]
  - - [13312, 1, 1, 17792]
    - [48, 0.0]
  - - [76032, 1, 1, 13312]
    - [49, 0.0]
  - - [9984, 1, 1, 13312]
    - [50, 0.0]
  - - [13312, 1, 1, 3328]
    - [51, 0.0]
  - - [17792, 1, 1, 13312]
    - [52, 0.0]
  - - [13312, 1, 1, 8896]
    - [53, 0.0]
  - - [38016, 1, 1, 13312]
    - [54, 0.0]
  - - [4992, 1, 1, 13312]
    - [55, 0.0]
  - - [13312, 1, 1, 1664]
    - [56, 0.0]
  - - [8896, 1, 1, 13312]
    - [57, 0.0]
  - - [13312, 1, 1, 4448]
    - [58, 0.0]
  - - [19008, 1, 1, 13312]
    - [59, 0.0]
  - - [4096, 12288, 1, 4096]
    - [60, 0.0]
  - - [4096, 12288, 1, 12288]
    - [60, 0.0]
  - - [4096, 12288, 1, 22016]
    - [60, 0.0]
  - - [4096, 12288, 1, 32000]
    - [60, 0.0]
  - - [11008, 12288, 1, 4096]
    - [61, 0.0]
  - - [128, 2048, 192, 2048]
    - [62, 0.0]
  - - [8192, 6144, 1, 8192]
    - [63, 0.0]
  - - [8192, 8192, 1, 2048]
    - [64, 0.0]
  - - [8192, 8192, 1, 6144]
    - [65, 0.0]
  - - [8192, 38016, 1, 8192]
    - [66, 0.0]
  - - [8192, 3072, 1, 8192]
    - [67, 0.0]
  - - [8192, 8192, 1, 1024]
    - [68, 0.0]
  - - [8192, 8192, 1, 3072]
    - [69, 0.0]
  - - [8192, 19008, 1, 8192]
    - [70, 0.0]
  - - [8192, 19968, 1, 13312]
    - [71, 0.0]
  - - [8192, 13312, 1, 6656]
    - [71, 0.0]
  - - [8192, 35584, 1, 13312]
    - [72, 0.0]
  - - [8192, 13312, 1, 17792]
    - [73, 0.0]
  - - [8192, 76032, 1, 13312]
    - [74, 0.0]
  - - [8192, 9984, 1, 13312]
    - [63, 0.0]
  - - [8192, 13312, 1, 3328]
    - [75, 0.0]
  - - [8192, 17792, 1, 13312]
    - [72, 0.0]
  - - [8192, 13312, 1, 8896]
    - [76, 0.0]
  - - [8192, 38016, 1, 13312]
    - [71, 0.0]
  - - [8192, 4992, 1, 13312]
    - [77, 0.0]
  - - [8192, 13312, 1, 1664]
    - [64, 0.0]
  - - [8192, 8896, 1, 13312]
    - [78, 0.0]
  - - [8192, 13312, 1, 4448]
    - [79, 0.0]
  - - [8192, 19008, 1, 13312]
    - [80, 0.0]
  - - [1, 12288, 1, 4096]
    - [81, 0.0]
  - - [1, 4096, 1, 4096]
    - [82, 0.0]
  - - [1, 22016, 1, 4096]
    - [83, 0.0]
  - - [1, 4096, 1, 11008]
    - [84, 0.0]
  - - [1, 151936, 1, 4096]
    - [83, 0.0]
  - - [1, 12288, 1, 8192]
    - [85, 0.0]
  - - [1, 8192, 1, 4096]
    - [86, 0.0]
  - - [1, 24576, 1, 8192]
    - [85, 0.0]
  - - [1, 8192, 1, 12288]
    - [87, 0.0]
  - - [1, 76032, 1, 8192]
    - [88, 0.0]
  - - [1, 6144, 1, 8192]
    - [89, 0.0]
  - - [1, 8192, 1, 2048]
    - [90, 0.0]
  - - [1, 8192, 1, 6144]
    - [86, 0.0]
  - - [1, 38016, 1, 8192]
    - [91, 0.0]
  - - [1, 3072, 1, 8192]
    - [92, 0.0]
  - - [1, 8192, 1, 1024]
    - [93, 0.0]
  - - [1, 8192, 1, 3072]
    - [86, 0.0]
  - - [1, 19008, 1, 8192]
    - [94, 0.0]
  - - [1, 19968, 1, 13312]
    - [95, 0.0]
  - - [1, 13312, 1, 6656]
    - [96, 0.0]
  - - [1, 35584, 1, 13312]
    - [97, 0.0]
  - - [1, 13312, 1, 17792]
    - [98, 0.0]
  - - [1, 76032, 1, 13312]
    - [91, 0.0]
  - - [1, 9984, 1, 13312]
    - [95, 0.0]
  - - [1, 13312, 1, 3328]
    - [99, 0.0]
  - - [1, 17792, 1, 13312]
    - [100, 0.0]
  - - [1, 13312, 1, 8896]
    - [101, 0.0]
  - - [1, 38016, 1, 13312]
    - [97, 0.0]
  - - [1, 4992, 1, 13312]
    - [102, 0.0]
  - - [1, 13312, 1, 1664]
    - [98, 0.0]
  - - [1, 8896, 1, 13312]
    - [103, 0.0]
  - - [1, 13312, 1, 4448]
    - [101, 0.0]
  - - [1, 19008, 1, 13312]
    - [94, 0.0]
- 
- 
- DeviceEfficiency
- Equality
