library/src/amd_detail/rocblaslt/src/Tensile/Logic/asm_full/navi33/GridBased/navi33_Cijk_Alik_Bljk_HSS_BH_Bias_HAS_SAV_UserArgs.yaml
- {MinimumRequiredVersion: 4.33.0}
- navi33
- gfx1102
- [Device 73f0]
    SolutionIndex: -1
    SolutionIndex: 0
    SolutionNameMin: Cijk_Alik_Bljk_HSS_BH_Bias_HAS_SAV_UserArgs_MT32x32x32_MI16x16x1_SN_LDSB0_GRVWA8_GRVWB8_GSU1_LBSPPA128_LBSPPB128_MIWT1_1_SS1_SU32_SUM0_SUS256_TLDS1_WG32_4_1_WGM8
    SolutionIndex: 1
    SolutionNameMin: Cijk_Alik_Bljk_HSS_BH_Bias_HAS_SAV_UserArgs_MT96x32x32_MI16x16x1_SN_LDSB0_GRVWA8_GRVWB8_GSU1_LBSPPA128_LBSPPB128_MIWT3_1_SS1_SU32_SUM0_SUS256_TLDS1_WG32_4_1_WGM8
    SolutionIndex: 2
    SolutionNameMin: Cijk_Alik_Bljk_HSS_BH_Bias_HAS_SAV_UserArgs_MT96x96x32_MI16x16x1_SN_LDSB0_GRVWA8_GRVWB8_GSU1_LBSPPA128_LBSPPB128_MIWT3_3_SS1_SU32_SUM0_SUS256_TLDS1_WG32_4_1_WGM8
- - - [64, 64, 1, 64, 64, 64, 64, 64]
    - [0, 93.1957]
  - - [128, 128, 1, 128, 128, 128, 128, 128]
    - [0, 725.958]
  - - [256, 256, 1, 256, 256, 256, 256, 256]
    - [0, 5604.61]
  - - [512, 512, 1, 512, 512, 512, 512, 512]
    - [1, 21748.4]
  - - [1024, 1024, 1, 1024, 1024, 1024, 1024, 1024]
    - [2, 56812.1]
  - - [1536, 1536, 1, 1536, 1536, 1536, 1536, 1536]
    - [2, 56959.2]
  - - [2048, 2048, 1, 2048, 2048, 2048, 2048, 2048]
    - [2, 69098.8]
  - - [2560, 2560, 1, 2560, 2560, 2560, 2560, 2560]
    - [2, 79213.2]
  - - [3072, 3072, 1, 3072, 3072, 3072, 3072, 3072]
    - [2, 77109.2]
  - - [3584, 3584, 1, 3584, 3584, 3584, 3584, 3584]
    - [2, 78363.3]
  - - [4096, 4096, 1, 4096, 4096, 4096, 4096, 4096]
    - [2, 82369.5]
- 
- 
- DeviceEfficiency
- GridBased
