library/src/amd_detail/rocblaslt/src/Tensile/Logic/asm_full/navi33/GridBased/navi33_Cijk_Ailk_Bjlk_I8BH_HAI_SAV_UserArgs.yaml
- {MinimumRequiredVersion: 4.33.0}
- navi33
- gfx1102
- [Device 73f0]
    SolutionIndex: -1
    SolutionIndex: 0
    SolutionNameMin: Cijk_Ailk_Bjlk_I8BH_HAI_SAV_UserArgs_MT64x16x32_MI16x16x1_SN_GRVWB4_GSU1_LBSPPA1024_LBSPPB256_MIWT1_1_NLCA1_NLCB1_SS1_SU32_SUM0_SUS256_WG64_2_1_WGM8
    SolutionIndex: 1
    SolutionNameMin: Cijk_Ailk_Bjlk_I8BH_HAI_SAV_UserArgs_MT192x16x32_MI16x16x1_SN_GRVWB4_GSU1_LBSPPA3072_LBSPPB256_MIWT3_1_NLCA3_NLCB1_SS1_SU32_SUM0_SUS256_WG64_2_1_WGM8
    SolutionIndex: 2
    SolutionNameMin: Cijk_Ailk_Bjlk_I8BH_HAI_SAV_UserArgs_MT32x32x32_MI16x16x1_SN_GRVWB4_GSU1_LBSPPA512_LBSPPB512_MIWT1_1_NLCA1_NLCB1_SS1_SU32_SUM0_SUS256_WG32_4_1_WGM8
    SolutionIndex: 3
    SolutionNameMin: Cijk_Ailk_Bjlk_I8BH_HAI_SAV_UserArgs_MT64x96x32_MI16x16x1_SN_GRVWB4_GSU1_LBSPPA1024_LBSPPB1536_MIWT2_3_NLCA1_NLCB3_SS1_SU32_SUM0_SUS256_WG32_4_1_WGM8
    SolutionIndex: 4
    SolutionNameMin: Cijk_Ailk_Bjlk_I8BH_HAI_SAV_UserArgs_MT32x32x64_MI16x16x1_SN_GRVWB4_GSU1_LBSPPA512_LBSPPB512_MIWT1_1_NLCA1_NLCB1_SS1_SU32_SUM0_SUS256_WG32_4_1_WGM8
- - - [64, 64, 1, 64, 64, 64, 64, 64]
    - [0, 48.6923]
  - - [128, 128, 1, 128, 128, 128, 128, 128]
    - [4, 355.753]
  - - [256, 256, 1, 256, 256, 256, 256, 256]
    - [2, 2310.59]
  - - [512, 512, 1, 512, 512, 512, 512, 512]
    - [1, 17956.2]
  - - [1024, 1024, 1, 1024, 1024, 1024, 1024, 1024]
    - [3, 47843.9]
  - - [1536, 1536, 1, 1536, 1536, 1536, 1536, 1536]
    - [3, 53385.1]
  - - [2048, 2048, 1, 2048, 2048, 2048, 2048, 2048]
    - [3, 46410.6]
  - - [2560, 2560, 1, 2560, 2560, 2560, 2560, 2560]
    - [3, 52390.6]
  - - [3072, 3072, 1, 3072, 3072, 3072, 3072, 3072]
    - [3, 57117.5]
  - - [3584, 3584, 1, 3584, 3584, 3584, 3584, 3584]
    - [3, 57584.1]
  - - [4096, 4096, 1, 4096, 4096, 4096, 4096, 4096]
    - [3, 59415.8]
- 
- 
- DeviceEfficiency
- GridBased
