library/src/amd_detail/rocblaslt/src/Tensile/Logic/asm_full/aquavanjaram/gfx942/Equality/aquavanjaram_Cijk_Ailk_Bljk_HF8_HHS_BH_custom.yaml
- {MinimumRequiredVersion: 4.33.0}
- aquavanjaram
- gfx942
- [Device 0049, Device 0050]
    SolutionIndex: -1
    SolutionIndex: 0
    SolutionNameMin: Cijk_Ailk_Bljk_HF8_HHS_BH_MT128x16x64_MI16x16x1_SN_LDSB1_GRVWA4_GRVWB4_GSU4_GSUAMBSK_LBSPPA2048_LBSPPB128_LPA32_LPB16_LRVW8_MIWT2_1_NLCA1_SS1_SVW2_VWA2_WSGRA2_WSGRB1_WG64_4_1_WGM8
    SolutionIndex: 1
    SolutionNameMin: Cijk_Ailk_Bljk_HF8_HHS_BH_MT64x16x128_MI16x16x1_SN_LDSB0_GRVWA8_GRVWB8_GSU6_GSUAMBSK_LBSPPA1024_LBSPPB256_LPA16_LPB16_LRVW8_MIWT1_1_NLCA1_SS0_SVW4_VWA1_WSGRA2_WSGRB1_WG64_4_1_WGM8
    SolutionIndex: 2
    SolutionNameMin: Cijk_Ailk_Bljk_HF8_HHS_BH_MT16x192x128_MI16x16x1_SN_LDSB1_GRVWA8_GRVWB8_GSU7_GSUAMBSK_LBSPPA256_LBSPPB256_LPA16_LPB16_LRVW8_MIWT1_3_NLCA1_SS0_SVW4_VWA1_WSGRA1_WSGRB2_WG16_16_1_WGM8
    SolutionIndex: 3
    SolutionNameMin: Cijk_Ailk_Bljk_HF8_HHS_BH_MT16x96x128_MI16x16x1_SN_LDSB1_GRVWA4_GRVWB8_GSU7_GSUAMBSK_LBSPPA256_LBSPPB256_LPA16_LPB16_LRVW8_MIWT1_3_NLCA1_SS0_SVW4_VWA1_WSGRA1_WSGRB2_WG16_8_1_WGM8
    SolutionIndex: 4
    SolutionNameMin: Cijk_Ailk_Bljk_HF8_HHS_BH_MT16x64x128_MI16x16x1_SN_LDSB0_GRVWA8_GRVWB8_GSU9_GSUAMBSK_LBSPPA256_LBSPPB256_LPA16_LPB16_LRVW8_MIWT1_1_NLCA1_SS0_SVW4_VWA1_WSGRA1_WSGRB2_WG16_16_1_WGM8
    SolutionIndex: 5
    SolutionNameMin: Cijk_Ailk_Bljk_HF8_HHS_BH_MT32x16x128_MI16x16x1_SN_LDSB0_GRVWA8_GRVWB8_GSU3_GSUAMBSK_LBSPPA512_LBSPPB256_LPA16_LPB16_LRVW8_MIWT1_1_NLCA1_NLCB1_SS0_SVW4_VWA1_WSGRA1_WSGRB1_WG32_4_1_WGM1
    SolutionIndex: 6
    SolutionNameMin: Cijk_Ailk_Bljk_HF8_HHS_BH_MT64x16x128_MI16x16x1_SN_LDSB0_GRVWA8_GRVWB4_GSU9_GSUAMBSK_LBSPPA1024_LBSPPB256_LPA16_LPB16_LRVW8_MIWT1_1_NLCA1_SS0_SVW4_VWA1_WSGRA2_WSGRB1_WG64_4_1_WGM8
    SolutionIndex: 7
    SolutionNameMin: Cijk_Ailk_Bljk_HF8_HHS_BH_MT16x32x128_MI16x16x1_SN_LDSB0_GSU5_GSUAMBSK_LBSPPB256_MIWT1_1_NTB1_PKA1_SS0_SPO0_SVW4_WG16_8_1_WGM1
    SolutionIndex: 8
    SolutionNameMin: Cijk_Ailk_Bljk_HF8_HHS_BH_MT16x16x128_MI16x16x1_SN_GRVWA8_GRVWB8_GSU8_GSUAMBSK_LBSPPB256_MIWT1_1_NLCB1_SS0_SVW4_WSGRA1_WSGRB1_WGM1
    SolutionIndex: 9
    SolutionNameMin: Cijk_Ailk_Bljk_HF8_HHS_BH_MT16x16x256_MI16x16x1_SN_GRVWA8_GRVWB8_GSU32_GSUAMBSK_LBSPPB512_MIWT1_1_NLCB1_SS0_SVW4_WSGRA2_WSGRB2_WGM1
    SolutionIndex: 10
    SolutionNameMin: Cijk_Ailk_Bljk_HF8_HHS_BH_MT16x16x256_MI16x16x1_SN_GRVWA8_GRVWB8_GSU64_GSUAMBSK_LBSPPB512_MIWT1_1_NLCB1_SS0_SVW4_WSGRA2_WSGRB2_WGM1
- - - [8192, 16, 1, 8192]
    - [0, 0]
  - - [2048, 16, 1, 8192]
    - [1, 0]
  - - [16, 8192, 1, 65536]
    - [2, 0]
  - - [16, 8192, 1, 8192]
    - [3, 0]
  - - [16, 2048, 1, 8192]
    - [4, 0]
  - - [2048, 16, 1, 1024]
    - [5, 0]
  - - [2048, 16, 1, 65536]
    - [6, 0]
  - - [16, 2048, 1, 1024]
    - [7, 0]
  - - [16, 16, 1, 1024]
    - [8, 0]
  - - [16, 16, 1, 8192]
    - [9, 0]
  - - [16, 16, 1, 65536]
    - [10, 0]
- 
- 
- DeviceEfficiency
- Equality
