library/src/amd_detail/rocblaslt/src/Tensile/Logic/asm_full/aquavanjaram/gfx942/Equality/aquavanjaram_Cijk_Alik_Bljk_BBS_BH_Bias_HAS_SAV_UserArgs.yaml
- {MinimumRequiredVersion: 4.33.0}
- aquavanjaram
- gfx942
- [Device 0049, Device 0050]
    SolutionIndex: -1
    SolutionIndex: 0
    SolutionNameMin: Cijk_Alik_Bljk_BBS_BH_UserArgs_MT256x192x64_MI16x16x1_SN_GSU1_MIWT8_6_SS1_SU8_SUM0_SUS128_SVW8_WGM0
    SolutionIndex: 1
    SolutionNameMin: Cijk_Alik_Bljk_BBS_BH_UserArgs_MT16x16x256_MI16x16x1_SN_GSU1_MIWT1_1_NEPBS0_SU0_SUM0_SUS0_WGM1
    SolutionIndex: 2
    SolutionNameMin: Cijk_Alik_Bljk_BBS_BH_UserArgs_MT16x16x256_MI16x16x1_SN_GSU1_MIWT1_1_NEPBS16_SU0_SUM0_SUS0_WGM0
    SolutionIndex: 3
    SolutionNameMin: Cijk_Alik_Bljk_BBS_BH_UserArgs_MT256x208x64_MI16x16x1_SN_GSU1_MIWT4_13_NEPBS0_SU32_SUM0_SUS256_WGM0
    SolutionIndex: 4
    SolutionNameMin: Cijk_Alik_Bljk_BBS_BH_UserArgs_MT64x96x128_MI16x16x1_SN_GSU1_MIWT2_3_NEPBS16_SU8_SUM1_SUS1024_WGM16
    SolutionIndex: 5
    SolutionNameMin: Cijk_Alik_Bljk_BBS_BH_UserArgs_MT128x16x64_MI16x16x1_SN_GSU1_MIWT2_1_NEPBS16_SU4_SUM1_SUS128_WGM0
    SolutionIndex: 6
    SolutionNameMin: Cijk_Alik_Bljk_BBS_BH_UserArgs_MT16x16x256_MI16x16x1_SN_GSU6_MIWT1_1_NEPBS16_SU0_SUM0_SUS0_WGM1
    SolutionIndex: 7
    SolutionNameMin: Cijk_Alik_Bljk_BBS_BH_UserArgs_MT128x16x64_MI16x16x1_SN_GSU1_MIWT2_1_NEPBS0_SU4_SUM1_SUS256_WGM1
    SolutionIndex: 8
    SolutionNameMin: Cijk_Alik_Bljk_BBS_BH_UserArgs_MT256x192x64_MI16x16x1_SN_GSU1_MIWT8_6_NEPBS0_SU8_SUM0_SUS256_WGM0
    SolutionIndex: 9
    SolutionNameMin: Cijk_Alik_Bljk_BBS_BH_UserArgs_MT16x16x256_MI16x16x1_SN_GSU6_MIWT1_1_NEPBS0_SU0_SUM0_SUS0_WGM1
    SolutionIndex: 10
    SolutionNameMin: Cijk_Alik_Bljk_BBS_BH_UserArgs_MT128x48x128_MI16x16x1_SN_GSU1_MIWT2_3_NEPBS16_SU0_SUM0_SUS0_WGM16
    SolutionIndex: 11
    SolutionNameMin: Cijk_Alik_Bljk_BBS_BH_UserArgs_MT32x16x256_MI16x16x1_SN_GSU1_MIWT1_1_NEPBS0_SU0_SUM0_SUS0_WGM1
    SolutionIndex: 12
    SolutionNameMin: Cijk_Alik_Bljk_BBS_BH_UserArgs_MT128x64x64_MI16x16x1_SN_GSU1_MIWT4_2_NEPBS16_SU32_SUM0_SUS1024_WGM0
    SolutionIndex: 13
    SolutionNameMin: Cijk_Alik_Bljk_BBS_BH_UserArgs_MT32x16x128_MI16x16x1_SN_GSU1_MIWT1_1_NEPBS16_SU0_SUM0_SUS0_WGM1
    SolutionIndex: 14
    SolutionNameMin: Cijk_Alik_Bljk_BBS_BH_UserArgs_MT64x32x128_MI16x16x1_SN_GSU1_MIWT2_1_NEPBS16_SU16_SUM1_SUS1024_WGM4
    SolutionIndex: 15
    SolutionNameMin: Cijk_Alik_Bljk_BBS_BH_UserArgs_MT128x64x64_MI16x16x1_SN_GSU11_MIWT4_2_NEPBS0_SU0_SUM0_SUS0_WGM1
    SolutionIndex: 16
    SolutionNameMin: Cijk_Alik_Bljk_BBS_BH_UserArgs_MT64x32x128_MI16x16x1_SN_GSU1_MIWT2_1_NEPBS0_SU32_SUM1_SUS1024_WGM4
    SolutionIndex: 17
    SolutionNameMin: Cijk_Alik_Bljk_BBS_BH_UserArgs_MT64x64x128_MI16x16x1_SN_GSU1_MIWT2_2_NEPBS16_SU16_SUM0_SUS1024_WGM32
    SolutionIndex: 18
    SolutionNameMin: Cijk_Alik_Bljk_BBS_BH_UserArgs_MT64x64x64_MI16x16x1_SN_GSU1_MIWT2_2_NEPBS0_SU8_SUM0_SUS128_WGM32
    SolutionIndex: 19
    SolutionNameMin: Cijk_Alik_Bljk_BBS_BH_UserArgs_MT80x128x64_MI16x16x1_SN_GSU1_MIWT5_2_NEPBS16_SU4_SUM1_SUS256_WGM32
    SolutionIndex: 20
    SolutionNameMin: Cijk_Alik_Bljk_BBS_BH_UserArgs_MT32x16x128_MI16x16x1_SN_GSU1_MIWT1_1_NEPBS0_SU0_SUM0_SUS0_WGM1
    SolutionIndex: 21
    SolutionNameMin: Cijk_Alik_Bljk_BBS_BH_UserArgs_MT64x64x64_MI16x16x1_SN_GSU9_MIWT4_1_NEPBS16_SU4_SUM1_SUS256_WGM16
    SolutionIndex: 22
    SolutionNameMin: Cijk_Alik_Bljk_BBS_BH_UserArgs_MT64x64x64_MI16x16x1_SN_GSU9_MIWT4_1_NEPBS0_SU4_SUM1_SUS512_WGM32
    SolutionIndex: 23
    SolutionNameMin: Cijk_Alik_Bljk_BBS_BH_UserArgs_MT64x64x64_MI16x16x1_SN_GSU9_MIWT4_1_NEPBS0_SU8_SUM1_SUS128_WGM32
    SolutionIndex: 24
    SolutionNameMin: Cijk_Alik_Bljk_BBS_BH_UserArgs_MT64x32x64_MI16x16x1_SN_GSU1_MIWT2_1_NEPBS16_SU8_SUM1_SUS512_WGM16
    SolutionIndex: 25
    SolutionNameMin: Cijk_Alik_Bljk_BBS_BH_UserArgs_MT32x32x128_MI16x16x1_SN_GSU1_MIWT1_1_NEPBS16_SU8_SUM1_SUS1024_WGM16
    SolutionIndex: 26
    SolutionNameMin: Cijk_Alik_Bljk_BBS_BH_UserArgs_MT64x32x256_MI16x16x1_SN_GSU1_MIWT2_1_NEPBS0_SU32_SUM0_SUS512_WGM8
    SolutionIndex: 27
    SolutionNameMin: Cijk_Alik_Bljk_BBS_BH_UserArgs_MT80x256x64_MI16x16x1_SN_GSU1_MIWT5_4_NEPBS0_SU32_SUM0_SUS256_WGM32
    SolutionIndex: 28
    SolutionNameMin: Cijk_Alik_Bljk_BBS_BH_UserArgs_MT128x96x64_MI16x16x1_SN_GSU1_MIWT2_6_NEPBS0_SU4_SUM0_SUS512_WGM0
    SolutionIndex: 29
    SolutionNameMin: Cijk_Alik_Bljk_BBS_BH_UserArgs_MT64x128x128_MI16x16x1_SN_GSU1_MIWT4_2_NEPBS16_SU0_SUM0_SUS0_WGM8
    SolutionIndex: 30
    SolutionNameMin: Cijk_Alik_Bljk_BBS_BH_UserArgs_MT256x224x64_MI16x16x1_SN_GSU1_MIWT8_7_NEPBS0_SU8_SUM0_SUS128_WGM0
    SolutionIndex: 31
    SolutionNameMin: Cijk_Alik_Bljk_BBS_BH_UserArgs_MT256x64x64_MI16x16x1_SN_GSU1_MIWT8_2_NEPBS0_SU16_SUM0_SUS128_WGM0
    SolutionIndex: 32
    SolutionNameMin: Cijk_Alik_Bljk_BBS_BH_UserArgs_MT128x16x64_MI16x16x1_SN_GSU1_MIWT2_1_NEPBS0_SU4_SUM1_SUS128_WGM0
    SolutionIndex: 33
    SolutionNameMin: Cijk_Alik_Bljk_BBS_BH_UserArgs_MT448x32x64_MI16x16x1_SN_GSU1_MIWT14_1_NEPBS0_SU4_SUM1_SUS128_WGM1
    SolutionIndex: 34
    SolutionNameMin: Cijk_Alik_Bljk_BBS_BH_UserArgs_MT16x16x256_MI16x16x1_SN_GSU6_MIWT1_1_NEPBS16_SU0_SUM0_SUS0_WGM0
    SolutionIndex: 35
    SolutionNameMin: Cijk_Alik_Bljk_BBS_BH_UserArgs_MT16x32x256_MI16x16x1_SN_GSU1_MIWT1_1_NEPBS16_SU0_SUM0_SUS0_WGM1
    SolutionIndex: 36
    SolutionNameMin: Cijk_Alik_Bljk_BBS_BH_UserArgs_MT128x128x64_MI16x16x1_SN_GSU1_MIWT4_4_NEPBS0_SU8_SUM0_SUS128_WGM4
    SolutionIndex: 37
    SolutionNameMin: Cijk_Alik_Bljk_BBS_BH_UserArgs_MT64x64x64_MI16x16x1_SN_GSU1_MIWT2_2_NEPBS0_SU8_SUM1_SUS1024_WGM4
    SolutionIndex: 38
    SolutionNameMin: Cijk_Alik_Bljk_BBS_BH_UserArgs_MT128x64x64_MI16x16x1_SN_GSU9_MIWT2_4_NEPBS16_SU4_SUM0_SUS256_WGM0
    SolutionIndex: 39
    SolutionNameMin: Cijk_Alik_Bljk_BBS_BH_UserArgs_MT64x64x64_MI16x16x1_SN_GSU1_MIWT2_2_NEPBS16_SU32_SUM1_SUS1024_WGM16
    SolutionIndex: 40
    SolutionNameMin: Cijk_Alik_Bljk_BBS_BH_UserArgs_MT128x64x128_MI16x16x1_SN_GSU1_MIWT2_4_NEPBS16_SU0_SUM0_SUS0_WGM16
    SolutionIndex: 41
    SolutionNameMin: Cijk_Alik_Bljk_BBS_BH_UserArgs_MT128x64x64_MI16x16x1_SN_GSU1_MIWT8_1_NEPBS16_SU4_SUM0_SUS128_WGM8
    SolutionIndex: 42
    SolutionNameMin: Cijk_Alik_Bljk_BBS_BH_UserArgs_MT160x128x64_MI16x16x1_SN_GSU1_MIWT5_4_NEPBS16_SU16_SUM0_SUS512_WGM8
    SolutionIndex: 43
    SolutionNameMin: Cijk_Alik_Bljk_BBS_BH_UserArgs_MT32x16x128_MI16x16x1_SN_GSU1_MIWT1_1_NEPBS16_SU0_SUM0_SUS0_WGM0
    SolutionIndex: 44
    SolutionNameMin: Cijk_Alik_Bljk_BBS_BH_UserArgs_MT128x48x128_MI16x16x1_SN_GSU7_MIWT2_3_NEPBS16_SU4_SUM1_SUS256_WGM1
    SolutionIndex: 45
    SolutionNameMin: Cijk_Alik_Bljk_BBS_BH_UserArgs_MT128x128x64_MI16x16x1_SN_GSU7_MIWT4_4_NEPBS0_SU4_SUM0_SUS128_WGM0
    SolutionIndex: 46
    SolutionNameMin: Cijk_Alik_Bljk_BBS_BH_UserArgs_MT128x64x64_MI16x16x1_SN_GSU9_MIWT2_4_NEPBS0_SU4_SUM1_SUS128_WGM1
    SolutionIndex: 47
    SolutionNameMin: Cijk_Alik_Bljk_BBS_BH_UserArgs_MT64x64x64_MI16x16x1_SN_GSU1_MIWT2_2_NEPBS0_SU32_SUM0_SUS128_WGM8
    SolutionIndex: 48
    SolutionNameMin: Cijk_Alik_Bljk_BBS_BH_UserArgs_MT64x32x256_MI16x16x1_SN_GSU1_MIWT2_1_NEPBS0_SU0_SUM0_SUS0_WGM16
    SolutionIndex: 49
    SolutionNameMin: Cijk_Alik_Bljk_BBS_BH_UserArgs_MT64x64x128_MI16x16x1_SN_GSU1_MIWT2_2_NEPBS16_SU32_SUM0_SUS512_WGM16
    SolutionIndex: 50
    SolutionNameMin: Cijk_Alik_Bljk_BBS_BH_UserArgs_MT256x128x64_MI16x16x1_SN_GSU1_MIWT4_8_NEPBS0_SU4_SUM0_SUS128_WGM4
    SolutionIndex: 51
    SolutionNameMin: Cijk_Alik_Bljk_BBS_BH_UserArgs_MT128x64x64_MI16x16x1_SN_GSU1_MIWT4_2_NEPBS0_SU8_SUM1_SUS128_WGM16
    SolutionIndex: 52
    SolutionNameMin: Cijk_Alik_Bljk_BBS_BH_UserArgs_MT128x96x64_MI16x16x1_SN_GSU7_MIWT2_6_NEPBS16_SU4_SUM0_SUS128_WGM0
    SolutionIndex: 53
    SolutionNameMin: Cijk_Alik_Bljk_BBS_BH_UserArgs_MT128x128x64_MI16x16x1_SN_GSU1_MIWT8_2_NEPBS0_SU4_SUM1_SUS512_WGM4
    SolutionIndex: 54
    SolutionNameMin: Cijk_Alik_Bljk_BBS_BH_UserArgs_MT128x128x64_MI16x16x1_SN_GSU1_MIWT4_4_NEPBS0_SU4_SUM0_SUS1024_WGM8
    SolutionIndex: 55
    SolutionNameMin: Cijk_Alik_Bljk_BBS_BH_UserArgs_MT64x32x128_MI16x16x1_SN_GSU1_MIWT2_1_NEPBS0_SU4_SUM0_SUS1024_WGM8
    SolutionIndex: 56
    SolutionNameMin: Cijk_Alik_Bljk_BBS_BH_UserArgs_MT128x128x64_MI16x16x1_SN_GSU5_MIWT4_4_NEPBS0_SU8_SUM0_SUS128_WGM0
    SolutionIndex: 57
    SolutionNameMin: Cijk_Alik_Bljk_BBS_BH_UserArgs_MT64x32x128_MI16x16x1_SN_GSU1_MIWT1_2_NEPBS16_SU0_SUM0_SUS0_WGM8
    SolutionIndex: 58
    SolutionNameMin: Cijk_Alik_Bljk_BBS_BH_UserArgs_MT128x64x64_MI16x16x1_SN_GSU1_MIWT2_4_NEPBS0_SU16_SUM1_SUS1024_WGM8
    SolutionIndex: 59
    SolutionNameMin: Cijk_Alik_Bljk_BBS_BH_UserArgs_MT64x64x128_MI16x16x1_SN_GSU1_MIWT2_2_NEPBS0_SU0_SUM0_SUS0_WGM4
    SolutionIndex: 60
    SolutionNameMin: Cijk_Alik_Bljk_BBS_BH_UserArgs_MT128x64x128_MI16x16x1_SN_GSU1_MIWT2_4_NEPBS0_SU4_SUM0_SUS512_WGM32
    SolutionIndex: 61
    SolutionNameMin: Cijk_Alik_Bljk_BBS_BH_UserArgs_MT256x224x64_MI16x16x1_SN_GSU1_MIWT8_7_NEPBS16_SU4_SUM1_SUS128_WGM4
    SolutionIndex: 62
    SolutionNameMin: Cijk_Alik_Bljk_BBS_BH_UserArgs_MT32x16x256_MI16x16x1_SN_GSU1_MIWT1_1_NEPBS16_SU0_SUM0_SUS0_WGM0
    SolutionIndex: 63
    SolutionNameMin: Cijk_Alik_Bljk_BBS_BH_Bias_HAS_SAV_UserArgs_MT64x128x64_MI16x16x1_SN_GSU1_LBSPPA512_LPA16_LPB16_LRVW8_MIWT4_2_SU32_SUM1_SUS128_SVW4_VWA4_WG16_16_1_WGM8
    SolutionIndex: 64
    SolutionNameMin: Cijk_Alik_Bljk_BBS_BH_Bias_HAS_SAB_SAV_UserArgs_MT32x16x512_MI16x16x1_SN_LDSB1_GSU1_GSUAMB_LBSPPA1024_LBSPPB1024_MIWT1_1_NTA7_NTD0_NEPBS0_SS0_SU8_SUM0_SUS1024_SVW4_VWA1_WG32_4_1_WGM0
    SolutionIndex: 65
    SolutionNameMin: Cijk_Alik_Bljk_BBS_BH_Bias_HAS_SAB_SAV_UserArgs_MT32x16x512_MI16x16x1_SN_LDSB1_GSU1_GSUAMBSK_LBSPPA1024_LBSPPB1024_MIWT1_1_NTA7_NTD0_NEPBS16_SS0_SU0_SUM0_SUS0_SVW4_VWA1_WG32_4_1_WGM1
    SolutionIndex: 66
    SolutionNameMin: Cijk_Alik_Bljk_BBS_BH_Bias_HAS_SAB_SAV_UserArgs_MT32x16x512_MI16x16x1_SN_LDSB1_GSU1_GSUAMB_LBSPPA1024_LBSPPB1024_MIWT1_1_NTA7_NTD0_NEPBS0_SS0_SU0_SUM0_SUS0_SVW4_VWA1_WG32_4_1_WGM1
    SolutionIndex: 67
    SolutionNameMin: Cijk_Alik_Bljk_BBS_BH_Bias_HAS_SAB_SAV_UserArgs_MT128x48x128_MI16x16x1_SN_LDSB1_GSU8_GSUAMB_LBSPPA512_LBSPPB256_MIWT2_3_NTA7_NTD7_NEPBS0_SS1_SU8_SUM1_SUS256_SVW2_VWA2_WG64_4_1_WGM0
    SolutionIndex: 68
    SolutionNameMin: Cijk_Alik_Bljk_BBS_BH_Bias_HAS_SAB_SAV_UserArgs_MT128x64x128_MI16x16x1_SN_LDSB1_GSU8_GSUAMB_LBSPPA1024_LBSPPB256_MIWT4_2_NTA0_NTD7_NEPBS0_SS1_SU8_SUM1_SUS256_SVW4_VWA4_WG32_8_1_WGM0
    SolutionIndex: 69
    SolutionNameMin: Cijk_Alik_Bljk_BBS_BH_Bias_HAS_SAB_SAV_UserArgs_MT128x96x128_MI16x16x1_SN_LDSB1_GSU8_GSUAMB_LBSPPA512_LBSPPB256_MIWT2_6_NTA0_NTD7_NEPBS0_SS1_SU0_SUM0_SUS0_SVW2_VWA2_WG64_4_1_WGM1
    SolutionIndex: 70
    SolutionNameMin: Cijk_Alik_Bljk_BBS_BH_Bias_HAS_SAB_SAV_UserArgs_MT16x16x256_MI16x16x1_SN_LDSB1_GSU8_GSUAMBSK_LBSPPA512_LBSPPB512_MIWT1_1_NTA7_NTD0_NEPBS0_SS0_SU0_SUM0_SUS0_SVW4_VWA1_WG16_4_1_WGM0
    SolutionIndex: 71
    SolutionNameMin: Cijk_Alik_Bljk_BBS_BH_Bias_HAS_SAB_SAV_UserArgs_MT64x16x256_MI16x16x1_SN_LDSB1_GSU8_GSUAMBSK_LBSPPA1024_LBSPPB512_MIWT2_1_NTA0_NTD0_NEPBS0_SS0_SU0_SUM0_SUS0_SVW8_VWA2_WG32_4_1_WGM1
    SolutionIndex: 72
    SolutionNameMin: Cijk_Alik_Bljk_BBS_BH_Bias_HAS_SAB_SAV_UserArgs_MT64x32x256_MI16x16x1_SN_LDSB1_GSU8_GSUAMB_LBSPPA1024_LBSPPB512_MIWT2_2_NTA7_NTD7_NEPBS16_SS1_SU0_SUM0_SUS0_SVW2_VWA2_WG32_4_1_WGM0
    SolutionIndex: 73
    SolutionNameMin: Cijk_Alik_Bljk_BBS_BH_Bias_HAS_SAB_SAV_UserArgs_MT64x64x128_MI16x16x1_SN_LDSB1_GSU8_GSUAMB_LBSPPA512_LBSPPB256_MIWT2_2_NTA7_NTD7_NEPBS0_SS1_SU8_SUM1_SUS256_SVW2_VWA2_WG32_8_1_WGM1
    SolutionIndex: 74
    SolutionNameMin: Cijk_Alik_Bljk_BBS_BH_Bias_HAS_SAB_SAV_UserArgs_MT128x48x128_MI16x16x1_SN_LDSB1_GSU8_GSUAMB_LBSPPA512_LBSPPB256_MIWT2_3_NTA0_NTD7_NEPBS0_SS1_SU8_SUM1_SUS256_SVW2_VWA2_WG64_4_1_WGM0
    SolutionIndex: 75
    SolutionNameMin: Cijk_Alik_Bljk_BBS_BH_Bias_HAS_SAB_SAV_UserArgs_MT32x16x512_MI16x16x1_SN_LDSB1_GSU1_GSUAMBSK_LBSPPA1024_LBSPPB1024_MIWT1_1_NTA7_NTD0_NEPBS16_SS1_SU8_SUM1_SUS1024_SVW1_VWA1_WG32_4_1_WGM0
    SolutionIndex: 76
    SolutionNameMin: Cijk_Alik_Bljk_BBS_BH_Bias_HAS_SAB_SAV_UserArgs_MT32x16x512_MI16x16x1_SN_LDSB1_GSU1_GSUAMBSK_LBSPPA1024_LBSPPB1024_MIWT1_1_NTA7_NTD0_NEPBS16_SS0_SU8_SUM1_SUS1024_SVW4_VWA1_WG32_4_1_WGM1
    SolutionIndex: 77
    SolutionNameMin: Cijk_Alik_Bljk_BBS_BH_Bias_HAS_SAB_SAV_UserArgs_MT32x16x512_MI16x16x1_SN_LDSB1_GSU1_GSUAMBSK_LBSPPA1024_LBSPPB1024_MIWT1_1_NTA7_NTD0_NEPBS0_SS0_SU8_SUM1_SUS1024_SVW4_VWA1_WG32_4_1_WGM1
    SolutionIndex: 78
    SolutionNameMin: Cijk_Alik_Bljk_BBS_BH_Bias_HAS_SAB_SAV_UserArgs_MT32x16x512_MI16x16x1_SN_LDSB1_GSU1_GSUAMBSK_LBSPPA1024_LBSPPB1024_MIWT1_1_NTA7_NTD0_NEPBS16_SS1_SU0_SUM0_SUS0_SVW1_VWA1_WG32_4_1_WGM0
    SolutionIndex: 79
    SolutionNameMin: Cijk_Alik_Bljk_BBS_BH_Bias_HAS_SAB_SAV_UserArgs_MT64x32x256_MI16x16x1_SN_LDSB1_GSU1_GSUAMBSK_LBSPPA1024_LBSPPB512_MIWT2_1_NTA7_NTD0_NEPBS16_SS1_SU8_SUM1_SUS512_SVW2_VWA2_WG32_8_1_WGM1
    SolutionIndex: 80
    SolutionNameMin: Cijk_Alik_Bljk_BBS_BH_Bias_HAS_SAB_SAV_UserArgs_MT64x64x128_MI16x16x1_SN_LDSB1_GSU1_GSUAMBSK_LBSPPA1024_LBSPPB256_MIWT4_1_NTA0_NTD7_NEPBS0_SS1_SU8_SUM1_SUS256_SVW4_VWA4_WG16_16_1_WGM1
    SolutionIndex: 81
    SolutionNameMin: Cijk_Alik_Bljk_BBS_BH_Bias_HAS_SAB_SAV_UserArgs_MT128x48x128_MI16x16x1_SN_LDSB1_GSU1_GSUAMBSK_LBSPPA512_LBSPPB256_MIWT2_3_NTA0_NTD7_NEPBS16_SS1_SU8_SUM0_SUS256_SVW2_VWA2_WG64_4_1_WGM1
    SolutionIndex: 82
    SolutionNameMin: Cijk_Alik_Bljk_BBS_BH_Bias_HAS_SAB_SAV_UserArgs_MT64x32x256_MI16x16x1_SN_LDSB1_GSU1_GSUAMBSK_LBSPPA1024_LBSPPB512_MIWT2_2_NTA7_NTD0_NEPBS16_SS1_SU8_SUM1_SUS512_SVW2_VWA2_WG32_4_1_WGM0
    SolutionIndex: 83
    SolutionNameMin: Cijk_Alik_Bljk_BBS_BH_Bias_HAS_SAB_SAV_UserArgs_MT32x16x512_MI16x16x1_SN_LDSB1_GSU1_GSUAMBSK_LBSPPA1024_LBSPPB1024_MIWT1_1_NTA7_NTD7_NEPBS0_SS0_SU8_SUM1_SUS1024_SVW4_VWA1_WG32_4_1_WGM0
    SolutionIndex: 84
    SolutionNameMin: Cijk_Alik_Bljk_BBS_BH_Bias_HAS_SAB_SAV_UserArgs_MT32x16x512_MI16x16x1_SN_LDSB1_GSU1_GSUAMBSK_LBSPPA1024_LBSPPB1024_MIWT1_1_NTA7_NTD0_NEPBS0_SS0_SU8_SUM0_SUS1024_SVW4_VWA1_WG32_4_1_WGM0
    SolutionIndex: 85
    SolutionNameMin: Cijk_Alik_Bljk_BBS_BH_Bias_HAS_SAB_SAV_UserArgs_MT32x16x512_MI16x16x1_SN_LDSB1_GSU1_GSUAMBSK_LBSPPA1024_LBSPPB1024_MIWT1_1_NTA7_NTD0_NEPBS0_SS0_SU0_SUM0_SUS0_SVW4_VWA1_WG32_4_1_WGM0
    SolutionIndex: 86
    SolutionNameMin: Cijk_Alik_Bljk_BBS_BH_Bias_HAS_SAB_SAV_UserArgs_MT32x16x512_MI16x16x1_SN_LDSB1_GSU1_GSUAMBSK_LBSPPA1024_LBSPPB1024_MIWT1_1_NTA7_NTD0_NEPBS16_SS0_SU8_SUM0_SUS1024_SVW4_VWA1_WG32_4_1_WGM0
    SolutionIndex: 87
    SolutionNameMin: Cijk_Alik_Bljk_BBS_BH_Bias_HAS_SAB_SAV_UserArgs_MT64x32x256_MI16x16x1_SN_LDSB1_GSU1_GSUAMBSK_LBSPPA1024_LBSPPB512_MIWT2_2_NTA7_NTD0_NEPBS0_SS0_SU8_SUM1_SUS512_SVW8_VWA2_WG32_4_1_WGM1
    SolutionIndex: 88
    SolutionNameMin: Cijk_Alik_Bljk_BBS_BH_Bias_HAS_SAB_SAV_UserArgs_MT64x48x128_MI16x16x1_SN_LDSB0_GSU1_GSUAMB_LBSPPA512_LBSPPB256_MIWT2_3_NTA0_NTD7_NEPBS0_SS0_SU8_SUM0_SUS256_SVW8_VWA2_WG32_4_1_WGM0
    SolutionIndex: 89
    SolutionNameMin: Cijk_Alik_Bljk_BBS_BH_Bias_HAS_SAV_UserArgs_MT16x16x256_MI16x16x1_SN_LDSB1_GRVWA8_GRVWB8_GSU6_GSUAMBSK_LBSPPA512_LBSPPB512_MIWT1_1_NTA7_SS0_SU8_SUM0_SUS512_SVW4_WG16_4_1_WGM8
    SolutionIndex: 90
    SolutionNameMin: Cijk_Alik_Bljk_BBS_BH_Bias_HAS_SAV_UserArgs_MT32x16x256_MI16x16x1_SN_GSU1_MIWT1_1_NTA7_SU32_SUM1_SUS512_WGM8
    SolutionIndex: 91
    SolutionNameMin: Cijk_Alik_Bljk_BBS_BH_Bias_HAS_SAV_UserArgs_MT32x16x256_MI16x16x1_SN_GSU1_MIWT1_1_NTA4_SU32_SUM1_SUS512_WGM8
    SolutionIndex: 92
    SolutionNameMin: Cijk_Alik_Bljk_BBS_BH_Bias_HAS_SAV_UserArgs_MT128x64x128_MI16x16x1_SN_LDSB1_GSU5_GSUAMB_LBSPPA1024_LBSPPB256_MIWT4_2_NTA4_NEPBS16_SU0_SUM0_SUS0_SVW4_VWA4_WG32_8_1_WGM8
    SolutionIndex: 93
    SolutionNameMin: Cijk_Alik_Bljk_BBS_BH_Bias_HAS_SAV_UserArgs_MT128x96x128_MI16x16x1_SN_LDSB1_GSU5_GSUAMB_LBSPPA512_LBSPPB256_MIWT2_6_NTA4_NEPBS16_SU0_SUM0_SUS0_SVW2_VWA2_WG64_4_1_WGM8
    SolutionIndex: 94
    SolutionNameMin: Cijk_Alik_Bljk_BBS_BH_Bias_HAS_SAV_UserArgs_MT64x32x256_MI16x16x1_SN_LDSB1_GRVWA8_GRVWB8_GSU1_LBSPPA1024_LBSPPB512_LPA16_LPB16_LRVW8_MIWT2_2_NTA7_NTD7_SS1_SU8_SUM1_SUS512_SVW2_VWA2_WG32_4_2_WGM0
    SolutionIndex: 95
    SolutionNameMin: Cijk_Alik_Bljk_BBS_BH_Bias_HAS_SAV_UserArgs_MT16x16x256_MI16x16x1_SN_GRVWA8_GRVWB8_GSU1_LBSPPA512_LBSPPB512_LPA16_LPB16_LRVW8_MIWT1_1_NTA0_NEPBS0_SU0_SUM0_SUS0_SVW1_VWA1_VWB1_WG16_4_1_WGM1_WGMXCC8
    SolutionIndex: 96
    SolutionNameMin: Cijk_Alik_Bljk_BBS_BH_Bias_HAS_SAV_UserArgs_MT16x16x256_MI16x16x1_SN_GRVWA8_GRVWB8_GSU1_LBSPPA512_LBSPPB512_LPA16_LPB16_LRVW8_MIWT1_1_NTA0_NEPBS0_SU0_SUM0_SUS0_SVW1_VWA1_VWB1_WG16_4_1_WGM1_WGMXCC1
    SolutionIndex: 97
    SolutionNameMin: Cijk_Alik_Bljk_BBS_BH_Bias_HAS_SAV_UserArgs_MT16x32x512_MI16x16x1_SN_GRVWA8_GRVWB8_GSU1_LBSPPA1024_LBSPPB1024_LPA16_LPB16_LRVW8_MIWT1_1_NTA4_NEPBS16_SU0_SUM0_SUS0_SVW1_VWA1_VWB1_WG16_8_1_WGM0_WGMXCC1
    SolutionIndex: 98
    SolutionNameMin: Cijk_Alik_Bljk_BBS_BH_Bias_HAS_SAV_UserArgs_MT16x16x256_MI16x16x1_SN_GRVWA8_GRVWB8_GSU1_LBSPPA512_LBSPPB512_LPA16_LPB16_LRVW8_MIWT1_1_NTA4_NEPBS0_SU0_SUM0_SUS0_SVW1_VWA1_VWB1_WG16_4_1_WGM0_WGMXCC1
    SolutionIndex: 99
    SolutionNameMin: Cijk_Alik_Bljk_BBS_BH_Bias_HAS_SAV_UserArgs_MT128x32x64_MI16x16x1_SN_GRVWA8_GRVWB8_GSU1_LBSPPA512_LBSPPB128_LPA16_LPB16_LRVW8_MIWT4_1_NTA0_NEPBS0_SU0_SUM0_SUS0_SVW4_VWA4_VWB1_WG32_8_1_WGM1_WGMXCC8
    SolutionIndex: 100
    SolutionNameMin: Cijk_Alik_Bljk_BBS_BH_Bias_HAS_SAV_UserArgs_MT128x32x32_MI16x16x1_SN_GRVWA4_GRVWB4_GSU1_LBSPPA256_LBSPPB128_LPA4_LPB4_LRVW4_MIWT4_1_NTA0_NEPBS0_SU8_SUM0_SUS64_SVW4_VWA4_VWB1_WG32_8_1_WGM8_WGMXCC8
    SolutionIndex: 101
    SolutionNameMin: Cijk_Alik_Bljk_BBS_BH_Bias_HAS_SAV_UserArgs_MT16x32x256_MI16x16x1_SN_GRVWA8_GRVWB8_GSU1_LBSPPA512_LBSPPB512_LPA16_LPB16_LRVW8_MIWT1_1_NTA4_NEPBS16_SU0_SUM0_SUS0_SVW1_VWA1_VWB1_WG16_8_1_WGM0_WGMXCC1
    SolutionIndex: 102
    SolutionNameMin: Cijk_Alik_Bljk_BBS_BH_Bias_HAS_SAV_UserArgs_MT16x32x256_MI16x16x1_SN_GRVWA8_GRVWB8_GSU1_LBSPPA512_LBSPPB512_LPA16_LPB16_LRVW8_MIWT1_1_NTA0_NEPBS16_SU8_SUM0_SUS512_SVW1_VWA1_VWB1_WG16_8_1_WGM0_WGMXCC8
    SolutionIndex: 103
    SolutionNameMin: Cijk_Alik_Bljk_BBS_BH_Bias_HAS_SAV_UserArgs_MT128x96x64_MI16x16x1_SN_GRVWA8_GRVWB8_GSU1_LBSPPA512_LBSPPB128_LPA16_LPB16_LRVW8_MIWT4_3_NTA0_NEPBS16_SU8_SUM0_SUS128_SVW4_VWA4_VWB1_WG32_8_1_WGM8_WGMXCC1
    SolutionIndex: 104
    SolutionNameMin: Cijk_Alik_Bljk_BBS_BH_Bias_HAS_SAV_UserArgs_MT16x32x256_MI16x16x1_SN_GRVWA8_GRVWB8_GSU1_LBSPPA512_LBSPPB512_LPA16_LPB16_LRVW8_MIWT1_1_NTA0_NEPBS16_SU0_SUM0_SUS0_SVW1_VWA1_VWB1_WG16_8_1_WGM1_WGMXCC8
    SolutionIndex: 105
    SolutionNameMin: Cijk_Alik_Bljk_BBS_BH_Bias_HAS_SAV_UserArgs_MT16x32x256_MI16x16x1_SN_GRVWA8_GRVWB8_GSU1_LBSPPA512_LBSPPB512_LPA16_LPB16_LRVW8_MIWT1_1_NTA0_NEPBS0_SU8_SUM0_SUS512_SVW1_VWA1_VWB1_WG16_8_1_WGM1_WGMXCC1
    SolutionIndex: 106
    SolutionNameMin: Cijk_Alik_Bljk_BBS_BH_Bias_HAS_SAV_UserArgs_MT16x32x32_MI16x16x1_SN_GRVWA4_GRVWB4_GSU1_LBSPPA128_LBSPPB128_LPA4_LPB4_LRVW4_MIWT1_1_NTA0_NEPBS16_SU0_SUM0_SUS0_SVW1_VWA1_VWB1_WG16_8_1_WGM1_WGMXCC8
    SolutionIndex: 107
    SolutionNameMin: Cijk_Alik_Bljk_BBS_BH_Bias_HAS_SAV_UserArgs_MT32x32x64_MI16x16x1_SN_GRVWA8_GRVWB8_GSU1_LBSPPA128_LBSPPB128_LPA16_LPB16_LRVW8_MIWT1_1_NTA0_NEPBS0_SU0_SUM0_SUS0_SVW1_VWA1_VWB1_WG32_8_1_WGM0_WGMXCC8
    SolutionIndex: 108
    SolutionNameMin: Cijk_Alik_Bljk_BBS_BH_Bias_HAS_SAV_UserArgs_MT16x32x64_MI16x16x1_SN_GRVWA8_GRVWB8_GSU1_LBSPPA128_LBSPPB128_LPA16_LPB16_LRVW8_MIWT1_1_NTA0_NEPBS16_SU0_SUM0_SUS0_SVW1_VWA1_VWB1_WG16_8_1_WGM1_WGMXCC8
    SolutionIndex: 109
    SolutionNameMin: Cijk_Alik_Bljk_BBS_BH_Bias_HAS_SAV_UserArgs_MT16x32x128_MI16x16x1_SN_GRVWA8_GRVWB8_GSU1_LBSPPA256_LBSPPB256_LPA16_LPB16_LRVW8_MIWT1_1_NTA0_NEPBS0_SU0_SUM0_SUS0_SVW1_VWA1_VWB1_WG16_8_1_WGM1_WGMXCC8
    SolutionIndex: 110
    SolutionNameMin: Cijk_Alik_Bljk_BBS_BH_Bias_HAS_SAV_UserArgs_MT64x16x64_MI16x16x1_SN_GRVWA8_GRVWB8_GSU1_LBSPPA256_LBSPPB128_LPA16_LPB16_LRVW8_MIWT2_1_NTA0_NEPBS16_SU0_SUM0_SUS0_SVW2_VWA2_VWB1_WG32_4_1_WGM0_WGMXCC8
    SolutionIndex: 111
    SolutionNameMin: Cijk_Alik_Bljk_BBS_BH_Bias_HAS_SAV_UserArgs_MT48x64x64_MI16x16x1_SN_GRVWA4_GRVWB8_GSU1_LBSPPA128_LBSPPB128_LPA16_LPB16_LRVW8_MIWT3_1_NTA0_NEPBS16_SU8_SUM0_SUS128_SVW1_VWA1_VWB1_WG16_16_1_WGM1_WGMXCC8
    SolutionIndex: 112
    SolutionNameMin: Cijk_Alik_Bljk_BBS_BH_Bias_HAS_SAV_UserArgs_MT128x64x64_MI16x16x1_SN_GRVWA8_GRVWB8_GSU1_LBSPPA256_LBSPPB512_LPA16_LPB16_LRVW8_MIWT2_4_NTA0_NEPBS0_SU8_SUM0_SUS128_SVW2_VWA2_VWB4_WG64_4_1_WGM1_WGMXCC8
    SolutionIndex: 113
    SolutionNameMin: Cijk_Alik_Bljk_BBS_BH_Bias_HAS_SAV_UserArgs_MT128x96x128_MI16x16x1_SN_GRVWA8_GRVWB8_GSU1_LBSPPA1024_LBSPPB256_LPA16_LPB16_LRVW8_MIWT4_3_NTA0_NEPBS16_SU8_SUM0_SUS256_SVW4_VWA4_VWB1_WG32_8_1_WGM8_WGMXCC1
    SolutionIndex: 114
    SolutionNameMin: Cijk_Alik_Bljk_BBS_BH_Bias_HAS_SAV_UserArgs_MT256x224x64_MI16x16x1_SN_GRVWA8_GRVWB8_GSU1_LPA4_LPB4_LRVW4_MIWT8_7_NEPBS16_SU8_SUM0_SUS256_SVW8_VWA8_WGM32_WGMXCC4_WGMXCCG304
    SolutionIndex: 115
    SolutionNameMin: Cijk_Alik_Bljk_BBS_BH_Bias_HAS_SAV_UserArgs_MT128x128x64_MI16x16x1_SN_GRVWA8_GRVWB8_GSU1_LPA4_LPB4_LRVW4_MIWT4_4_NEPBS16_SU8_SUM0_SUS256_SVW4_VWA4_WGM1_WGMXCC8_WGMXCCG304
    SolutionIndex: 116
    SolutionNameMin: Cijk_Alik_Bljk_BBS_BH_Bias_HAS_SAV_UserArgs_MT256x256x32_MI16x16x1_SN_GRVWA2_GRVWB2_GSU1_LPA4_LPB4_LRVW4_MIWT8_8_NEPBS0_SU8_SUM0_SUS256_SVW8_VWA8_WGM0_WGMXCC8_WGMXCCG0
    SolutionIndex: 117
    SolutionNameMin: Cijk_Alik_Bljk_BBS_BH_Bias_HAS_SAV_UserArgs_MT256x16x64_MI16x16x1_SN_GRVWA8_GRVWB4_GSU1_LPA16_LPB16_LRVW8_MIWT4_1_NTC0_NTD4_SU0_SUM0_SUS0_SPO1_SSO0_WG64_4_1_WGM1_WGMXCC4_WGMXCCG0
    SolutionIndex: 118
    SolutionNameMin: Cijk_Alik_Bljk_BBS_BH_Bias_HAS_SAV_UserArgs_MT256x224x64_MI16x16x1_SN_GRVWA2_GRVWB2_GSU1_LBSPPA512_LPA4_LPB4_LRVW4_MIWT8_7_SU8_SUM0_SUS256_SVW4_VWA4_WG32_8_1_WGM1
    SolutionIndex: 119
    SolutionNameMin: Cijk_Alik_Bljk_BBS_BH_Bias_HAS_SAV_UserArgs_MT256x256x32_MI16x16x1_SN_GRVWA4_GRVWB4_GSU1_LBSPPA512_LBSPPB512_LPA4_LPB4_LRVW4_MIWT8_8_NTC0_NTD4_NEPBS16_SU8_SUM0_SUS256_SSO4_SVW8_VWA8_VWB8_WG32_8_1_WGM32_WGMXCC8_WGMXCCG0
    SolutionIndex: 120
    SolutionNameMin: Cijk_Alik_Bljk_BBS_BH_Bias_HAS_SAV_UserArgs_MT192x224x64_MI16x16x1_SN_GRVWA8_GRVWB8_GSU1_LBSPPA256_LBSPPB128_LPA16_LPB16_LRVW8_MIWT6_7_NTC4_NTD4_NEPBS0_SU8_SUM0_SUS256_SSO0_SVW2_VWA2_VWB1_WG32_8_1_WGM32_WGMXCC8_WGMXCCG0
    SolutionIndex: 121
    SolutionNameMin: Cijk_Alik_Bljk_BBS_BH_Bias_HAS_SAV_UserArgs_MT128x128x32_MI16x16x1_SN_GRVWA4_GRVWB4_GSU1_LBSPPA256_LBSPPB256_LPA4_LPB4_LRVW4_MIWT4_4_NTC4_NTD0_NEPBS0_SU8_SUM0_SUS256_SSO0_SVW4_VWA4_VWB4_WG32_8_1_WGM0_WGMXCC8_WGMXCCG32
    SolutionIndex: 122
    SolutionNameMin: Cijk_Alik_Bljk_BBS_BH_Bias_HAS_SAV_UserArgs_MT256x128x32_MI16x16x1_SN_GRVWA4_GRVWB4_GSU1_LBSPPA512_LBSPPB256_LPA4_LPB4_LRVW4_MIWT8_4_NTC4_NTD4_NEPBS0_SU8_SUM0_SUS256_SSO4_SVW8_VWA8_VWB4_WG32_8_1_WGM32_WGMXCC32_WGMXCCG0
    SolutionIndex: 123
    SolutionNameMin: Cijk_Alik_Bljk_BBS_BH_Bias_HAS_SAV_UserArgs_MT128x96x128_MI16x16x1_SN_GSU8_LBSPPA512_LBSPPB512_MIWT2_6_NTC4_NTD7_SU0_SUM0_SUS0_SPO0_SSO0_SVW2_VWA2_VWB2_WSGRA2_WSGRB0_WG64_4_1_WGM0_WGMXCC8_WGMXCCG32
    SolutionIndex: 124
    SolutionNameMin: Cijk_Alik_Bljk_BBS_BH_Bias_HAS_SAV_UserArgs_MT128x128x64_MI16x16x1_SN_GSU1_MIWT8_2_SU0_SUM0_SUS0_WSGRA2_WSGRB2_WG16_16_1_WGM4_WGMXCC304_WGMXCCG0
    SolutionIndex: 125
    SolutionNameMin: Cijk_Alik_Bljk_BBS_BH_Bias_HAS_SAV_UserArgs_MT64x16x128_MI16x16x1_SN_LDSB0_GSU7_LBSPPA256_LBSPPB256_MIWT1_1_NTA4_SU0_SUM0_SUS0_SVW1_ULSGRO1_VWA1_WG64_4_1_WGM0_WGMXCC32_WGMXCCG0
    SolutionIndex: 126
    SolutionNameMin: Cijk_Alik_Bljk_BBS_BH_Bias_HAS_SAV_UserArgs_MT64x16x256_MI16x16x1_SN_GSU1_MIWT2_1_SU8_SUM1_SUS512_ULSGRO1_USL0_UIOFGRO1_USFGRO0_WGM38_WGMXCC38_WGMXCCG0
    SolutionIndex: 127
    SolutionNameMin: Cijk_Alik_Bljk_BBS_BH_Bias_HAS_SAV_UserArgs_MT32x16x128_MI16x16x1_SN_LDSB0_GSU1_LBSPPA256_LBSPPB256_MIWT1_1_NTA4_SU8_SUM1_SUS512_SVW1_ULSGRO0_VWA1_WG32_4_1_WGM1_WGMXCC8_WGMXCCG0
    SolutionIndex: 128
    SolutionNameMin: Cijk_Alik_Bljk_BBS_BH_Bias_HAS_SAV_UserArgs_MT64x16x256_MI16x16x1_SN_LDSB1_GSU1_LBSPPA1024_LBSPPB512_MIWT2_1_NTA4_SU8_SUM0_SUS512_SVW2_ULSGRO0_VWA2_WG32_4_1_WGM1_WGMXCC32_WGMXCCG0
    SolutionIndex: 129
    SolutionNameMin: Cijk_Alik_Bljk_BBS_BH_Bias_HAS_SAV_UserArgs_MT256x224x64_MI16x16x1_SN_GSU1_MIWT8_7_NEPBS0_SU8_SUM0_SUS128_SPO0_SSO0_ULSGRO1_WGM38_WGMXCC32_WGMXCCG0
    SolutionIndex: 130
    SolutionNameMin: Custom_Cijk_Alik_Bljk_BBS_BH_Bias_HAS_SAV_UserArgs_MT256x256x64_MI16x16x1_SN_K1_MIWT4_16_DTVA
    SolutionIndex: 131
    SolutionNameMin: Cijk_Alik_Bljk_BBS_BH_Bias_HAS_SAV_UserArgs_MT64x16x256_MI16x16x1_SN_GSU1_MIWT2_1_SU8_SUM1_SUS512_ULSGRO0_USL0_UIOFGRO0_USFGRO1_WGM0_WGMXCC1_WGMXCCG0
    SolutionIndex: 132
    SolutionNameMin: Cijk_Alik_Bljk_BBS_BH_Bias_HAS_SAV_UserArgs_MT128x128x64_MI16x16x1_SN_GRVWA8_GRVWB8_GSU2_LBSPPA1024_LBSPPB256_LPA16_LPB16_LRVW8_MIWT8_2_SU8_SUM0_SUS128_SVW8_ULSGRO1_VWA8_VWB2_WSGRA2_WSGRB2_WG16_16_1_WGM0_WGMXCC32_WGMXCCG0
    SolutionIndex: 133
    SolutionNameMin: Cijk_Alik_Bljk_BBS_BH_Bias_HAS_SAV_UserArgs_MT128x256x32_MI16x16x1_SN_GRVWA4_GRVWB4_GSU1_LBSPPA256_LBSPPB512_LPA4_LPB4_LRVW4_MIWT4_8_SU0_SUM0_SUS0_SVW4_ULSGRO1_VWA4_VWB8_WSGRA0_WSGRB0_WG32_8_1_WGM8_WGMXCC4_WGMXCCG4
    SolutionIndex: 134
    SolutionNameMin: Cijk_Alik_Bljk_BBS_BH_Bias_HAS_SAV_UserArgs_MT192x256x64_MI16x16x1_SN_GRVWA8_GRVWB8_GSU1_LBSPPA512_LBSPPB512_LPA16_LPB16_LRVW8_MIWT12_4_SU0_SUM0_SUS0_SVW4_ULSGRO1_VWA4_VWB4_WSGRA0_WSGRB0_WG16_16_1_WGM32_WGMXCC8_WGMXCCG0
    SolutionIndex: 135
    SolutionNameMin: Cijk_Alik_Bljk_BBS_BH_Bias_HAS_SAV_UserArgs_MT128x128x64_MI16x16x1_SN_GRVWA8_GRVWB8_GSU2_LBSPPA512_LBSPPB512_LPA16_LPB16_LRVW8_MIWT4_4_SU0_SUM0_SUS0_SVW4_ULSGRO0_VWA4_VWB4_WSGRA2_WSGRB0_WG32_8_1_WGM38_WGMXCC4_WGMXCCG304
    SolutionIndex: 136
    SolutionNameMin: Cijk_Alik_Bljk_BBS_BH_Bias_HAS_SAV_UserArgs_MT192x128x32_MI16x16x1_SN_GRVWA4_GRVWB4_GSU1_LBSPPA128_LBSPPB256_LPA4_LPB4_LRVW4_MIWT6_4_SU8_SUM0_SUS64_SVW2_ULSGRO1_VWA2_VWB4_WSGRA2_WSGRB2_WG32_8_1_WGM304_WGMXCC8_WGMXCCG0
    SolutionIndex: 137
    SolutionNameMin: Cijk_Alik_Bljk_BBS_BH_Bias_HAS_SAV_UserArgs_MT128x256x64_MI16x16x1_SN_GRVWA8_GRVWB8_GSU1_LBSPPA512_LBSPPB1024_LPA16_LPB16_LRVW8_MIWT4_8_SU0_SUM0_SUS0_SVW4_ULSGRO0_VWA4_VWB8_WSGRA0_WSGRB2_WG32_8_1_WGM1_WGMXCC8_WGMXCCG32
    SolutionIndex: 138
    SolutionNameMin: Cijk_Alik_Bljk_BBS_BH_Bias_HAS_SAV_UserArgs_MT192x256x64_MI16x16x1_SN_GRVWA8_GRVWB8_GSU1_LBSPPA512_LBSPPB512_LPA16_LPB16_LRVW8_MIWT12_4_SU8_SUM0_SUS128_SVW4_ULSGRO1_VWA4_VWB4_WSGRA0_WSGRB0_WG16_16_1_WGM32_WGMXCC32_WGMXCCG0
    SolutionIndex: 139
    SolutionNameMin: Cijk_Alik_Bljk_BBS_BH_Bias_HAS_SAV_UserArgs_MT256x96x64_MI16x16x1_SN_GRVWA8_GRVWB8_GSU6_LBSPPA512_LBSPPB256_LPA16_LPB16_LRVW8_MIWT4_6_SU0_SUM0_SUS0_SVW4_ULSGRO0_VWA4_VWB2_WSGRA0_WSGRB2_WG64_4_1_WGM0_WGMXCC32_WGMXCCG32
    SolutionIndex: 140
    SolutionNameMin: Cijk_Alik_Bljk_BBS_BH_Bias_HAS_SAV_UserArgs_MT192x128x64_MI16x16x1_SN_GRVWA8_GRVWB8_GSU6_LBSPPA256_LBSPPB512_LPA16_LPB16_LRVW8_MIWT6_4_SU8_SUM0_SUS128_SVW2_ULSGRO0_VWA2_VWB4_WSGRA0_WSGRB0_WG32_8_1_WGM1_WGMXCC32_WGMXCCG0
    SolutionIndex: 141
    SolutionNameMin: Cijk_Alik_Bljk_BBS_BH_Bias_HAS_SAV_UserArgs_MT256x96x64_MI16x16x1_SN_GRVWA8_GRVWB8_GSU6_LBSPPA512_LBSPPB256_LPA16_LPB16_LRVW8_MIWT4_6_SU0_SUM0_SUS0_SVW4_ULSGRO1_VWA4_VWB2_WSGRA0_WSGRB0_WG64_4_1_WGM0_WGMXCC1_WGMXCCG4
    SolutionIndex: 142
    SolutionNameMin: Cijk_Alik_Bljk_BBS_BH_Bias_HAS_SAV_UserArgs_MT192x128x64_MI16x16x1_SN_GRVWA8_GRVWB8_GSU6_LBSPPA256_LBSPPB512_LPA16_LPB16_LRVW8_MIWT6_4_SU0_SUM0_SUS0_SVW2_ULSGRO0_VWA2_VWB4_WSGRA0_WSGRB2_WG32_8_1_WGM4_WGMXCC32_WGMXCCG0
    SolutionIndex: 143
    SolutionNameMin: Cijk_Alik_Bljk_BBS_BH_Bias_HAS_SAV_UserArgs_MT192x128x64_MI16x16x1_SN_GRVWA8_GRVWB8_GSU6_LBSPPA256_LBSPPB512_LPA16_LPB16_LRVW8_MIWT6_4_SU0_SUM0_SUS0_SVW2_ULSGRO0_VWA2_VWB4_WSGRA0_WSGRB2_WG32_8_1_WGM1_WGMXCC32_WGMXCCG0
    SolutionIndex: 144
    SolutionNameMin: Cijk_Alik_Bljk_BBS_BH_Bias_HAS_SAV_UserArgs_MT256x96x64_MI16x16x1_SN_GRVWA8_GRVWB8_GSU6_LBSPPA512_LBSPPB256_LPA16_LPB16_LRVW8_MIWT4_6_SU8_SUM0_SUS128_SVW4_ULSGRO0_VWA4_VWB2_WSGRA0_WSGRB0_WG64_4_1_WGM0_WGMXCC1_WGMXCCG0
    SolutionIndex: 145
    SolutionNameMin: Custom_Cijk_Alik_Bljk_BBS_BH_Bias_HAS_SAV_UserArgs_MT256x256x64_MI16x16x1_SN_K1_MIWT4_16_DTVA
    SolutionIndex: 146
    SolutionNameMin: Custom_Cijk_Alik_Bljk_BBS_BH_Bias_HAS_SAV_UserArgs_MT256x256x64_MI16x16x1_SN_K1_MIWT4_16_DTVA
    SolutionIndex: 147
    SolutionNameMin: Cijk_Alik_Bljk_BBS_BH_Bias_HAS_SAV_UserArgs_MT64x16x256_MI16x16x1_SN_GSU1_K1_MIWT2_1_NTA7_SU8_SUM1_SUS512_ULSGRO1_USL0_UIOFGRO1_USFGRO0_WGM4_WGMXCC8_WGMXCCG32
    SolutionIndex: 148
    SolutionNameMin: Cijk_Alik_Bljk_BBS_BH_Bias_HAS_SAV_UserArgs_MT128x64x128_MI16x16x1_SN_LDSB1_GRVWA8_GRVWB8_GSU1_GSUC1_GSUWGMRR1_K1_LBSPPA1024_LBSPPB512_LPA16_LPB16_LRVW8_MIWT4_2_NTD4_SU16_SUM0_SUS256_SVW4_ULSGRO0_VWA4_VWB2_WG32_8_1_WGM1_WGMXCC1_WGMXCCG304
    SolutionIndex: 149
    SolutionNameMin: Cijk_Alik_Bljk_BBS_BH_Bias_HAS_SAV_UserArgs_MT64x64x128_MI16x16x1_SN_LDSB1_GRVWA8_GRVWB8_GSU1_GSUC1_GSUWGMRR1_K1_LBSPPA512_LBSPPB512_LPA16_LPB16_LRVW8_MIWT2_2_NTD0_SU0_SUM0_SUS0_SVW2_ULSGRO0_VWA2_VWB2_WG32_8_1_WGM1_WGMXCC1_WGMXCCG304
    SolutionIndex: 150
    SolutionNameMin: Cijk_Alik_Bljk_BBS_BH_Bias_HAS_SAV_UserArgs_MT128x64x128_MI16x16x1_SN_LDSB1_GRVWA8_GRVWB8_GSU1_GSUC1_GSUWGMRR1_K1_LBSPPA1024_LBSPPB512_LPA16_LPB16_LRVW8_MIWT4_2_NTD4_SU0_SUM0_SUS0_SVW4_ULSGRO1_VWA4_VWB2_WG32_8_1_WGM8_WGMXCC8_WGMXCCG304
    SolutionIndex: 151
    SolutionNameMin: Cijk_Alik_Bljk_BBS_BH_Bias_HAS_SAV_UserArgs_MT64x128x128_MI16x16x1_SN_LDSB1_GRVWA8_GRVWB8_GSU1_GSUC1_GSUWGMRR1_K1_LBSPPA1024_LBSPPB512_LPA16_LPB16_LRVW8_MIWT4_2_NTD0_SU16_SUM0_SUS256_SVW4_ULSGRO0_VWA4_VWB2_WG16_16_1_WGM4_WGMXCC1_WGMXCCG304
    SolutionIndex: 152
    SolutionNameMin: Cijk_Alik_Bljk_BBS_BH_Bias_HAS_SAV_UserArgs_MT64x64x128_MI16x16x1_SN_LDSB1_GRVWA8_GRVWB8_GSU1_GSUC1_GSUWGMRR1_K1_LBSPPA512_LBSPPB512_LPA16_LPB16_LRVW8_MIWT2_2_NTD4_SU16_SUM0_SUS256_SVW2_ULSGRO1_VWA2_VWB2_WG32_8_1_WGM1_WGMXCC1_WGMXCCG304
    SolutionIndex: 153
    SolutionNameMin: Cijk_Alik_Bljk_BBS_BH_Bias_HAS_SAV_UserArgs_MT64x64x64_MI16x16x1_SN_LDSB1_GRVWA8_GRVWB8_GSU1_GSUC1_GSUWGMRR1_K1_LBSPPA256_LBSPPB256_LPA16_LPB16_LRVW8_MIWT2_2_NTD0_SU16_SUM0_SUS128_SVW2_ULSGRO1_VWA2_VWB2_WG32_8_1_WGM1_WGMXCC1_WGMXCCG304
    SolutionIndex: 154
    SolutionNameMin: Cijk_Alik_Bljk_BBS_BH_Bias_HAS_SAV_UserArgs_MT64x64x128_MI16x16x1_SN_LDSB1_GRVWA8_GRVWB8_GSU1_GSUC1_GSUWGMRR1_K1_LBSPPA512_LBSPPB512_LPA16_LPB16_LRVW8_MIWT2_2_NTD4_SU16_SUM0_SUS256_SVW2_ULSGRO0_VWA2_VWB2_WG32_8_1_WGM1_WGMXCC1_WGMXCCG304
    SolutionIndex: 155
    SolutionNameMin: Cijk_Alik_Bljk_BBS_BH_Bias_HAS_SAV_UserArgs_MT64x32x256_MI16x16x1_SN_LDSB1_GRVWA8_GRVWB8_GSU2_GSUC1_GSUWGMRR1_K1_LBSPPA1024_LBSPPB512_LPA16_LPB16_LRVW8_MIWT2_1_NTD0_SU16_SUM1_SUS512_SVW2_ULSGRO0_VWA2_VWB1_WG32_8_1_WGM1_WGMXCC1_WGMXCCG304
    SolutionIndex: 156
    SolutionNameMin: Cijk_Alik_Bljk_BBS_BH_Bias_HAS_SAV_UserArgs_MT64x128x64_MI16x16x1_SN_LDSB1_GRVWA8_GRVWB8_GSU1_GSUC1_GSUWGMRR1_K1_LBSPPA512_LBSPPB256_LPA16_LPB16_LRVW8_MIWT4_2_NTD4_SU16_SUM1_SUS128_SVW4_ULSGRO1_VWA4_VWB2_WG16_16_1_WGM4_WGMXCC8_WGMXCCG304
    SolutionIndex: 157
    SolutionNameMin: Cijk_Alik_Bljk_BBS_BH_Bias_HAS_SAV_UserArgs_MT64x128x128_MI16x16x1_SN_LDSB1_GRVWA8_GRVWB8_GSU1_GSUC1_GSUWGMRR1_K1_LBSPPA1024_LBSPPB512_LPA16_LPB16_LRVW8_MIWT4_2_NTD4_SU16_SUM1_SUS256_SVW4_ULSGRO1_VWA4_VWB2_WG16_16_1_WGM8_WGMXCC1_WGMXCCG304
    SolutionIndex: 158
    SolutionNameMin: Cijk_Alik_Bljk_BBS_BH_Bias_HAS_SAV_UserArgs_MT128x64x128_MI16x16x1_SN_LDSB1_GRVWA8_GRVWB8_GSU1_GSUC1_GSUWGMRR1_K1_LBSPPA1024_LBSPPB512_LPA16_LPB16_LRVW8_MIWT4_2_NTD0_SU16_SUM0_SUS256_SVW4_ULSGRO1_VWA4_VWB2_WG32_8_1_WGM4_WGMXCC1_WGMXCCG304
    SolutionIndex: 159
    SolutionNameMin: Cijk_Alik_Bljk_BBS_BH_Bias_HAS_SAV_UserArgs_MT128x64x128_MI16x16x1_SN_LDSB1_GRVWA8_GRVWB8_GSU2_GSUC1_GSUWGMRR1_K1_LBSPPA1024_LBSPPB512_LPA16_LPB16_LRVW8_MIWT4_2_NTD0_SU16_SUM1_SUS256_SVW4_ULSGRO1_VWA4_VWB2_WG32_8_1_WGM8_WGMXCC8_WGMXCCG304
    SolutionIndex: 160
    SolutionNameMin: Cijk_Alik_Bljk_BBS_BH_Bias_HAS_SAV_UserArgs_MT128x64x128_MI16x16x1_SN_LDSB1_GRVWA8_GRVWB8_GSU1_GSUC1_GSUWGMRR1_K1_LBSPPA1024_LBSPPB512_LPA16_LPB16_LRVW8_MIWT4_2_NTD0_SU16_SUM0_SUS256_SVW4_ULSGRO0_VWA4_VWB2_WG32_8_1_WGM4_WGMXCC1_WGMXCCG304
    SolutionIndex: 161
    SolutionNameMin: Cijk_Alik_Bljk_BBS_BH_Bias_HAS_SAV_UserArgs_MT64x32x64_MI16x16x1_SN_LDSB0_GRVWA8_GRVWB8_GSU1_GSUC1_GSUWGMRR1_K1_LBSPPA256_LBSPPB128_LPA16_LPB16_LRVW8_MIWT2_1_NTD4_SU16_SUM0_SUS128_SVW2_ULSGRO1_VWA2_VWB1_WG32_8_1_WGM1_WGMXCC1_WGMXCCG304
    SolutionIndex: 162
    SolutionNameMin: Cijk_Alik_Bljk_BBS_BH_Bias_HAS_SAV_UserArgs_MT128x96x128_MI16x16x1_SN_LDSB1_GRVWA8_GRVWB8_GSU1_GSUC1_GSUWGMRR1_K1_LBSPPA512_LBSPPB512_LPA16_LPB16_LRVW8_MIWT2_6_NTD4_SU16_SUM1_SUS256_SVW2_ULSGRO1_VWA2_VWB2_WG64_4_1_WGM1_WGMXCC1_WGMXCCG304
    SolutionIndex: 163
    SolutionNameMin: Cijk_Alik_Bljk_BBS_BH_Bias_HAS_SAV_UserArgs_MT64x32x128_MI16x16x1_SN_LDSB1_GRVWA8_GRVWB8_GSU4_GSUC1_GSUWGMRR1_K1_LBSPPA512_LBSPPB256_LPA16_LPB16_LRVW8_MIWT2_1_NTD0_SU16_SUM1_SUS256_SVW2_ULSGRO1_VWA2_VWB1_WG32_8_1_WGM8_WGMXCC8_WGMXCCG304
    SolutionIndex: 164
    SolutionNameMin: Cijk_Alik_Bljk_BBS_BH_Bias_HAS_SAV_UserArgs_MT64x16x256_MI16x16x1_SN_LDSB1_GRVWA8_GRVWB8_GSU1_GSUC1_GSUWGMRR1_K1_LBSPPA512_LBSPPB512_LPA16_LPB16_LRVW8_MIWT1_1_NTD4_SU0_SUM0_SUS0_SVW1_ULSGRO0_VWA1_VWB1_WG64_4_1_WGM1_WGMXCC1_WGMXCCG304
    SolutionIndex: 165
    SolutionNameMin: Cijk_Alik_Bljk_BBS_BH_Bias_HAS_SAV_UserArgs_MT32x16x256_MI16x16x1_SN_LDSB1_GRVWA8_GRVWB8_GSU1_GSUC1_GSUWGMRR1_K1_LBSPPA512_LBSPPB512_LPA16_LPB16_LRVW8_MIWT1_1_NTD0_SU0_SUM0_SUS0_SVW1_ULSGRO0_VWA1_VWB1_WG32_4_1_WGM1_WGMXCC1_WGMXCCG304
    SolutionIndex: 166
    SolutionNameMin: Cijk_Alik_Bljk_BBS_BH_Bias_HAS_SAV_UserArgs_MT128x64x128_MI16x16x1_SN_LDSB1_GRVWA8_GRVWB8_GSU3_GSUC1_GSUWGMRR1_K1_LBSPPA1024_LBSPPB512_LPA16_LPB16_LRVW8_MIWT4_2_NTD0_SU0_SUM0_SUS0_SVW4_ULSGRO1_VWA4_VWB2_WG32_8_1_WGM1_WGMXCC1_WGMXCCG304
    SolutionIndex: 167
    SolutionNameMin: Cijk_Alik_Bljk_BBS_BH_Bias_HAS_SAV_UserArgs_MT256x128x64_MI16x16x1_SN_GRVWA8_GRVWB8_GSU1_GSUC1_GSUWGMRR1_K1_LBSPPA1024_LBSPPB512_LPA16_LPB16_LRVW8_MIWT8_4_NTD4_SU16_SUM0_SUS128_SVW8_ULSGRO1_VWA8_VWB4_WGM1_WGMXCC1_WGMXCCG304
    SolutionIndex: 168
    SolutionNameMin: Cijk_Alik_Bljk_BBS_BH_Bias_HAS_SAV_UserArgs_MT256x256x32_MI16x16x1_SN_GRVWA4_GRVWB4_GSU1_GSUC1_GSUWGMRR1_K1_LBSPPA512_LBSPPB512_LPA4_LPB4_LRVW4_MIWT8_8_NTD4_SU16_SUM0_SUS64_SVW8_ULSGRO0_VWA8_VWB8_WGM1_WGMXCC1_WGMXCCG304
    SolutionIndex: 169
    SolutionNameMin: Cijk_Alik_Bljk_BBS_BH_Bias_HAS_SAV_UserArgs_MT256x256x32_MI16x16x1_SN_GRVWA4_GRVWB4_GSU1_GSUC1_GSUWGMRR1_K1_LBSPPA512_LBSPPB512_LPA4_LPB4_LRVW4_MIWT8_8_NTD4_SU16_SUM0_SUS64_SVW8_ULSGRO0_VWA8_VWB8_WGM4_WGMXCC1_WGMXCCG304
    SolutionIndex: 170
    SolutionNameMin: Cijk_Alik_Bljk_BBS_BH_Bias_HAS_SAV_UserArgs_MT256x128x64_MI16x16x1_SN_GRVWA8_GRVWB8_GSU1_GSUC1_GSUWGMRR1_K1_LBSPPA1024_LBSPPB512_LPA16_LPB16_LRVW8_MIWT8_4_NTD4_SU16_SUM0_SUS128_SVW8_ULSGRO0_VWA8_VWB4_WGM8_WGMXCC1_WGMXCCG304
    SolutionIndex: 171
    SolutionNameMin: Cijk_Alik_Bljk_BBS_BH_Bias_HAS_SAV_UserArgs_MT256x256x32_MI16x16x1_SN_GRVWA4_GRVWB4_GSU1_GSUC1_GSUWGMRR1_K1_LBSPPA512_LBSPPB512_LPA4_LPB4_LRVW4_MIWT8_8_NTD4_SU16_SUM0_SUS64_SVW8_ULSGRO1_VWA8_VWB8_WGM1_WGMXCC1_WGMXCCG304
    SolutionIndex: 172
    SolutionNameMin: Cijk_Alik_Bljk_BBS_BH_Bias_HAS_SAV_UserArgs_MT256x160x64_MI16x16x1_SN_LDSB1_GRVWA8_GRVWB8_GSU1_GSUAMB_GSUC0_GSUWGMRR0_K1_LBSPPA1024_LBSPPB128_LPA16_LPB16_LRVW8_MIWT8_5_SU16_SUM1_SUS128_SVW8_ULSGRO1_VWA8_VWB1_WG32_8_1_WGM1_WGMXCC1
    SolutionIndex: 173
    SolutionNameMin: Cijk_Alik_Bljk_BBS_BH_Bias_HAS_SAV_UserArgs_MT64x32x64_MI16x16x1_SN_LDSB0_GRVWA8_GRVWB8_GSU3_GSUAMBSK_GSUC0_GSUWGMRR0_K1_LBSPPA256_LBSPPB128_LPA16_LPB16_LRVW8_MIWT2_1_SU16_SUM0_SUS128_SVW2_ULSGRO1_VWA2_VWB1_WG32_8_1_WGM1_WGMXCC1
    SolutionIndex: 174
    SolutionNameMin: Cijk_Alik_Bljk_BBS_BH_Bias_HAS_SAV_UserArgs_MT64x64x128_MI16x16x1_SN_LDSB1_GRVWA8_GRVWB8_GSU1_GSUAMBSK_GSUC0_GSUWGMRR0_K1_LBSPPA512_LBSPPB512_LPA16_LPB16_LRVW8_MIWT2_2_SU16_SUM1_SUS256_SVW2_ULSGRO1_VWA2_VWB2_WG32_8_1_WGM1_WGMXCC1
    SolutionIndex: 175
    SolutionNameMin: Cijk_Alik_Bljk_BBS_BH_Bias_HAS_SAV_UserArgs_MT32x16x64_MI16x16x1_SN_LDSB0_GRVWA8_GRVWB8_GSU3_GSUAMBSK_GSUC0_GSUWGMRR0_K1_LBSPPA128_LBSPPB128_LPA16_LPB16_LRVW8_MIWT1_1_SU16_SUM0_SUS128_SVW1_ULSGRO1_VWA1_VWB1_WG32_4_1_WGM1_WGMXCC1
    SolutionIndex: 176
    SolutionNameMin: Cijk_Alik_Bljk_BBS_BH_Bias_HAS_SAV_UserArgs_MT64x32x64_MI16x16x1_SN_LDSB0_GRVWA8_GRVWB8_GSU3_GSUAMBSK_GSUC0_GSUWGMRR0_K1_LBSPPA256_LBSPPB128_LPA16_LPB16_LRVW8_MIWT2_1_SU16_SUM1_SUS128_SVW2_ULSGRO1_VWA2_VWB1_WG32_8_1_WGM1_WGMXCC1
    SolutionIndex: 177
    SolutionNameMin: Cijk_Alik_Bljk_BBS_BH_Bias_HAS_SAV_UserArgs_MT32x16x64_MI16x16x1_SN_LDSB0_GRVWA8_GRVWB8_GSU4_GSUAMBSK_GSUC0_GSUWGMRR0_K1_LBSPPA128_LBSPPB128_LPA16_LPB16_LRVW8_MIWT1_1_SU16_SUM0_SUS128_SVW1_ULSGRO1_VWA1_VWB1_WG32_4_1_WGM1_WGMXCC1
    SolutionIndex: 178
    SolutionNameMin: Cijk_Alik_Bljk_BBS_BH_Bias_HAS_SAV_UserArgs_MT32x16x128_MI16x16x1_SN_LDSB0_GRVWA8_GRVWB8_GSU1_GSUAMB_GSUC0_GSUWGMRR0_K1_LBSPPA256_LBSPPB256_LPA16_LPB16_LRVW8_MIWT1_1_SU16_SUM1_SUS256_SVW1_ULSGRO1_VWA1_VWB1_WG32_4_1_WGM1_WGMXCC1
    SolutionIndex: 179
    SolutionNameMin: Cijk_Alik_Bljk_BBS_BH_Bias_HAS_SAV_UserArgs_MT64x32x256_MI16x16x1_SN_LDSB1_CLR1_GRVWA8_GRVWB8_GSU1_GSUC0_GSUWGMRR0_K1_LBSPPA1024_LBSPPB512_LPA16_LPB16_LRVW8_LSU1_MIWT2_1_NTD4_PLR1_SU0_SUM0_SUS0_SVW2_ULSGRO1_VWA2_VWB1_WG32_8_1_WGM1_WGMXCC1_WGMXCCG304
    SolutionIndex: 180
    SolutionNameMin: Cijk_Alik_Bljk_BBS_BH_Bias_HAS_SAV_UserArgs_MT64x32x256_MI16x16x1_SN_LDSB1_CLR1_GRVWA8_GRVWB8_GSU1_GSUC0_GSUWGMRR0_K1_LBSPPA1024_LBSPPB512_LPA16_LPB16_LRVW8_LSU1_MIWT2_1_NTD0_PLR1_SU16_SUM1_SUS512_SVW2_ULSGRO1_VWA2_VWB1_WG32_8_1_WGM1_WGMXCC1_WGMXCCG304
    SolutionIndex: 181
    SolutionNameMin: Cijk_Alik_Bljk_BBS_BH_Bias_HAS_SAV_UserArgs_MT32x32x256_MI16x16x1_SN_LDSB1_CLR1_GRVWA8_GRVWB8_GSU1_GSUC0_GSUWGMRR0_K1_LBSPPA1024_LBSPPB1024_LPA16_LPB16_LRVW8_LSU4_MIWT2_2_NTD4_PLR1_SU16_SUM0_SUS512_SVW2_ULSGRO0_VWA2_VWB2_WG16_4_4_WGM1_WGMXCC1_WGMXCCG304
    SolutionIndex: 182
    SolutionNameMin: Cijk_Alik_Bljk_BBS_BH_Bias_HAS_SAV_UserArgs_MT128x160x64_MI16x16x1_SN_LDSB1_CLR1_GRVWA8_GRVWB8_GSU1_GSUC0_GSUWGMRR0_K1_LBSPPA512_LBSPPB128_LPA16_LPB16_LRVW8_LSU1_MIWT4_5_NTD4_PLR1_SU16_SUM1_SUS128_SVW4_ULSGRO1_VWA4_VWB1_WG32_8_1_WGM1_WGMXCC1_WGMXCCG304
    SolutionIndex: 183
    SolutionNameMin: Cijk_Alik_Bljk_BBS_BH_Bias_HAS_SAV_UserArgs_MT32x16x256_MI16x16x1_SN_LDSB1_CLR1_GRVWA8_GRVWB8_GSU1_GSUC0_GSUWGMRR0_K1_LBSPPA512_LBSPPB512_LPA16_LPB16_LRVW8_LSU1_MIWT1_1_NTD4_PLR1_SU0_SUM0_SUS0_SVW1_ULSGRO0_VWA1_VWB1_WG32_4_1_WGM1_WGMXCC1_WGMXCCG304
    SolutionIndex: 184
    SolutionNameMin: Cijk_Alik_Bljk_BBS_BH_Bias_HAS_SAV_UserArgs_MT128x160x64_MI16x16x1_SN_LDSB1_CLR1_GRVWA8_GRVWB8_GSU1_GSUC0_GSUWGMRR0_K1_LBSPPA512_LBSPPB128_LPA16_LPB16_LRVW8_LSU1_MIWT4_5_NTD4_PLR1_SU16_SUM1_SUS128_SVW4_ULSGRO1_VWA4_VWB1_WG32_8_1_WGM1_WGMXCC8_WGMXCCG304
    SolutionIndex: 185
    SolutionNameMin: Cijk_Alik_Bljk_BBS_BH_Bias_HAS_SAV_UserArgs_MT64x32x128_MI16x16x1_SN_LDSB1_CLR1_GRVWA8_GRVWB8_GSU1_GSUC0_GSUWGMRR0_K1_LBSPPA512_LBSPPB256_LPA16_LPB16_LRVW8_LSU1_MIWT2_1_NTD4_PLR1_SU16_SUM0_SUS256_SVW2_ULSGRO0_VWA2_VWB1_WG32_8_1_WGM1_WGMXCC1_WGMXCCG304
    SolutionIndex: 186
    SolutionNameMin: Cijk_Alik_Bljk_BBS_BH_Bias_HAS_SAV_UserArgs_MT64x32x256_MI16x16x1_SN_LDSB1_CLR1_GRVWA8_GRVWB8_GSU1_GSUC0_GSUWGMRR0_K1_LBSPPA1024_LBSPPB512_LPA16_LPB16_LRVW8_LSU1_MIWT2_1_NTD0_PLR1_SU16_SUM0_SUS512_SVW2_ULSGRO0_VWA2_VWB1_WG32_8_1_WGM1_WGMXCC1_WGMXCCG304
    SolutionIndex: 187
    SolutionNameMin: Cijk_Alik_Bljk_BBS_BH_Bias_HAS_SAV_UserArgs_MT16x16x256_MI16x16x1_SN_LDSB1_CLR1_GRVWA8_GRVWB8_GSU1_GSUC0_GSUWGMRR0_K1_LBSPPA512_LBSPPB512_LPA16_LPB16_LRVW8_LSU4_MIWT1_1_NTD4_PLR1_SU0_SUM0_SUS0_SVW1_ULSGRO1_VWA1_VWB1_WG16_4_4_WGM1_WGMXCC1_WGMXCCG304
    SolutionIndex: 188
    SolutionNameMin: Cijk_Alik_Bljk_BBS_BH_Bias_HAS_SAV_UserArgs_MT16x16x256_MI16x16x1_SN_LDSB1_CLR1_GRVWA8_GRVWB8_GSU1_GSUC0_GSUWGMRR0_K1_LBSPPA512_LBSPPB512_LPA16_LPB16_LRVW8_LSU4_MIWT1_1_NTD4_PLR1_SU16_SUM0_SUS512_SVW1_ULSGRO1_VWA1_VWB1_WG16_4_4_WGM1_WGMXCC1_WGMXCCG304
    SolutionIndex: 189
    SolutionNameMin: Cijk_Alik_Bljk_BBS_BH_Bias_HAS_SAV_UserArgs_MT32x16x256_MI16x16x1_SN_LDSB1_CLR1_GRVWA8_GRVWB8_GSU1_GSUC0_GSUWGMRR0_K1_LBSPPA512_LBSPPB512_LPA16_LPB16_LRVW8_LSU2_MIWT1_1_NTD4_PLR1_SU16_SUM0_SUS512_SVW1_ULSGRO1_VWA1_VWB1_WG32_4_2_WGM1_WGMXCC1_WGMXCCG304
    SolutionIndex: 190
    SolutionNameMin: Cijk_Alik_Bljk_BBS_BH_Bias_HAS_SAV_UserArgs_MT32x48x256_MI16x16x1_SN_LDSB1_CLR1_GRVWA8_GRVWB8_GSU1_GSUC0_GSUWGMRR0_K1_LBSPPA512_LBSPPB512_LPA16_LPB16_LRVW8_LSU2_MIWT1_3_NTD0_PLR1_SU16_SUM0_SUS512_SVW1_ULSGRO0_VWA1_VWB1_WG32_4_2_WGM4_WGMXCC8_WGMXCCG304
    SolutionIndex: 191
    SolutionNameMin: Cijk_Alik_Bljk_BBS_BH_Bias_HAS_SAV_UserArgs_MT32x48x256_MI16x16x1_SN_LDSB1_CLR1_GRVWA8_GRVWB8_GSU1_GSUC0_GSUWGMRR0_K1_LBSPPA512_LBSPPB512_LPA16_LPB16_LRVW8_LSU2_MIWT1_3_NTD0_PLR1_SU16_SUM1_SUS512_SVW1_ULSGRO1_VWA1_VWB1_WG32_4_2_WGM1_WGMXCC1_WGMXCCG304
    SolutionIndex: 192
    SolutionNameMin: Cijk_Alik_Bljk_BBS_BH_Bias_HAS_SAV_UserArgs_MT64x32x256_MI16x16x1_SN_LDSB1_GRVWA8_GRVWB8_GSU1_LBSPPA1024_LBSPPB512_LPA16_LPB16_LRVW8_MIWT2_2_NTA5_NTD7_SS1_SU8_SUM1_SUS512_SVW2_VWA2_WG32_4_2_WGM0
    SolutionIndex: 193
    SolutionNameMin: Cijk_Alik_Bljk_BBS_BH_Bias_HAS_SAV_UserArgs_MT128x128x32_MI16x16x1_SN_GRVWA4_GRVWB4_GSU1_GSUC0_GSUWGMRR0_K1_LBSPPA256_LBSPPB256_LPA4_LPB4_LRVW4_MIWT4_4_NTC4_NTD4_NEPBS16_SU8_SUM0_SUS256_SPO1_SSO0_ULSGRO1_VWB4_WGM8_WGMXCC4_WGMXCCG0
    SolutionIndex: 194
    SolutionNameMin: Cijk_Alik_Bljk_BBS_BH_Bias_HAS_SAV_UserArgs_MT128x256x32_MI16x16x1_SN_GRVWA4_GRVWB4_GSU1_GSUC0_GSUWGMRR0_K1_LBSPPA256_LBSPPB512_LPA4_LPB4_LRVW4_MIWT4_8_NTC4_NTD4_NEPBS16_SU0_SUM0_SUS0_SPO1_SSO4_ULSGRO1_VWB8_WGM8_WGMXCC8_WGMXCCG0
    SolutionIndex: 195
    SolutionNameMin: Cijk_Alik_Bljk_BBS_BH_Bias_HAS_SAV_UserArgs_MT128x256x32_MI16x16x1_SN_GRVWA4_GRVWB4_GSU1_GSUC0_GSUWGMRR0_K1_LBSPPA256_LBSPPB512_LPA4_LPB4_LRVW4_MIWT4_8_NTC0_NTD4_NEPBS0_SU8_SUM0_SUS64_SPO1_SSO0_ULSGRO1_VWB8_WGM1_WGMXCC8_WGMXCCG0
    SolutionIndex: 196
    SolutionNameMin: Cijk_Alik_Bljk_BBS_BH_Bias_HAS_SAV_UserArgs_MT128x256x32_MI16x16x1_SN_GRVWA4_GRVWB4_GSU1_GSUC0_GSUWGMRR0_K1_LBSPPA256_LBSPPB512_LPA4_LPB4_LRVW4_MIWT4_8_NTC4_NTD4_NEPBS0_SU8_SUM0_SUS64_SPO0_SSO0_ULSGRO0_VWB8_WGM0_WGMXCC8_WGMXCCG0
    SolutionIndex: 197
    SolutionNameMin: Cijk_Alik_Bljk_BBS_BH_Bias_HAS_SAV_UserArgs_MT224x256x64_MI16x16x1_SN_GRVWA4_GRVWB4_GSU1_GSUC0_GSUWGMRR0_K1_LBSPPA256_LBSPPB512_LPA4_LPB4_LRVW4_MIWT14_4_NEPBS0_SU0_SUM0_SUS0_SPO0_SSO0_SVW2_ULSGRO1_VWA2_VWB4_WG16_16_1_WGM1_WGMXCC8_WGMXCCG0
    SolutionIndex: 198
    SolutionNameMin: Cijk_Alik_Bljk_BBS_BH_Bias_HAS_SAV_UserArgs_MT128x64x128_MI16x16x1_SN_GSU1_GSUC0_GSUWGMRR0_K1_LBSPPA1024_LBSPPB512_MIWT4_2_SU0_SUM0_SUS0_SVW4_ULSGRO0_USL0_UIOFGRO1_USFGROn1_VWA4_VWB2_WSGRA2_WSGRB0_WG32_8_1_WGM304_WGMXCC32_WGMXCCG0
    SolutionIndex: 199
    SolutionNameMin: Cijk_Alik_Bljk_BBS_BH_Bias_HAS_SAV_UserArgs_MT64x128x128_MI16x16x1_SN_GSU1_GSUC0_GSUWGMRR0_K1_LBSPPA512_LBSPPB1024_MIWT2_4_NEPBS0_SU0_SUM0_SUS0_SVW2_VWA2_VWB4_WG32_8_1_WGM0_WGMXCC32_WGMXCCG0
    SolutionIndex: 200
    SolutionNameMin: Cijk_Alik_Bljk_BBS_BH_Bias_HAS_SAV_UserArgs_MT128x64x128_MI16x16x1_SN_GSU1_GSUC0_GSUWGMRR0_K1_LBSPPA1024_LBSPPB512_MIWT4_2_NEPBS16_SU4_SUM1_SUS256_SVW4_VWA4_VWB2_WG32_8_1_WGM32_WGMXCC32_WGMXCCG0
    SolutionIndex: 201
    SolutionNameMin: Cijk_Alik_Bljk_BBS_BH_Bias_HAS_SAV_UserArgs_MT128x64x128_MI16x16x1_SN_GSU1_GSUC0_GSUWGMRR0_K1_LBSPPA512_LBSPPB1024_MIWT2_4_NTC0_NTD4_NEPBS16_SU4_SUM0_SUS256_SPO0_SSO0_SVW2_VWA2_VWB4_WG64_4_1_WGM1_WGMXCC4_WGMXCCG304
    SolutionIndex: 202
    SolutionNameMin: Cijk_Alik_Bljk_BBS_BH_Bias_HAS_SAV_UserArgs_MT128x128x64_MI16x16x1_SN_GSU2_GSUC0_GSUWGMRR0_K1_LBSPPA512_LBSPPB512_MIWT4_4_NEPBS0_SU0_SUM0_SUS0_SVW4_VWA4_VWB4_WG32_8_1_WGM32_WGMXCC8_WGMXCCG32
    SolutionIndex: 203
    SolutionNameMin: Cijk_Alik_Bljk_BBS_BH_Bias_HAS_SAV_UserArgs_MT128x128x64_MI16x16x1_SN_GSU1_GSUC0_GSUWGMRR0_K1_MIWT8_2_SU0_SUM0_SUS0_ULSGRO1_USL1_UIOFGRO0_USFGRO0_WSGRA2_WSGRB2_WGM4_WGMXCC4_WGMXCCG32
    SolutionIndex: 204
    SolutionNameMin: Cijk_Alik_Bljk_BBS_BH_Bias_HAS_SAV_UserArgs_MT256x128x64_MI16x16x1_SN_GSU1_GSUC0_GSUWGMRR0_K1_LBSPPA1024_LBSPPB512_MIWT8_4_SU0_SUM0_SUS0_SVW8_ULSGRO1_USL0_UIOFGRO0_USFGROn1_VWA8_VWB4_WSGRA2_WSGRB0_WG32_8_1_WGM8_WGMXCC8_WGMXCCG0
    SolutionIndex: 205
    SolutionNameMin: Cijk_Alik_Bljk_BBS_BH_Bias_HAS_SAV_UserArgs_MT128x96x64_MI16x16x1_SN_GSU1_GSUC0_GSUWGMRR0_K1_LBSPPA512_LBSPPB128_MIWT4_3_NTC0_NTD4_NEPBS0_SU4_SUM0_SUS128_SPO0_SSO0_SVW4_VWA4_VWB1_WG32_8_1_WGM304_WGMXCC4_WGMXCCG0
    SolutionIndex: 206
    SolutionNameMin: Cijk_Alik_Bljk_BBS_BH_Bias_HAS_SAV_UserArgs_MT128x96x64_MI16x16x1_SN_GSU1_GSUC0_GSUWGMRR0_K1_LBSPPA512_LBSPPB128_MIWT4_3_NTC0_NTD4_NEPBS0_SU4_SUM0_SUS128_SPO0_SSO4_SVW4_VWA4_VWB1_WG32_8_1_WGM32_WGMXCC4_WGMXCCG0
    SolutionIndex: 207
    SolutionNameMin: Custom_Cijk_Alik_Bljk_BBS_BH_Bias_HAS_SAV_UserArgs_MT256x256x64_MI16x16x1_SN_K1_MIWT4_16_DTVA
    SolutionIndex: 208
    SolutionNameMin: Cijk_Alik_Bljk_BBS_BH_Bias_AS_SAV_UserArgs_MT256x160x32_MI16x16x1_SN_GRVWA4_GRVWB4_GSU1_GSUC0_GSUWGMRR0_K1_LBSPPA512_LBSPPB128_LPA4_LPB4_LRVW4_MIWT8_5_NTC0_NTD4_NEPBS0_SU32_SUM0_SUS64_SPO0_SVW8_ULSGRO0_VWA8_VWB1_WG32_8_1_WGM304_WGMXCC1_WGMXCCG4
    SolutionIndex: 209
    SolutionNameMin: Cijk_Alik_Bljk_BBS_BH_Bias_AS_SAV_UserArgs_MT128x224x32_MI16x16x1_SN_GRVWA4_GRVWB4_GSU1_GSUC0_GSUWGMRR0_K1_LBSPPA256_LBSPPB128_LPA4_LPB4_LRVW4_MIWT4_7_NTC4_NTD4_NEPBS16_SU32_SUM0_SUS64_SPO0_SVW4_ULSGRO0_VWA4_VWB1_WG32_8_1_WGM38_WGMXCC4_WGMXCCG0
    SolutionIndex: 210
    SolutionNameMin: Cijk_Alik_Bljk_BBS_BH_Bias_AS_SAV_UserArgs_MT128x224x32_MI16x16x1_SN_GRVWA4_GRVWB4_GSU1_GSUC0_GSUWGMRR0_K1_LBSPPA256_LBSPPB128_LPA4_LPB4_LRVW4_MIWT4_7_NTC4_NTD4_NEPBS16_SU32_SUM0_SUS256_SPO0_SVW4_ULSGRO1_VWA4_VWB1_WG32_8_1_WGM38_WGMXCC4_WGMXCCG0
    SolutionIndex: 211
    SolutionNameMin: Cijk_Alik_Bljk_BBS_BH_Bias_AS_SAV_UserArgs_MT128x224x32_MI16x16x1_SN_GRVWA4_GRVWB4_GSU1_GSUC0_GSUWGMRR0_K1_LBSPPA256_LBSPPB128_LPA4_LPB4_LRVW4_MIWT4_7_NTC0_NTD4_NEPBS0_SU8_SUM0_SUS256_SPO0_SVW4_ULSGRO1_VWA4_VWB1_WG32_8_1_WGM38_WGMXCC4_WGMXCCG0
    SolutionIndex: 212
    SolutionNameMin: Cijk_Alik_Bljk_BBS_BH_Bias_AS_SAV_UserArgs_MT256x224x64_MI16x16x1_SN_GRVWA4_GRVWB4_GSU1_GSUC0_GSUWGMRR0_K1_LBSPPA1024_LBSPPB128_LPA4_LPB4_LRVW4_MIWT8_7_NTC0_NTD0_NEPBS16_SU8_SUM0_SUS128_SPO1_SVW8_ULSGRO0_VWA8_VWB1_WG32_8_1_WGM8_WGMXCC4_WGMXCCG0
    SolutionIndex: 213
    SolutionNameMin: Cijk_Alik_Bljk_BBS_BH_Bias_AS_SAV_UserArgs_MT256x224x64_MI16x16x1_SN_GRVWA4_GRVWB4_GSU1_GSUC0_GSUWGMRR0_K1_LBSPPA1024_LBSPPB128_LPA4_LPB4_LRVW4_MIWT8_7_NTC0_NTD4_NEPBS16_SU8_SUM0_SUS256_SPO0_SVW8_ULSGRO0_VWA8_VWB1_WG32_8_1_WGM4_WGMXCC8_WGMXCCG0
    SolutionIndex: 214
    SolutionNameMin: Cijk_Alik_Bljk_BBS_BH_Bias_AS_SAV_UserArgs_MT128x128x64_MI16x16x1_SN_GSU9_GSUC1_GSUWGMRR1_K1_MIWT4_4_NTC0_NTD4_NEPBS0_SU0_SUM0_SUS0_SPO1_SSO0_ULSGRO0_WSGRA2_WSGRB2_WGM1_WGMXCC304_WGMXCCG0
    SolutionIndex: 215
    SolutionNameMin: Cijk_Alik_Bljk_BBS_BH_Bias_AS_SAV_UserArgs_MT256x96x64_MI16x16x1_SN_GSU3_GSUC1_GSUWGMRR1_K1_MIWT4_6_NTC0_NTD4_NEPBS0_SU0_SUM0_SUS0_SPO0_SSO0_ULSGRO0_WSGRA0_WSGRB0_WGM1_WGMXCC1_WGMXCCG0
    SolutionIndex: 216
    SolutionNameMin: Cijk_Alik_Bljk_BBS_BH_Bias_AS_SAV_UserArgs_MT128x64x128_MI16x16x1_SN_GSU1_GSUC0_GSUWGMRR0_K1_MIWT4_2_NTC0_NTD4_NEPBS16_SU0_SUM0_SUS0_SPO0_SSO0_ULSGRO0_WSGRA0_WSGRB0_WGM1_WGMXCC8_WGMXCCG0
    SolutionIndex: 217
    SolutionNameMin: Cijk_Alik_Bljk_BBS_BH_Bias_AS_SAV_UserArgs_MT128x64x128_MI16x16x1_SN_GSU1_GSUC0_GSUWGMRR0_K1_MIWT2_4_NTC0_NTD4_NEPBS0_SU8_SUM1_SUS256_SPO0_SSO0_ULSGRO1_WSGRA2_WSGRB2_WGM1_WGMXCC8_WGMXCCG32
    SolutionIndex: 218
    SolutionNameMin: Cijk_Alik_Bljk_BBS_BH_Bias_AS_SAV_UserArgs_MT128x128x64_MI16x16x1_SN_GSU2_GSUC0_GSUWGMRR0_K1_MIWT8_2_NTC0_NTD0_NEPBS16_SU8_SUM0_SUS128_SPO1_SSO4_ULSGRO1_WSGRA2_WSGRB2_WGM0_WGMXCC32_WGMXCCG0
    SolutionIndex: 219
    SolutionNameMin: Cijk_Alik_Bljk_BBS_BH_Bias_AS_SAV_UserArgs_MT128x128x64_MI16x16x1_SN_GSU1_GSUC0_GSUWGMRR0_K1_MIWT4_4_NTC0_NTD0_NEPBS16_SU8_SUM1_SUS128_SPO0_SSO4_ULSGRO1_WSGRA0_WSGRB0_WGM0_WGMXCC32_WGMXCCG0
    SolutionIndex: 220
    SolutionNameMin: Cijk_Alik_Bljk_BBS_BH_Bias_AS_SAV_UserArgs_MT128x128x64_MI16x16x1_SN_GSU1_GSUC0_GSUWGMRR0_K1_MIWT4_4_NTC0_NTD4_NEPBS0_SU4_SUM0_SUS1024_SPO0_SSO0_ULSGRO0_WSGRA2_WSGRB0_WGM8_WGMXCC1_WGMXCCG0
    SolutionIndex: 221
    SolutionNameMin: Cijk_Alik_Bljk_BBS_BH_Bias_AS_SAV_UserArgs_MT128x256x64_MI16x16x1_SN_GSU1_GSUC0_GSUWGMRR0_K1_MIWT8_4_NTC0_NTD4_NEPBS0_SU8_SUM1_SUS512_SPO0_SSO0_ULSGRO0_WSGRA2_WSGRB2_WGM0_WGMXCC1_WGMXCCG0
    SolutionIndex: 222
    SolutionNameMin: Cijk_Alik_Bljk_BBS_BH_Bias_AS_SAV_UserArgs_MT192x256x64_MI16x16x1_SN_GSU1_GSUC0_GSUWGMRR0_K1_MIWT12_4_NTC0_NTD4_NEPBS0_SU8_SUM0_SUS256_SPO1_SSO0_ULSGRO0_WSGRA2_WSGRB0_WGM8_WGMXCC1_WGMXCCG0
    SolutionIndex: 223
    SolutionNameMin: Cijk_Alik_Bljk_BBS_BH_Bias_AS_SAV_UserArgs_MT224x256x64_MI16x16x1_SN_GSU1_GSUC0_GSUWGMRR0_K1_MIWT14_4_NTC0_NTD4_NEPBS0_SU8_SUM0_SUS256_SPO0_SSO0_ULSGRO0_WSGRA2_WSGRB0_WGM0_WGMXCC1_WGMXCCG0
    SolutionIndex: 224
    SolutionNameMin: Cijk_Alik_Bljk_BBS_BH_Bias_AS_SAV_UserArgs_MT128x256x64_MI16x16x1_SN_GSU1_GSUC0_GSUWGMRR0_K1_MIWT4_8_NTC0_NTD4_NEPBS0_SU8_SUM0_SUS256_SPO0_SSO0_ULSGRO0_WSGRA2_WSGRB0_WGM1_WGMXCC1_WGMXCCG0
    SolutionIndex: 225
    SolutionNameMin: Cijk_Alik_Bljk_BBS_BH_Bias_AS_SAV_UserArgs_MT192x256x64_MI16x16x1_SN_GSU1_GSUC0_GSUWGMRR0_K1_MIWT12_4_NTC0_NTD4_NEPBS0_SU8_SUM0_SUS256_SPO0_SSO0_ULSGRO0_WSGRA0_WSGRB2_WGM16_WGMXCC1_WGMXCCG0
    SolutionIndex: 226
    SolutionNameMin: Cijk_Alik_Bljk_BBS_BH_Bias_AS_SAV_UserArgs_MT256x256x32_MI16x16x1_SN_GSU1_GSUC0_GSUWGMRR0_K1_MIWT8_8_NTC4_NTD4_NEPBS0_SU8_SUM0_SUS64_SPO0_SSO4_ULSGRO1_WSGRA2_WSGRB0_WGM0_WGMXCC32_WGMXCCG0
    SolutionIndex: 227
    SolutionNameMin: Cijk_Alik_Bljk_BBS_BH_Bias_AS_SAV_UserArgs_MT192x256x64_MI16x16x1_SN_GSU1_GSUC0_GSUWGMRR0_K1_MIWT12_4_NTC0_NTD4_NEPBS16_SU8_SUM0_SUS256_SPO0_SSO0_ULSGRO0_WSGRA0_WSGRB0_WGM32_WGMXCC1_WGMXCCG0
- - - [2048, 64896, 1, 512]
    - [0, 0.0]
  - - [2048, 17556, 1, 512]
    - [63, 0.0]
  - - [512, 14, 1, 256]
    - [1, 0.0]
  - - [2048, 16302, 1, 512]
    - [63, 0.0]
  - - [512, 13, 1, 256]
    - [2, 0.0]
  - - [8192, 3500, 1, 2048]
    - [3, 0.0]
  - - [512, 3500, 1, 512]
    - [4, 0.0]
  - - [2048, 17052, 1, 512]
    - [63, 0.0]
  - - [262144, 13, 1, 256]
    - [5, 0.0]
  - - [256, 14, 1, 2560]
    - [6, 0.0]
  - - [262144, 14, 1, 256]
    - [7, 0.0]
  - - [8192, 3250, 1, 2048]
    - [8, 0.0]
  - - [256, 13, 1, 2560]
    - [9, 0.0]
  - - [512, 3250, 1, 512]
    - [10, 0.0]
  - - [256, 14, 1, 256]
    - [11, 0.0]
  - - [2048, 1024, 1, 5560]
    - [12, 0.0]
  - - [1, 1024, 1, 256]
    - [13, 0.0]
  - - [512, 1024, 1, 5744]
    - [14, 0.0]
  - - [128, 1024, 1, 10624]
    - [15, 0.0]
  - - [512, 1024, 1, 5560]
    - [16, 0.0]
  - - [1024, 1024, 1, 3840]
    - [17, 0.0]
  - - [1024, 1024, 1, 2872]
    - [18, 0.0]
  - - [2872, 1024, 1, 512]
    - [19, 0.0]
  - - [1, 1024, 1, 128]
    - [20, 0.0]
  - - [128, 1024, 1, 7040]
    - [21, 0.0]
  - - [128, 1024, 1, 4416]
    - [22, 0.0]
  - - [128, 1024, 1, 6784]
    - [23, 0.0]
  - - [512, 1024, 1, 2872]
    - [24, 0.0]
  - - [256, 1024, 1, 4608]
    - [25, 0.0]
  - - [512, 1024, 1, 3072]
    - [26, 0.0]
  - - [5560, 1024, 1, 2780]
    - [27, 0.0]
  - - [2780, 1024, 1, 5560]
    - [28, 0.0]
  - - [512, 16, 1, 256]
    - [95, 0.0]
  - - [512, 32, 1, 256]
    - [1, 0.0]
  - - [8192, 4000, 1, 2048]
    - [114, 0.0]
  - - [512, 4000, 1, 512]
    - [29, 0.0]
  - - [8192, 8000, 1, 2048]
    - [30, 0.0]
  - - [512, 8000, 1, 512]
    - [31, 0.0]
  - - [262144, 16, 1, 256]
    - [32, 0.0]
  - - [256, 16, 1, 2560]
    - [9, 0.0]
  - - [262144, 32, 1, 256]
    - [33, 0.0]
  - - [256, 32, 1, 2560]
    - [34, 0.0]
  - - [256, 13, 1, 256]
    - [35, 0.0]
  - - [2048, 2048, 1, 5560]
    - [36, 0.0]
  - - [1, 2048, 1, 256]
    - [20, 0.0]
  - - [512, 2048, 1, 5744]
    - [37, 0.0]
  - - [128, 2048, 1, 10624]
    - [38, 0.0]
  - - [512, 2048, 1, 5560]
    - [39, 0.0]
  - - [1024, 2048, 1, 3840]
    - [40, 0.0]
  - - [1024, 2048, 1, 2872]
    - [41, 0.0]
  - - [2872, 2048, 1, 512]
    - [42, 0.0]
  - - [1, 2048, 1, 128]
    - [43, 0.0]
  - - [128, 2048, 1, 7040]
    - [44, 0.0]
  - - [128, 2048, 1, 4416]
    - [45, 0.0]
  - - [128, 2048, 1, 6784]
    - [46, 0.0]
  - - [512, 2048, 1, 2872]
    - [47, 0.0]
  - - [256, 2048, 1, 4608]
    - [48, 0.0]
  - - [512, 2048, 1, 3072]
    - [49, 0.0]
  - - [2048, 4096, 1, 5560]
    - [50, 0.0]
  - - [1, 4096, 1, 256]
    - [20, 0.0]
  - - [512, 4096, 1, 5744]
    - [51, 0.0]
  - - [128, 4096, 1, 10624]
    - [52, 0.0]
  - - [512, 4096, 1, 5560]
    - [63, 0.0]
  - - [1024, 4096, 1, 3840]
    - [53, 0.0]
  - - [1024, 4096, 1, 2872]
    - [54, 0.0]
  - - [2872, 4096, 1, 512]
    - [63, 0.0]
  - - [1, 4096, 1, 128]
    - [13, 0.0]
  - - [128, 4096, 1, 7040]
    - [55, 0.0]
  - - [128, 4096, 1, 4416]
    - [56, 0.0]
  - - [128, 4096, 1, 6784]
    - [57, 0.0]
  - - [512, 4096, 1, 2872]
    - [58, 0.0]
  - - [256, 4096, 1, 4608]
    - [59, 0.0]
  - - [512, 4096, 1, 3072]
    - [60, 0.0]
  - - [2048, 152710, 1, 512]
    - [61, 0.0]
  - - [256, 16, 1, 256]
    - [62, 0.0]
  - - [256, 32, 1, 256]
    - [2, 0.0]
  - - [4000, 2, 1, 8192]
    - [64, 0.0]
  - - [4000, 4, 1, 8192]
    - [64, 0.0]
  - - [4000, 8, 1, 8192]
    - [65, 0.0]
  - - [4000, 16, 1, 8192]
    - [66, 0.0]
  - - [4000, 32, 1, 8192]
    - [67, 0.0]
  - - [4000, 64, 1, 8192]
    - [68, 0.0]
  - - [4000, 96, 1, 8192]
    - [69, 0.0]
  - - [1280, 2, 1, 8192]
    - [70, 0.0]
  - - [1280, 16, 1, 8192]
    - [71, 0.0]
  - - [1280, 32, 1, 8192]
    - [72, 0.0]
  - - [1280, 64, 1, 8192]
    - [73, 0.0]
  - - [1280, 96, 1, 8192]
    - [74, 0.0]
  - - [8192, 2, 1, 1024]
    - [75, 0.0]
  - - [8192, 4, 1, 1024]
    - [76, 0.0]
  - - [8192, 8, 1, 1024]
    - [77, 0.0]
  - - [8192, 16, 1, 1024]
    - [78, 0.0]
  - - [8192, 32, 1, 1024]
    - [79, 0.0]
  - - [8192, 64, 1, 1024]
    - [80, 0.0]
  - - [8192, 96, 1, 1024]
    - [81, 0.0]
  - - [7168, 32, 1, 8192]
    - [82, 0.0]
  - - [8192, 2, 1, 3584]
    - [83, 0.0]
  - - [8192, 4, 1, 3584]
    - [84, 0.0]
  - - [8192, 8, 1, 3584]
    - [85, 0.0]
  - - [8192, 16, 1, 3584]
    - [86, 0.0]
  - - [8192, 32, 1, 3584]
    - [87, 0.0]
  - - [8192, 96, 1, 3584]
    - [88, 0.0]
  - - [1280, 4, 1, 8192]
    - [89, 0.0]
  - - [1280, 8, 1, 8192]
    - [89, 0.0]
  - - [7168, 2, 1, 8192]
    - [90, 0.0]
  - - [7168, 4, 1, 8192]
    - [91, 0.0]
  - - [7168, 8, 1, 8192]
    - [91, 0.0]
  - - [7168, 16, 1, 8192]
    - [91, 0.0]
  - - [7168, 64, 1, 8192]
    - [92, 0.0]
  - - [7168, 96, 1, 8192]
    - [93, 0.0]
  - - [8192, 64, 1, 3584]
    - [94, 0.0]
  - - [61440, 16, 1, 256]
    - [117, 0.0]
  - - [256, 27, 1, 256]
    - [96, 0.0]
  - - [256, 27, 1, 2560]
    - [97, 0.0]
  - - [512, 27, 1, 256]
    - [98, 0.0]
  - - [61440, 27, 1, 256]
    - [99, 0.0]
  - - [262144, 27, 1, 256]
    - [100, 0.0]
  - - [512, 33, 1, 256]
    - [101, 0.0]
  - - [8, 4000, 1, 2048]
    - [102, 0.0]
  - - [512, 4000, 1, 384]
    - [103, 0.0]
  - - [6, 5940, 1, 512]
    - [104, 0.0]
  - - [8, 5940, 1, 2048]
    - [105, 0.0]
  - - [11, 5940, 1, 512]
    - [104, 0.0]
  - - [15, 5940, 1, 32]
    - [106, 0.0]
  - - [32, 5940, 1, 64]
    - [107, 0.0]
  - - [35, 5940, 1, 128]
    - [108, 0.0]
  - - [64, 5940, 1, 128]
    - [109, 0.0]
  - - [128, 5940, 1, 128]
    - [110, 0.0]
  - - [128, 5940, 1, 548]
    - [111, 0.0]
  - - [384, 5940, 1, 513]
    - [112, 0.0]
  - - [512, 5940, 1, 384]
    - [115, 0.0]
  - - [512, 5940, 1, 512]
    - [113, 0.0]
  - - [8192, 5940, 1, 2048]
    - [118, 0.0]
  - - [512, 68850, 1, 516]
    - [116, 0.0]
  - - [208448, 1792, 1, 1024]
    - [119, 0.0]
  - - [20352, 1792, 1, 1024]
    - [120, 0.0]
  - - [200, 128, 1792, 384]
    - [121, 0.0]
  - - [208448, 1792, 1, 256]
    - [122, 0.0]
  - - [2048, 1792, 1, 208448]
    - [124, 0.0]
  - - [256, 1792, 1, 49152]
    - [123, 0.0]
  - - [2304, 2, 1, 16384]
    - [125, 0.0]
  - - [13312, 2, 1, 16384]
    - [126, 0.0]
  - - [16384, 2, 1, 2048]
    - [127, 0.0]
  - - [16384, 2, 1, 6656]
    - [131, 0.0]
  - - [128256, 2, 1, 16384]
    - [128, 0.0]
  - - [13312, 8192, 1, 16384]
    - [146, 0.0]
  - - [16384, 8192, 1, 2048]
    - [129, 0.0]
  - - [2304, 8192, 1, 16384]
    - [130, 0.0]
  - - [16384, 8192, 1, 6656]
    - [145, 0.0]
  - - [128256, 8192, 1, 16384]
    - [146, 0.0]
  - - [2048, 1024, 1, 208448]
    - [132, 0.0]
  - - [384, 204800, 1, 384]
    - [133, 0.0]
  - - [26496, 1024, 1, 1024]
    - [134, 0.0]
  - - [2048, 1024, 1, 8224]
    - [135, 0.0]
  - - [20352, 1024, 1, 1024]
    - [136, 0.0]
  - - [24448, 1024, 1, 1024]
    - [137, 0.0]
  - - [208448, 1024, 1, 1024]
    - [138, 0.0]
  - - [1024, 1024, 1, 24448]
    - [139, 0.0]
  - - [1024, 1024, 1, 26496]
    - [140, 0.0]
  - - [1024, 1024, 1, 22400]
    - [141, 0.0]
  - - [1024, 1024, 1, 20352]
    - [142, 0.0]
  - - [1024, 1024, 1, 18304]
    - [143, 0.0]
  - - [1024, 1024, 1, 16256]
    - [144, 0.0]
  - - [16032, 8192, 1, 16384]
    - [146, 0.0]
  - - [16032, 2, 1, 16384]
    - [147, 0.0]
  - - [2048, 1152, 1, 2048]
    - [148, 332269.0]
  - - [2048, 462, 1, 4096]
    - [149, 238481.0]
  - - [16384, 1152, 1, 2048]
    - [167, 472093.0]
  - - [2048, 1152, 1, 8192]
    - [150, 388855.0]
  - - [8192, 4608, 1, 1024]
    - [168, 502189.0]
  - - [1024, 4608, 1, 1024]
    - [184, 333110.0]
  - - [1024, 462, 1, 4096]
    - [192, 176348.0]
  - - [1024, 4608, 1, 4096]
    - [151, 380324.0]
  - - [2048, 462, 1, 768]
    - [152, 153261.0]
  - - [4096, 18432, 1, 512]
    - [169, 447793.0]
  - - [512, 18432, 1, 512]
    - [170, 346315.0]
  - - [2048, 308, 1, 1472]
    - [153, 125200.0]
  - - [16384, 576, 1, 2048]
    - [172, 380543.0]
  - - [512, 18432, 1, 2048]
    - [170, 427482.0]
  - - [2048, 576, 1, 2048]
    - [154, 240993.0]
  - - [512, 462, 1, 4096]
    - [155, 118621.0]
  - - [1024, 308, 1, 1472]
    - [173, 80012.0]
  - - [512, 308, 1, 1472]
    - [173, 46073.5]
  - - [16384, 231, 1, 4096]
    - [156, 296176.0]
  - - [4096, 231, 1, 4096]
    - [174, 227144.0]
  - - [8192, 2304, 1, 1024]
    - [171, 487939.0]
  - - [2048, 231, 1, 4096]
    - [180, 172069.0]
  - - [1024, 231, 1, 4096]
    - [181, 131593.0]
  - - [1024, 2304, 1, 1024]
    - [157, 281901.0]
  - - [4096, 9216, 1, 512]
    - [169, 434990.0]
  - - [1024, 2304, 1, 4096]
    - [158, 358643.0]
  - - [512, 9216, 1, 512]
    - [184, 263290.0]
  - - [16384, 288, 1, 2048]
    - [182, 322408.0]
  - - [1024, 154, 1, 1472]
    - [175, 46054.0]
  - - [2048, 576, 1, 8192]
    - [159, 322361.0]
  - - [512, 462, 1, 768]
    - [183, 65492.7]
  - - [512, 9216, 1, 2048]
    - [160, 346597.0]
  - - [1024, 462, 1, 768]
    - [179, 108200.0]
  - - [2048, 231, 1, 768]
    - [185, 103786.0]
  - - [2048, 154, 1, 1472]
    - [176, 78881.1]
  - - [2048, 288, 1, 2048]
    - [186, 163245.0]
  - - [512, 154, 1, 1472]
    - [177, 25990.9]
  - - [3584, 154, 1, 1472]
    - [161, 112584.0]
  - - [16384, 144, 1, 2048]
    - [162, 226469.0]
  - - [1472, 154, 1, 3584]
    - [163, 96964.5]
  - - [384, 154, 1, 1472]
    - [177, 20044.6]
  - - [512, 231, 1, 768]
    - [187, 36458.9]
  - - [3072, 77, 1, 768]
    - [164, 58715.4]
  - - [1472, 154, 1, 384]
    - [178, 31973.7]
  - - [768, 77, 1, 3072]
    - [188, 43451.9]
  - - [512, 231, 1, 4096]
    - [189, 82791.5]
  - - [768, 77, 1, 768]
    - [188, 19256.8]
  - - [1024, 231, 1, 768]
    - [165, 62472.2]
  - - [2048, 144, 1, 2048]
    - [190, 109043.0]
  - - [2048, 144, 1, 8192]
    - [191, 160947.0]
  - - [2048, 288, 1, 8192]
    - [166, 236383.0]
  - - [128, 409600, 1, 384]
    - [193, 0.0]
  - - [256, 2048, 1, 49152]
    - [214, 0.0]
  - - [384, 393216, 1, 257]
    - [194, 0.0]
  - - [384, 409600, 1, 128]
    - [195, 0.0]
  - - [384, 409600, 1, 384]
    - [196, 0.0]
  - - [641, 393216, 1, 6514]
    - [197, 0.0]
  - - [1024, 2048, 1, 10112]
    - [198, 0.0]
  - - [1024, 2048, 1, 12160]
    - [199, 0.0]
  - - [1024, 2048, 1, 14208]
    - [200, 0.0]
  - - [1024, 2048, 1, 16256]
    - [215, 0.0]
  - - [1024, 2048, 1, 18304]
    - [201, 0.0]
  - - [1024, 2048, 1, 20352]
    - [216, 0.0]
  - - [1024, 2048, 1, 22400]
    - [217, 0.0]
  - - [1024, 2048, 1, 24448]
    - [218, 0.0]
  - - [1024, 2048, 1, 26496]
    - [202, 0.0]
  - - [2048, 2048, 1, 8224]
    - [219, 0.0]
  - - [2048, 2048, 1, 208448]
    - [203, 0.0]
  - - [2304, 2048, 1, 4800]
    - [220, 0.0]
  - - [4800, 2048, 1, 2304]
    - [221, 0.0]
  - - [4800, 2048, 1, 22400]
    - [204, 0.0]
  - - [14208, 2048, 1, 1024]
    - [222, 0.0]
  - - [16256, 2048, 1, 1024]
    - [223, 0.0]
  - - [18304, 2048, 1, 1024]
    - [224, 0.0]
  - - [20352, 2048, 1, 1024]
    - [225, 0.0]
  - - [22400, 2048, 1, 1024]
    - [205, 0.0]
  - - [24448, 2048, 1, 1024]
    - [206, 0.0]
  - - [24576, 2048, 1, 4800]
    - [226, 0.0]
  - - [26496, 2048, 1, 1024]
    - [227, 0.0]
  - - [208448, 2048, 1, 1024]
    - [207, 0.0]
  - - [256, 401179, 1, 512]
    - [208, 0.0]
  - - [384, 331051, 1, 256]
    - [209, 0.0]
  - - [384, 365802, 1, 256]
    - [209, 0.0]
  - - [384, 395225, 1, 256]
    - [210, 0.0]
  - - [384, 401179, 1, 256]
    - [211, 0.0]
  - - [512, 331051, 1, 1536]
    - [212, 0.0]
  - - [512, 395225, 1, 1024]
    - [213, 0.0]
- 
- 
- DeviceEfficiency
- Equality
