library/src/amd_detail/rocblaslt/src/Tensile/Logic/asm_full/aquavanjaram/gfx942/Equality/aquavanjaram_Cijk_Ailk_Bljk_HHS_BH_Bias_HAH_SAV.yaml
- {MinimumRequiredVersion: 4.33.0}
- aquavanjaram
- gfx942
- [Device 0049]
    SolutionIndex: -1
    SolutionIndex: 0
    SolutionNameMin: Cijk_Ailk_Bljk_HHS_BH_Bias_HAH_SAV_MT128x96x64_MI32x32x8x1_SN_1LDSB0_GRVW8_GSU1_LPB8_LRVW8_MIWT1_3_NEPBS0_NLCA1_PLR9_SS0_SU4_SUS128_SVW4_VW1_WG128_2_1_WGM8
    SolutionIndex: 1
    SolutionNameMin: Cijk_Ailk_Bljk_HHS_BH_Bias_HAH_SAV_MT128x128x32_MI32x32x8x1_SN_1LDSB1_GRVW8_GSU1_LPB8_LRVW8_MIWT2_2_NEPBS2_NLCA1_PLR5_SS1_SU0_SUS0_SVW2_VW2_WG64_4_1_WGM1
    SolutionIndex: 2
    SolutionNameMin: Cijk_Ailk_Bljk_HHS_BH_Bias_HAH_SAV_MT128x128x32_MI32x32x8x1_SN_1LDSB1_GRVW8_GSU1_LPB8_LRVW8_MIWT2_2_NEPBS2_NLCA1_PLR5_SS1_SU4_SUS256_SVW2_VW2_WG64_4_1_WGM4
    SolutionIndex: 3
    SolutionNameMin: Cijk_Ailk_Bljk_HHS_BH_Bias_HAH_SAV_MT128x128x32_MI32x32x8x1_SN_1LDSB1_GRVW8_GSU1_LPB8_LRVW8_MIWT2_2_NEPBS2_NLCA1_PLR5_SS1_SU32_SUS128_SVW2_VW2_WG64_4_1_WGM8
    SolutionIndex: 4
    SolutionNameMin: Cijk_Ailk_Bljk_HHS_BH_Bias_HAH_SAV_MT64x16x64_MI16x16x16x1_SN_GRVW8_GSU9_LPB16_LRVW8_MIWT1_1_PLR5_SU0_SUS0_SVW4_VW4_WG64_4_1_WGM8
    SolutionIndex: 5
    SolutionNameMin: Cijk_Ailk_Bljk_HHS_BH_Bias_HAH_SAV_MT64x16x64_MI16x16x16x1_SN_GRVW2_GSU9_MIWT1_1_SU0_SUS0_SRVW0_SVW4_VW4_WG64_4_1_WGM15
    SolutionIndex: 6
    SolutionNameMin: Cijk_Ailk_Bljk_HHS_BH_Bias_HAH_SAV_MT16x32x64_MI16x16x16x1_SN_GRVW8_LPB8_MIWT1_1_NTB3_NEPBS0_PGR2_PLR5_SPO1
    SolutionIndex: 7
    SolutionNameMin: Cijk_Ailk_Bljk_HHS_BH_Bias_HAH_SAV_MT16x32x64_MI16x16x16x1_SN_GRVW8_LPB8_MIWT1_1_NTB3_NEPBS1_PGR2_PLR5_SPO1
    SolutionIndex: 8
    SolutionNameMin: Cijk_Ailk_Bljk_HHS_BH_Bias_HAH_SAV_MT64x16x64_MI16x16x16x1_SN_GRVW2_GSU6_MIWT1_1_SU0_SUS0_SRVW0_SVW4_VW2_WG64_4_1_WGM1
    SolutionIndex: 9
    SolutionNameMin: Cijk_Ailk_Bljk_HHS_BH_Bias_HAH_SAV_MT32x16x64_MI16x16x16x1_SN_GRVW8_GSU25_LPB16_LRVW8_MIWT1_1_PLR5_SU0_SUS0_SVW2_VW8_WG32_4_1_WGM8
    SolutionIndex: 10
    SolutionNameMin: Cijk_Ailk_Bljk_HHS_BH_Bias_HAH_SAV_MT16x16x64_MI16x16x16x1_SN_GRVW8_GSU25_LPB16_LRVW8_MIWT1_1_PLR5_SU0_SUS0_SVW4_VW8_WG16_4_1_WGM1
    SolutionIndex: 11
    SolutionNameMin: Cijk_Ailk_Bljk_HHS_BH_Bias_HAH_SAV_MT128x128x32_MI32x32x8x1_SN_1LDSB0_GRVW8_LPB8_LRVW8_MIWT2_2_NEPBS0_NLCA1_PLR5_SS0_SU4_SUS128_SRVW4_SVW4_VW1_WG64_4_1_WGM21
    SolutionIndex: 12
    SolutionNameMin: Cijk_Ailk_Bljk_HHS_BH_Bias_HAH_SAV_MT128x128x32_MI32x32x8x1_SN_1LDSB0_GRVW8_LPB8_LRVW8_MIWT2_2_NEPBS2_NLCA1_PLR5_SS0_SU4_SUS256_SRVW4_SVW4_VW2_WG64_4_1_WGM15
    SolutionIndex: 13
    SolutionNameMin: Cijk_Ailk_Bljk_HHS_BH_Bias_HAH_SAV_MT64x16x64_MI16x16x16x1_SN_GRVW8_GSU1_LPB16_LRVW8_MIWT1_1_PLR5_SU0_SUS0_SVW4_VW2_WG64_4_1_WGM1
    SolutionIndex: 14
    SolutionNameMin: Cijk_Ailk_Bljk_HHS_BH_Bias_HAH_SAV_MT64x16x64_MI16x16x16x1_SN_GRVW4_GSU1_LPB16_LRVW8_MIWT1_1_PLR5_SU0_SUS0_SVW4_VW8_WG64_4_1_WGM1
    SolutionIndex: 15
    SolutionNameMin: Cijk_Ailk_Bljk_HHS_BH_Bias_HAH_SAV_MT256x128x32_MI32x32x8x1_SN_1LDSB1_GRVW8_LPB8_LRVW8_MIWT4_2_NEPBS2_NLCA1_PLR5_SS1_SU0_SUS0_SRVW0_SVW4_VW4_WG64_4_1_WGM1
    SolutionIndex: 16
    SolutionNameMin: Cijk_Ailk_Bljk_HHS_BH_MT256x240x64_MI16x16x1_SN_GSU1_LWPMn1_MIWT4_15_NTD0_SU4_SUM0_SUS128_WSGRA1_WSGRB0_WGM1
    SolutionIndex: 17
    SolutionNameMin: Cijk_Ailk_Bljk_HHS_BH_MT256x240x64_MI16x16x1_SN_GSU1_LWPMn1_MIWT4_15_NTD0_SU4_SUM0_SUS128_WSGRA0_WSGRB0_WGM1
- - - [1104, 1, 1, 4608]
    - [8, 225.657]
  - - [1104, 16, 1, 4608]
    - [8, 3590.13]
  - - [1104, 1335, 1, 4608]
    - [11, 102975.0]
  - - [1104, 1408, 1, 4608]
    - [12, 107796.0]
  - - [4608, 1, 1, 320]
    - [13, 146.518]
  - - [4608, 16, 1, 320]
    - [14, 2391.82]
  - - [4608, 1335, 1, 320]
    - [15, 65705.4]
  - - [4608, 1408, 1, 320]
    - [1, 102208.0]
  - - [16, 1, 1, 4608]
    - [9, 3.67757]
  - - [16, 16, 1, 4608]
    - [10, 55.8544]
  - - [16, 1335, 1, 4608]
    - [6, 4338.28]
  - - [16, 1408, 1, 4608]
    - [7, 4511.86]
  - - [768, 1, 1, 4608]
    - [4, 161.154]
  - - [768, 16, 1, 4608]
    - [5, 2382.32]
  - - [768, 1335, 1, 4608]
    - [0, 90493.4]
  - - [768, 1408, 1, 4608]
    - [0, 90493.4]
  - - [4608, 1, 1, 768]
    - [13, 281.046]
  - - [4608, 16, 1, 768]
    - [14, 4587.1]
  - - [4608, 1335, 1, 768]
    - [2, 93398.6]
  - - [4608, 1408, 1, 768]
    - [3, 75750.8]
  - - [8192, 2048, 1, 8192]
    - [16, 0.0]
  - - [8192, 2048, 1, 65536]
    - [17, 0.0]
- 
- 
- DeviceEfficiency
- Equality
