library/src/amd_detail/rocblaslt/src/Tensile/Logic/asm_full/aquavanjaram/gfx942/Equality/aquavanjaram_Cijk_Ailk_Bjlk_HHS_BH_UserArgs.yaml
- {MinimumRequiredVersion: 4.33.0}
- aquavanjaram
- gfx942
- [Device 0049, Device 0050]
    SolutionIndex: -1
    SolutionIndex: 0
    SolutionNameMin: Cijk_Ailk_Bjlk_HHS_BH_MT128x64x64_MI16x16x1_SN_LDSB1_GRVWB4_GSU1_LBSPPA1024_LBSPPB512_LPA16_LPB16_MIWT2_4_NLCB1_SVW2_VWA2_VWB4_WG64_4_1
    SolutionIndex: 1
    SolutionNameMin: Cijk_Ailk_Bjlk_HHS_BH_MT256x224x64_MI16x16x1_SN_LDSB1_GRVWB4_GSU1_LBSPPA2048_LBSPPB1792_LPA16_LPB16_MIWT4_14_NLCB7_SVW4_VWA4_VWB2_WG64_4_1
    SolutionIndex: 2
    SolutionNameMin: Cijk_Ailk_Bjlk_HHS_BH_MT256x224x64_MI16x16x1_SN_LDSB1_GRVWB8_GSU1_LBSPPA2048_LBSPPB1792_LPA16_LPB16_MIWT4_14_NLCB7_SVW4_VWA4_VWB2_WG64_4_1
    SolutionIndex: 3
    SolutionNameMin: Cijk_Ailk_Bjlk_HHS_BH_MT128x128x128_MI32x32x1_SN_LDSB1_GRVWB8_GSU1_LBSPPA0_LBSPPB0_LPA0_LPB0_MIWT2_2_NLCB1_SVW2_VWA2_VWB2_WG64_4_1
    SolutionIndex: 4
    SolutionNameMin: Cijk_Ailk_Bjlk_HHS_BH_UserArgs_MT128x256x32_MI16x16x1_SN_GSU1_GSUC0_GSUWGMRR0_K1_LBSPPA1024_LPA0_LPB0_MIAV0_MIWT4_8_NTA3_NTB2_NTC1_NTD1_SS1_SU0_SUM0_SUS0_SPO0_SVW4_VWA4_VWB8_WG32_8_1_WGMn8
    SolutionIndex: 5
    SolutionNameMin: Cijk_Ailk_Bjlk_HHS_BH_UserArgs_MT128x256x32_MI16x16x1_SN_GSU1_GSUC0_GSUWGMRR0_K1_LBSPPA1024_LPA0_LPB0_MIAV0_MIWT4_8_NTA0_NTB0_NTC5_NTD5_SS1_SU0_SUM0_SUS0_SPO0_SVW4_VWA4_VWB8_WG32_8_1_WGM16
    SolutionIndex: 6
    SolutionNameMin: Cijk_Ailk_Bjlk_HHS_BH_UserArgs_MT256x256x32_MI16x16x1_SN_GSU1_GSUC0_GSUWGMRR0_K1_LBSPPA2048_LPA0_LPB0_MIAV0_MIWT8_8_NTA1_NTB2_NTC5_NTD5_SS1_SU32_SUM0_SUS64_SPO1_SVW8_VWA8_VWB8_WG32_8_1_WGM32
    SolutionIndex: 7
    SolutionNameMin: Cijk_Ailk_Bjlk_HHS_BH_UserArgs_MT256x256x32_MI16x16x1_SN_GSU1_GSUC0_GSUWGMRR0_K1_LBSPPA2048_LPA0_LPB0_MIAV0_MIWT8_8_NTA0_NTB3_NTC1_NTD1_SS1_SU32_SUM0_SUS64_SPO1_SVW8_VWA8_VWB8_WG32_8_1_WGM16
    SolutionIndex: 8
    SolutionNameMin: Cijk_Ailk_Bjlk_HHS_BH_UserArgs_MT256x256x32_MI16x16x1_SN_GSU1_GSUC0_GSUWGMRR0_K1_LBSPPA2048_LPA0_LPB0_MIAV0_MIWT8_8_NTA2_NTB1_NTC4_NTD4_SS1_SU32_SUM0_SUS64_SPO1_SVW8_VWA8_VWB8_WG32_8_1_WGM1
    SolutionIndex: 9
    SolutionNameMin: Cijk_Ailk_Bjlk_HHS_BH_UserArgs_MT256x256x32_MI16x16x1_SN_GSU1_GSUC0_GSUWGMRR0_K1_LBSPPA2048_LPA0_LPB0_MIAV0_MIWT8_8_NTA3_NTB3_NTC4_NTD4_SS1_SU32_SUM0_SUS64_SPO1_SVW8_VWA8_VWB8_WG32_8_1_WGMn8
    SolutionIndex: 10
    SolutionNameMin: Cijk_Ailk_Bjlk_HHS_BH_UserArgs_MT256x256x32_MI16x16x1_SN_GSU1_GSUC0_GSUWGMRR0_K1_LBSPPA2048_LPA0_LPB0_MIAV0_MIWT8_8_NTA2_NTB3_NTC4_NTD4_SS1_SU32_SUM0_SUS64_SPO1_SVW8_VWA8_VWB8_WG32_8_1_WGM16
    SolutionIndex: 11
    SolutionNameMin: Cijk_Ailk_Bjlk_HHS_BH_UserArgs_MT256x64x32_MI16x16x1_SN_LDSB1_GRVWB8_GSU1_GSUC0_GSUWGMRR0_K1_LBSPPA2048_LBSPPB512_LPA0_LPB0_MIAV1_MIWT4_4_NLCA1_NLCB1_SS1_SU0_SUM0_SUS0_SVW4_VWA4_VWB4_WG64_4_1_WGM1
    SolutionIndex: 12
    SolutionNameMin: Cijk_Ailk_Bjlk_HHS_BH_UserArgs_MT64x192x32_MI16x16x1_SN_LDSB1_GRVWB8_GSU1_GSUC0_GSUWGMRR0_K1_LBSPPA512_LBSPPB1536_LPA0_LPB16_MIAV1_MIWT4_3_NLCA1_NLCB3_SS1_SU0_SUM0_SUS0_SVW4_VWA4_VWB1_WG16_16_1_WGM1
    SolutionIndex: 13
    SolutionNameMin: Cijk_Ailk_Bjlk_HHS_BH_UserArgs_MT32x64x64_MI16x16x1_SN_GSU1_GSUC0_GSUWGMRR0_K1_LBSPPA256_LBSPPB512_LPA32_LPB16_MIWT2_1_NLCA1_NLCB1_SU0_SUM0_SUS0_SVW2_VWA2_VWB1_WG16_16_1_WGM1
- - - [512, 512, 1, 512]
    - [0, 0.0]
  - - [1024, 1024, 1, 1024]
    - [3, 0.0]
  - - [2048, 2048, 1, 2048]
    - [3, 0.0]
  - - [4096, 4096, 1, 4096]
    - [1, 0.0]
  - - [4096, 4096, 1, 8192]
    - [2, 0.0]
  - - [8192, 8192, 1, 8192]
    - [1, 0.0]
  - - [1024, 8192, 1, 32768]
    - [4, 0.0]
  - - [11008, 4096, 1, 2048]
    - [5, 0.0]
  - - [11008, 4096, 1, 65536]
    - [5, 0.0]
  - - [32000, 4096, 1, 65536]
    - [6, 0.0]
  - - [32000, 8192, 1, 32768]
    - [7, 0.0]
  - - [4096, 12288, 1, 2048]
    - [8, 0.0]
  - - [4096, 32000, 1, 2048]
    - [9, 0.0]
  - - [4096, 4096, 1, 2048]
    - [10, 0.0]
  - - [8192, 8192, 1, 32768]
    - [5, 0.0]
  - - [11008, 4096, 1, 49152]
    - [5, 0.0]
  - - [32000, 4096, 1, 49152]
    - [10, 0.0]
  - - [28672, 8192, 1, 57344]
    - [7, 0.0]
  - - [8192, 8192, 1, 57344]
    - [5, 0.0]
  - - [1024, 8192, 1, 57344]
    - [4, 0.0]
  - - [32000, 8192, 1, 57344]
    - [7, 0.0]
  - - [178, 64, 6144, 178]
    - [11, 0.0]
  - - [178, 64, 5604, 178]
    - [11, 0.0]
  - - [64, 178, 6144, 178]
    - [12, 0.0]
  - - [64, 178, 5604, 178]
    - [12, 0.0]
  - - [768, 768, 1, 512]
    - [13, 0.0]
- 
- 
- DeviceEfficiency
- Equality
